tvm/matmul_(1,2048,1,256).log
{"input": ["cuda -keys=cuda,gpu -max_num_threads=1024 -thread_warp_size=32", "batch_matmul.cuda", [["TENSOR", [1, 2048, 256], "float32"], ["TENSOR", [1, 1, 256], "float32"]], {}], "config": {"index": 1429, "code_hash": null, "entity": [["tile_y", "sp", [-1, 4, 4]], ["tile_x", "sp", [-1, 1, 1]], ["tile_k", "sp", [-1, 1]], ["auto_unroll_max_step", "ot", 32], ["unroll_explicit", "ot", 0]]}, "result": [[4.6957187044745054e-05], 0, 1.7551767826080322, 1595315356.6618626], "version": 0.2, "tvm_version": "0.7.dev1"}
{"input": ["cuda -keys=cuda,gpu -max_num_threads=1024 -thread_warp_size=32", "batch_matmul.cuda", [["TENSOR", [1, 2048, 256], "float32"], ["TENSOR", [1, 1, 256], "float32"]], {}], "config": {"index": 1489, "code_hash": null, "entity": [["tile_y", "sp", [-1, 128, 1]], ["tile_x", "sp", [-1, 1, 1]], ["tile_k", "sp", [-1, 2]], ["auto_unroll_max_step", "ot", 32], ["unroll_explicit", "ot", 0]]}, "result": [[3.060133161128176e-05], 0, 1.8805463314056396, 1595315358.1779342], "version": 0.2, "tvm_version": "0.7.dev1"}
{"input": ["cuda -keys=cuda,gpu -max_num_threads=1024 -thread_warp_size=32", "batch_matmul.cuda", [["TENSOR", [1, 2048, 256], "float32"], ["TENSOR", [1, 1, 256], "float32"]], {}], "config": {"index": 2213, "code_hash": null, "entity": [["tile_y", "sp", [-1, 64, 4]], ["tile_x", "sp", [-1, 1, 1]], ["tile_k", "sp", [-1, 2]], ["auto_unroll_max_step", "ot", 64], ["unroll_explicit", "ot", 0]]}, "result": [[7.778925363756613e-05], 0, 1.8644938468933105, 1595315359.6980226], "version": 0.2, "tvm_version": "0.7.dev1"}
{"input": ["cuda -keys=cuda,gpu -max_num_threads=1024 -thread_warp_size=32", "batch_matmul.cuda", [["TENSOR", [1, 2048, 256], "float32"], ["TENSOR", [1, 1, 256], "float32"]], {}], "config": {"index": 409, "code_hash": null, "entity": [["tile_y", "sp", [-1, 128, 2]], ["tile_x", "sp", [-1, 1, 1]], ["tile_k", "sp", [-1, 32]], ["auto_unroll_max_step", "ot", 8], ["unroll_explicit", "ot", 0]]}, "result": [[3.175050729822553e-05], 0, 1.9916443824768066, 1595315361.2833426], "version": 0.2, "tvm_version": "0.7.dev1"}
{"input": ["cuda -keys=cuda,gpu -max_num_threads=1024 -thread_warp_size=32", "batch_matmul.cuda", [["TENSOR", [1, 2048, 256], "float32"], ["TENSOR", [1, 1, 256], "float32"]], {}], "config": {"index": 2531, "code_hash": null, "entity": [["tile_y", "sp", [-1, 4, 8]], ["tile_x", "sp", [-1, 1, 1]], ["tile_k", "sp", [-1, 32]], ["auto_unroll_max_step", "ot", 64], ["unroll_explicit", "ot", 0]]}, "result": [[3.6028279949157925e-05], 0, 1.9190475940704346, 1595315362.9307923], "version": 0.2, "tvm_version": "0.7.dev1"}
{"input": ["cuda -keys=cuda,gpu -max_num_threads=1024 -thread_warp_size=32", "batch_matmul.cuda", [["TENSOR", [1, 2048, 256], "float32"], ["TENSOR", [1, 1, 256], "float32"]], {}], "config": {"index": 4514, "code_hash": null, "entity": [["tile_y", "sp", [-1, 1, 256]], ["tile_x", "sp", [-1, 1, 1]], ["tile_k", "sp", [-1, 8]], ["auto_unroll_max_step", "ot", 32], ["unroll_explicit", "ot", 1]]}, "result": [[0.0022350115294117647], 0, 1.9572644233703613, 1595315364.2675548], "version": 0.2, "tvm_version": "0.7.dev1"}
{"input": ["cuda -keys=cuda,gpu -max_num_threads=1024 -thread_warp_size=32", "batch_matmul.cuda", [["TENSOR", [1, 2048, 256], "float32"], ["TENSOR", [1, 1, 256], "float32"]], {}], "config": {"index": 3809, "code_hash": null, "entity": [["tile_y", "sp", [-1, 4, 128]], ["tile_x", "sp", [-1, 1, 1]], ["tile_k", "sp", [-1, 8]], ["auto_unroll_max_step", "ot", 16], ["unroll_explicit", "ot", 1]]}, "result": [[0.0007226253532934131], 0, 2.1350104808807373, 1595315365.8067086], "version": 0.2, "tvm_version": "0.7.dev1"}
{"input": ["cuda -keys=cuda,gpu -max_num_threads=1024 -thread_warp_size=32", "batch_matmul.cuda", [["TENSOR", [1, 2048, 256], "float32"], ["TENSOR", [1, 1, 256], "float32"]], {}], "config": {"index": 2928, "code_hash": null, "entity": [["tile_y", "sp", [-1, 1, 16]], ["tile_x", "sp", [-1, 1, 1]], ["tile_k", "sp", [-1, 2]], ["auto_unroll_max_step", "ot", 8], ["unroll_explicit", "ot", 1]]}, "result": [[0.00013012684178941627], 0, 1.8091042041778564, 1595315367.4671865], "version": 0.2, "tvm_version": "0.7.dev1"}
{"input": ["cuda -keys=cuda,gpu -max_num_threads=1024 -thread_warp_size=32", "batch_matmul.cuda", [["TENSOR", [1, 2048, 256], "float32"], ["TENSOR", [1, 1, 256], "float32"]], {}], "config": {"index": 1579, "code_hash": null, "entity": [["tile_y", "sp", [-1, 128, 2]], ["tile_x", "sp", [-1, 1, 1]], ["tile_k", "sp", [-1, 4]], ["auto_unroll_max_step", "ot", 32], ["unroll_explicit", "ot", 0]]}, "result": [[3.8376108070900014e-05], 0, 1.8679263591766357, 1595315368.9260669], "version": 0.2, "tvm_version": "0.7.dev1"}
{"input": ["cuda -keys=cuda,gpu -max_num_threads=1024 -thread_warp_size=32", "batch_matmul.cuda", [["TENSOR", [1, 2048, 256], "float32"], ["TENSOR", [1, 1, 256], "float32"]], {}], "config": {"index": 2653, "code_hash": null, "entity": [["tile_y", "sp", [-1, 2, 1]], ["tile_x", "sp", [-1, 1, 1]], ["tile_k", "sp", [-1, 128]], ["auto_unroll_max_step", "ot", 64], ["unroll_explicit", "ot", 0]]}, "result": [[3.2033070088845016e-05], 0, 1.94972825050354, 1595315370.3713677], "version": 0.2, "tvm_version": "0.7.dev1"}
{"input": ["cuda -keys=cuda,gpu -max_num_threads=1024 -thread_warp_size=32", "batch_matmul.cuda", [["TENSOR", [1, 2048, 256], "float32"], ["TENSOR", [1, 1, 256], "float32"]], {}], "config": {"index": 2817, "code_hash": null, "entity": [["tile_y", "sp", [-1, 512, 1]], ["tile_x", "sp", [-1, 1, 1]], ["tile_k", "sp", [-1, 1]], ["auto_unroll_max_step", "ot", 8], ["unroll_explicit", "ot", 1]]}, "result": [[7.719397710922172e-05], 0, 1.851247787475586, 1595315371.9470987], "version": 0.2, "tvm_version": "0.7.dev1"}
{"input": ["cuda -keys=cuda,gpu -max_num_threads=1024 -thread_warp_size=32", "batch_matmul.cuda", [["TENSOR", [1, 2048, 256], "float32"], ["TENSOR", [1, 1, 256], "float32"]], {}], "config": {"index": 1041, "code_hash": null, "entity": [["tile_y", "sp", [-1, 16, 4]], ["tile_x", "sp", [-1, 1, 1]], ["tile_k", "sp", [-1, 16]], ["auto_unroll_max_step", "ot", 16], ["unroll_explicit", "ot", 0]]}, "result": [[3.478927931087056e-05], 0, 1.9729259014129639, 1595315373.4053185], "version": 0.2, "tvm_version": "0.7.dev1"}
{"input": ["cuda -keys=cuda,gpu -max_num_threads=1024 -thread_warp_size=32", "batch_matmul.cuda", [["TENSOR", [1, 2048, 256], "float32"], ["TENSOR", [1, 1, 256], "float32"]], {}], "config": {"index": 4099, "code_hash": null, "entity": [["tile_y", "sp", [-1, 2, 16]], ["tile_x", "sp", [-1, 1, 1]], ["tile_k", "sp", [-1, 128]], ["auto_unroll_max_step", "ot", 16], ["unroll_explicit", "ot", 1]]}, "result": [[9.695165944399019e-05], 0, 1.9010212421417236, 1595315374.8819497], "version": 0.2, "tvm_version": "0.7.dev1"}
{"input": ["cuda -keys=cuda,gpu -max_num_threads=1024 -thread_warp_size=32", "batch_matmul.cuda", [["TENSOR", [1, 2048, 256], "float32"], ["TENSOR", [1, 1, 256], "float32"]], {}], "config": {"index": 562, "code_hash": null, "entity": [["tile_y", "sp", [-1, 16, 2]], ["tile_x", "sp", [-1, 1, 1]], ["tile_k", "sp", [-1, 128]], ["auto_unroll_max_step", "ot", 8], ["unroll_explicit", "ot", 0]]}, "result": [[2.0696328243550836e-05], 0, 2.0877203941345215, 1595315376.5716393], "version": 0.2, "tvm_version": "0.7.dev1"}
{"input": ["cuda -keys=cuda,gpu -max_num_threads=1024 -thread_warp_size=32", "batch_matmul.cuda", [["TENSOR", [1, 2048, 256], "float32"], ["TENSOR", [1, 1, 256], "float32"]], {}], "config": {"index": 5439, "code_hash": null, "entity": [["tile_y", "sp", [-1, 1, 64]], ["tile_x", "sp", [-1, 1, 1]], ["tile_k", "sp", [-1, 64]], ["auto_unroll_max_step", "ot", 64], ["unroll_explicit", "ot", 1]]}, "result": [[0.0002620559617486339], 0, 2.1640055179595947, 1595315378.13422], "version": 0.2, "tvm_version": "0.7.dev1"}
{"input": ["cuda -keys=cuda,gpu -max_num_threads=1024 -thread_warp_size=32", "batch_matmul.cuda", [["TENSOR", [1, 2048, 256], "float32"], ["TENSOR", [1, 1, 256], "float32"]], {}], "config": {"index": 4493, "code_hash": null, "entity": [["tile_y", "sp", [-1, 32, 16]], ["tile_x", "sp", [-1, 1, 1]], ["tile_k", "sp", [-1, 8]], ["auto_unroll_max_step", "ot", 32], ["unroll_explicit", "ot", 1]]}, "result": [[0.00013038466868131867], 0, 2.042661666870117, 1595315379.6757486], "version": 0.2, "tvm_version": "0.7.dev1"}
{"input": ["cuda -keys=cuda,gpu -max_num_threads=1024 -thread_warp_size=32", "batch_matmul.cuda", [["TENSOR", [1, 2048, 256], "float32"], ["TENSOR", [1, 1, 256], "float32"]], {}], "config": {"index": 718, "code_hash": null, "entity": [["tile_y", "sp", [-1, 16, 2]], ["tile_x", "sp", [-1, 1, 1]], ["tile_k", "sp", [-1, 1]], ["auto_unroll_max_step", "ot", 16], ["unroll_explicit", "ot", 0]]}, "result": [[4.3910710347505336e-05], 0, 1.8912029266357422, 1595315381.2037628], "version": 0.2, "tvm_version": "0.7.dev1"}
{"input": ["cuda -keys=cuda,gpu -max_num_threads=1024 -thread_warp_size=32", "batch_matmul.cuda", [["TENSOR", [1, 2048, 256], "float32"], ["TENSOR", [1, 1, 256], "float32"]], {}], "config": {"index": 2882, "code_hash": null, "entity": [["tile_y", "sp", [-1, 4, 512]], ["tile_x", "sp", [-1, 1, 1]], ["tile_k", "sp", [-1, 1]], ["auto_unroll_max_step", "ot", 8], ["unroll_explicit", "ot", 1]]}, "result": [[0.004241061888888889], 0, 1.6143639087677002, 1595315382.3908346], "version": 0.2, "tvm_version": "0.7.dev1"}
{"input": ["cuda -keys=cuda,gpu -max_num_threads=1024 -thread_warp_size=32", "batch_matmul.cuda", [["TENSOR", [1, 2048, 256], "float32"], ["TENSOR", [1, 1, 256], "float32"]], {}], "config": {"index": 3543, "code_hash": null, "entity": [["tile_y", "sp", [-1, 1, 8]], ["tile_x", "sp", [-1, 1, 1]], ["tile_k", "sp", [-1, 1]], ["auto_unroll_max_step", "ot", 16], ["unroll_explicit", "ot", 1]]}, "result": [[6.259742659804984e-05], 0, 1.8423373699188232, 1595315383.8445039], "version": 0.2, "tvm_version": "0.7.dev1"}
{"input": ["cuda -keys=cuda,gpu -max_num_threads=1024 -thread_warp_size=32", "batch_matmul.cuda", [["TENSOR", [1, 2048, 256], "float32"], ["TENSOR", [1, 1, 256], "float32"]], {}], "config": {"index": 2297, "code_hash": null, "entity": [["tile_y", "sp", [-1, 4, 8]], ["tile_x", "sp", [-1, 1, 1]], ["tile_k", "sp", [-1, 4]], ["auto_unroll_max_step", "ot", 64], ["unroll_explicit", "ot", 0]]}, "result": [[4.901146430854464e-05], 0, 1.864598274230957, 1595315385.4353423], "version": 0.2, "tvm_version": "0.7.dev1"}
{"input": ["cuda -keys=cuda,gpu -max_num_threads=1024 -thread_warp_size=32", "batch_matmul.cuda", [["TENSOR", [1, 2048, 256], "float32"], ["TENSOR", [1, 1, 256], "float32"]], {}], "config": {"index": 3165, "code_hash": null, "entity": [["tile_y", "sp", [-1, 8, 16]], ["tile_x", "sp", [-1, 1, 1]], ["tile_k", "sp", [-1, 16]], ["auto_unroll_max_step", "ot", 8], ["unroll_explicit", "ot", 1]]}, "result": [[5.847937590783872e-05], 0, 1.9737217426300049, 1595315386.925814], "version": 0.2, "tvm_version": "0.7.dev1"}
{"input": ["cuda -keys=cuda,gpu -max_num_threads=1024 -thread_warp_size=32", "batch_matmul.cuda", [["TENSOR", [1, 2048, 256], "float32"], ["TENSOR", [1, 1, 256], "float32"]], {}], "config": {"index": 3103, "code_hash": null, "entity": [["tile_y", "sp", [-1, 16, 64]], ["tile_x", "sp", [-1, 1, 1]], ["tile_k", "sp", [-1, 8]], ["auto_unroll_max_step", "ot", 8], ["unroll_explicit", "ot", 1]]}, "result": [[0.0005761828], 0, 2.0296075344085693, 1595315388.4446344], "version": 0.2, "tvm_version": "0.7.dev1"}
{"input": ["cuda -keys=cuda,gpu -max_num_threads=1024 -thread_warp_size=32", "batch_matmul.cuda", [["TENSOR", [1, 2048, 256], "float32"], ["TENSOR", [1, 1, 256], "float32"]], {}], "config": {"index": 4022, "code_hash": null, "entity": [["tile_y", "sp", [-1, 4, 16]], ["tile_x", "sp", [-1, 1, 1]], ["tile_k", "sp", [-1, 64]], ["auto_unroll_max_step", "ot", 16], ["unroll_explicit", "ot", 1]]}, "result": [[6.034022712039185e-05], 0, 1.9400885105133057, 1595315390.0630026], "version": 0.2, "tvm_version": "0.7.dev1"}
{"input": ["cuda -keys=cuda,gpu -max_num_threads=1024 -thread_warp_size=32", "batch_matmul.cuda", [["TENSOR", [1, 2048, 256], "float32"], ["TENSOR", [1, 1, 256], "float32"]], {}], "config": {"index": 3784, "code_hash": null, "entity": [["tile_y", "sp", [-1, 128, 8]], ["tile_x", "sp", [-1, 1, 1]], ["tile_k", "sp", [-1, 8]], ["auto_unroll_max_step", "ot", 16], ["unroll_explicit", "ot", 1]]}, "result": [[0.00011794943034209222], 0, 1.9411866664886475, 1595315391.6175044], "version": 0.2, "tvm_version": "0.7.dev1"}
{"input": ["cuda -keys=cuda,gpu -max_num_threads=1024 -thread_warp_size=32", "batch_matmul.cuda", [["TENSOR", [1, 2048, 256], "float32"], ["TENSOR", [1, 1, 256], "float32"]], {}], "config": {"index": 2170, "code_hash": null, "entity": [["tile_y", "sp", [-1, 2, 128]], ["tile_x", "sp", [-1, 1, 1]], ["tile_k", "sp", [-1, 1]], ["auto_unroll_max_step", "ot", 64], ["unroll_explicit", "ot", 0]]}, "result": [[0.000558122837962963], 0, 2.159655809402466, 1595315393.2805529], "version": 0.2, "tvm_version": "0.7.dev1"}
{"input": ["cuda -keys=cuda,gpu -max_num_threads=1024 -thread_warp_size=32", "batch_matmul.cuda", [["TENSOR", [1, 2048, 256], "float32"], ["TENSOR", [1, 1, 256], "float32"]], {}], "config": {"index": 2062, "code_hash": null, "entity": [["tile_y", "sp", [-1, 2, 8]], ["tile_x", "sp", [-1, 1, 1]], ["tile_k", "sp", [-1, 256]], ["auto_unroll_max_step", "ot", 32], ["unroll_explicit", "ot", 0]]}, "result": [[3.211940340008644e-05], 0, 1.8755505084991455, 1595315394.7890892], "version": 0.2, "tvm_version": "0.7.dev1"}
{"input": ["cuda -keys=cuda,gpu -max_num_threads=1024 -thread_warp_size=32", "batch_matmul.cuda", [["TENSOR", [1, 2048, 256], "float32"], ["TENSOR", [1, 1, 256], "float32"]], {}], "config": {"index": 3205, "code_hash": null, "entity": [["tile_y", "sp", [-1, 128, 1]], ["tile_x", "sp", [-1, 1, 1]], ["tile_k", "sp", [-1, 32]], ["auto_unroll_max_step", "ot", 8], ["unroll_explicit", "ot", 1]]}, "result": [[1.831063535861945e-05], 0, 1.926058292388916, 1595315396.319991], "version": 0.2, "tvm_version": "0.7.dev1"}
{"input": ["cuda -keys=cuda,gpu -max_num_threads=1024 -thread_warp_size=32", "batch_matmul.cuda", [["TENSOR", [1, 2048, 256], "float32"], ["TENSOR", [1, 1, 256], "float32"]], {}], "config": {"index": 279, "code_hash": null, "entity": [["tile_y", "sp", [-1, 8, 16]], ["tile_x", "sp", [-1, 1, 1]], ["tile_k", "sp", [-1, 8]], ["auto_unroll_max_step", "ot", 8], ["unroll_explicit", "ot", 0]]}, "result": [[6.35266170963365e-05], 0, 1.9106202125549316, 1595315397.8051708], "version": 0.2, "tvm_version": "0.7.dev1"}
{"input": ["cuda -keys=cuda,gpu -max_num_threads=1024 -thread_warp_size=32", "batch_matmul.cuda", [["TENSOR", [1, 2048, 256], "float32"], ["TENSOR", [1, 1, 256], "float32"]], {}], "config": {"index": 4312, "code_hash": null, "entity": [["tile_y", "sp", [-1, 1024, 2]], ["tile_x", "sp", [-1, 1, 1]], ["tile_k", "sp", [-1, 2]], ["auto_unroll_max_step", "ot", 32], ["unroll_explicit", "ot", 1]]}, "result": [[0.0002738703894616266], 0, 1.9131803512573242, 1595315399.4032776], "version": 0.2, "tvm_version": "0.7.dev1"}
{"input": ["cuda -keys=cuda,gpu -max_num_threads=1024 -thread_warp_size=32", "batch_matmul.cuda", [["TENSOR", [1, 2048, 256], "float32"], ["TENSOR", [1, 1, 256], "float32"]], {}], "config": {"index": 3685, "code_hash": null, "entity": [["tile_y", "sp", [-1, 128, 2]], ["tile_x", "sp", [-1, 1, 1]], ["tile_k", "sp", [-1, 4]], ["auto_unroll_max_step", "ot", 16], ["unroll_explicit", "ot", 1]]}, "result": [[3.859540112035308e-05], 0, 2.162118673324585, 1595315401.07517], "version": 0.2, "tvm_version": "0.7.dev1"}
{"input": ["cuda -keys=cuda,gpu -max_num_threads=1024 -thread_warp_size=32", "batch_matmul.cuda", [["TENSOR", [1, 2048, 256], "float32"], ["TENSOR", [1, 1, 256], "float32"]], {}], "config": {"index": 2883, "code_hash": null, "entity": [["tile_y", "sp", [-1, 1, 1024]], ["tile_x", "sp", [-1, 1, 1]], ["tile_k", "sp", [-1, 1]], ["auto_unroll_max_step", "ot", 8], ["unroll_explicit", "ot", 1]]}, "result": [[0.007716278599999999], 0, 1.7088780403137207, 1595315402.3931177], "version": 0.2, "tvm_version": "0.7.dev1"}
{"input": ["cuda -keys=cuda,gpu -max_num_threads=1024 -thread_warp_size=32", "batch_matmul.cuda", [["TENSOR", [1, 2048, 256], "float32"], ["TENSOR", [1, 1, 256], "float32"]], {}], "config": {"index": 281, "code_hash": null, "entity": [["tile_y", "sp", [-1, 32, 16]], ["tile_x", "sp", [-1, 1, 1]], ["tile_k", "sp", [-1, 8]], ["auto_unroll_max_step", "ot", 8], ["unroll_explicit", "ot", 0]]}, "result": [[0.00013031718781442145], 0, 1.951935052871704, 1595315403.8746843], "version": 0.2, "tvm_version": "0.7.dev1"}
{"input": ["cuda -keys=cuda,gpu -max_num_threads=1024 -thread_warp_size=32", "batch_matmul.cuda", [["TENSOR", [1, 2048, 256], "float32"], ["TENSOR", [1, 1, 256], "float32"]], {}], "config": {"index": 1197, "code_hash": null, "entity": [["tile_y", "sp", [-1, 16, 4]], ["tile_x", "sp", [-1, 1, 1]], ["tile_k", "sp", [-1, 64]], ["auto_unroll_max_step", "ot", 16], ["unroll_explicit", "ot", 0]]}, "result": [[1.8825054664723032e-05], 0, 1.873351812362671, 1595315405.3253033], "version": 0.2, "tvm_version": "0.7.dev1"}
{"input": ["cuda -keys=cuda,gpu -max_num_threads=1024 -thread_warp_size=32", "batch_matmul.cuda", [["TENSOR", [1, 2048, 256], "float32"], ["TENSOR", [1, 1, 256], "float32"]], {}], "config": {"index": 3099, "code_hash": null, "entity": [["tile_y", "sp", [-1, 1, 64]], ["tile_x", "sp", [-1, 1, 1]], ["tile_k", "sp", [-1, 8]], ["auto_unroll_max_step", "ot", 8], ["unroll_explicit", "ot", 1]]}, "result": [[0.00012954664168490153], 0, 1.9956111907958984, 1595315406.9450958], "version": 0.2, "tvm_version": "0.7.dev1"}
{"input": ["cuda -keys=cuda,gpu -max_num_threads=1024 -thread_warp_size=32", "batch_matmul.cuda", [["TENSOR", [1, 2048, 256], "float32"], ["TENSOR", [1, 1, 256], "float32"]], {}], "config": {"index": 1675, "code_hash": null, "entity": [["tile_y", "sp", [-1, 16, 8]], ["tile_x", "sp", [-1, 1, 1]], ["tile_k", "sp", [-1, 8]], ["auto_unroll_max_step", "ot", 32], ["unroll_explicit", "ot", 0]]}, "result": [[5.89632947421638e-05], 0, 1.9295892715454102, 1595315408.4007733], "version": 0.2, "tvm_version": "0.7.dev1"}
{"input": ["cuda -keys=cuda,gpu -max_num_threads=1024 -thread_warp_size=32", "batch_matmul.cuda", [["TENSOR", [1, 2048, 256], "float32"], ["TENSOR", [1, 1, 256], "float32"]], {}], "config": {"index": 4519, "code_hash": null, "entity": [["tile_y", "sp", [-1, 2, 512]], ["tile_x", "sp", [-1, 1, 1]], ["tile_k", "sp", [-1, 8]], ["auto_unroll_max_step", "ot", 32], ["unroll_explicit", "ot", 1]]}, "result": [[0.004261804694444444], 0, 1.7550721168518066, 1595315409.677359], "version": 0.2, "tvm_version": "0.7.dev1"}
{"input": ["cuda -keys=cuda,gpu -max_num_threads=1024 -thread_warp_size=32", "batch_matmul.cuda", [["TENSOR", [1, 2048, 256], "float32"], ["TENSOR", [1, 1, 256], "float32"]], {}], "config": {"index": 980, "code_hash": null, "entity": [["tile_y", "sp", [-1, 4, 16]], ["tile_x", "sp", [-1, 1, 1]], ["tile_k", "sp", [-1, 8]], ["auto_unroll_max_step", "ot", 16], ["unroll_explicit", "ot", 0]]}, "result": [[6.621478459756804e-05], 0, 1.9196534156799316, 1595315411.223643], "version": 0.2, "tvm_version": "0.7.dev1"}
{"input": ["cuda -keys=cuda,gpu -max_num_threads=1024 -thread_warp_size=32", "batch_matmul.cuda", [["TENSOR", [1, 2048, 256], "float32"], ["TENSOR", [1, 1, 256], "float32"]], {}], "config": {"index": 4337, "code_hash": null, "entity": [["tile_y", "sp", [-1, 32, 16]], ["tile_x", "sp", [-1, 1, 1]], ["tile_k", "sp", [-1, 2]], ["auto_unroll_max_step", "ot", 32], ["unroll_explicit", "ot", 1]]}, "result": [[0.000205524789836348], 0, 1.853668212890625, 1595315412.7111456], "version": 0.2, "tvm_version": "0.7.dev1"}
{"input": ["cuda -keys=cuda,gpu -max_num_threads=1024 -thread_warp_size=32", "batch_matmul.cuda", [["TENSOR", [1, 2048, 256], "float32"], ["TENSOR", [1, 1, 256], "float32"]], {}], "config": {"index": 3936, "code_hash": null, "entity": [["tile_y", "sp", [-1, 8, 8]], ["tile_x", "sp", [-1, 1, 1]], ["tile_k", "sp", [-1, 32]], ["auto_unroll_max_step", "ot", 16], ["unroll_explicit", "ot", 1]]}, "result": [[4.585479672330097e-05], 0, 1.9937987327575684, 1595315414.362452], "version": 0.2, "tvm_version": "0.7.dev1"}
{"input": ["cuda -keys=cuda,gpu -max_num_threads=1024 -thread_warp_size=32", "batch_matmul.cuda", [["TENSOR", [1, 2048, 256], "float32"], ["TENSOR", [1, 1, 256], "float32"]], {}], "config": {"index": 640, "code_hash": null, "entity": [["tile_y", "sp", [-1, 16, 2]], ["tile_x", "sp", [-1, 1, 1]], ["tile_k", "sp", [-1, 256]], ["auto_unroll_max_step", "ot", 8], ["unroll_explicit", "ot", 0]]}, "result": [[2.9563109464810322e-05], 0, 1.8652608394622803, 1595315415.8180182], "version": 0.2, "tvm_version": "0.7.dev1"}
{"input": ["cuda -keys=cuda,gpu -max_num_threads=1024 -thread_warp_size=32", "batch_matmul.cuda", [["TENSOR", [1, 2048, 256], "float32"], ["TENSOR", [1, 1, 256], "float32"]], {}], "config": {"index": 979, "code_hash": null, "entity": [["tile_y", "sp", [-1, 2, 16]], ["tile_x", "sp", [-1, 1, 1]], ["tile_k", "sp", [-1, 8]], ["auto_unroll_max_step", "ot", 16], ["unroll_explicit", "ot", 0]]}, "result": [[5.545778733572282e-05], 0, 1.8692188262939453, 1595315417.3651047], "version": 0.2, "tvm_version": "0.7.dev1"}
{"input": ["cuda -keys=cuda,gpu -max_num_threads=1024 -thread_warp_size=32", "batch_matmul.cuda", [["TENSOR", [1, 2048, 256], "float32"], ["TENSOR", [1, 1, 256], "float32"]], {}], "config": {"index": 3555, "code_hash": null, "entity": [["tile_y", "sp", [-1, 8, 16]], ["tile_x", "sp", [-1, 1, 1]], ["tile_k", "sp", [-1, 1]], ["auto_unroll_max_step", "ot", 16], ["unroll_explicit", "ot", 1]]}, "result": [[8.504098052650558e-05], 0, 2.179015874862671, 1595315418.8857157], "version": 0.2, "tvm_version": "0.7.dev1"}
{"input": ["cuda -keys=cuda,gpu -max_num_threads=1024 -thread_warp_size=32", "batch_matmul.cuda", [["TENSOR", [1, 2048, 256], "float32"], ["TENSOR", [1, 1, 256], "float32"]], {}], "config": {"index": 1829, "code_hash": null, "entity": [["tile_y", "sp", [-1, 4, 8]], ["tile_x", "sp", [-1, 1, 1]], ["tile_k", "sp", [-1, 32]], ["auto_unroll_max_step", "ot", 32], ["unroll_explicit", "ot", 0]]}, "result": [[3.617761350277999e-05], 0, 1.772787094116211, 1595315420.3104258], "version": 0.2, "tvm_version": "0.7.dev1"}
{"input": ["cuda -keys=cuda,gpu -max_num_threads=1024 -thread_warp_size=32", "batch_matmul.cuda", [["TENSOR", [1, 2048, 256], "float32"], ["TENSOR", [1, 1, 256], "float32"]], {}], "config": {"index": 1486, "code_hash": null, "entity": [["tile_y", "sp", [-1, 16, 1]], ["tile_x", "sp", [-1, 1, 1]], ["tile_k", "sp", [-1, 2]], ["auto_unroll_max_step", "ot", 32], ["unroll_explicit", "ot", 0]]}, "result": [[2.743151916687963e-05], 0, 1.7145888805389404, 1595315421.7343302], "version": 0.2, "tvm_version": "0.7.dev1"}
{"input": ["cuda -keys=cuda,gpu -max_num_threads=1024 -thread_warp_size=32", "batch_matmul.cuda", [["TENSOR", [1, 2048, 256], "float32"], ["TENSOR", [1, 1, 256], "float32"]], {}], "config": {"index": 909, "code_hash": null, "entity": [["tile_y", "sp", [-1, 2, 32]], ["tile_x", "sp", [-1, 1, 1]], ["tile_k", "sp", [-1, 4]], ["auto_unroll_max_step", "ot", 16], ["unroll_explicit", "ot", 0]]}, "result": [[9.586798599093531e-05], 0, 2.1275782585144043, 1595315423.3879018], "version": 0.2, "tvm_version": "0.7.dev1"}
{"input": ["cuda -keys=cuda,gpu -max_num_threads=1024 -thread_warp_size=32", "batch_matmul.cuda", [["TENSOR", [1, 2048, 256], "float32"], ["TENSOR", [1, 1, 256], "float32"]], {}], "config": {"index": 3631, "code_hash": null, "entity": [["tile_y", "sp", [-1, 2, 16]], ["tile_x", "sp", [-1, 1, 1]], ["tile_k", "sp", [-1, 2]], ["auto_unroll_max_step", "ot", 16], ["unroll_explicit", "ot", 1]]}, "result": [[8.635444576659038e-05], 0, 1.8499934673309326, 1595316518.3609767], "version": 0.2, "tvm_version": "0.7.dev1"}
{"input": ["cuda -keys=cuda,gpu -max_num_threads=1024 -thread_warp_size=32", "batch_matmul.cuda", [["TENSOR", [1, 2048, 256], "float32"], ["TENSOR", [1, 1, 256], "float32"]], {}], "config": {"index": 3855, "code_hash": null, "entity": [["tile_y", "sp", [-1, 1, 8]], ["tile_x", "sp", [-1, 1, 1]], ["tile_k", "sp", [-1, 16]], ["auto_unroll_max_step", "ot", 16], ["unroll_explicit", "ot", 1]]}, "result": [[4.991268851380973e-05], 0, 2.0956857204437256, 1595316520.1277306], "version": 0.2, "tvm_version": "0.7.dev1"}
{"input": ["cuda -keys=cuda,gpu -max_num_threads=1024 -thread_warp_size=32", "batch_matmul.cuda", [["TENSOR", [1, 2048, 256], "float32"], ["TENSOR", [1, 1, 256], "float32"]], {}], "config": {"index": 2896, "code_hash": null, "entity": [["tile_y", "sp", [-1, 1024, 1]], ["tile_x", "sp", [-1, 1, 1]], ["tile_k", "sp", [-1, 2]], ["auto_unroll_max_step", "ot", 8], ["unroll_explicit", "ot", 1]]}, "result": [[0.00010083914224690303], 0, 1.8432815074920654, 1595316521.665948], "version": 0.2, "tvm_version": "0.7.dev1"}
{"input": ["cuda -keys=cuda,gpu -max_num_threads=1024 -thread_warp_size=32", "batch_matmul.cuda", [["TENSOR", [1, 2048, 256], "float32"], ["TENSOR", [1, 1, 256], "float32"]], {}], "config": {"index": 5268, "code_hash": null, "entity": [["tile_y", "sp", [-1, 1, 16]], ["tile_x", "sp", [-1, 1, 1]], ["tile_k", "sp", [-1, 16]], ["auto_unroll_max_step", "ot", 64], ["unroll_explicit", "ot", 1]]}, "result": [[6.648828798382439e-05], 0, 2.56886887550354, 1595316523.8962765], "version": 0.2, "tvm_version": "0.7.dev1"}
{"input": ["cuda -keys=cuda,gpu -max_num_threads=1024 -thread_warp_size=32", "batch_matmul.cuda", [["TENSOR", [1, 2048, 256], "float32"], ["TENSOR", [1, 1, 256], "float32"]], {}], "config": {"index": 4329, "code_hash": null, "entity": [["tile_y", "sp", [-1, 64, 8]], ["tile_x", "sp", [-1, 1, 1]], ["tile_k", "sp", [-1, 2]], ["auto_unroll_max_step", "ot", 32], ["unroll_explicit", "ot", 1]]}, "result": [[0.0001434808602540835], 0, 1.7996933460235596, 1595316525.4602873], "version": 0.2, "tvm_version": "0.7.dev1"}
{"input": ["cuda -keys=cuda,gpu -max_num_threads=1024 -thread_warp_size=32", "batch_matmul.cuda", [["TENSOR", [1, 2048, 256], "float32"], ["TENSOR", [1, 1, 256], "float32"]], {}], "config": {"index": 4244, "code_hash": null, "entity": [["tile_y", "sp", [-1, 512, 4]], ["tile_x", "sp", [-1, 1, 1]], ["tile_k", "sp", [-1, 1]], ["auto_unroll_max_step", "ot", 32], ["unroll_explicit", "ot", 1]]}, "result": [[0.0003156060879265092], 0, 1.8065085411071777, 1595316527.043072], "version": 0.2, "tvm_version": "0.7.dev1"}
{"input": ["cuda -keys=cuda,gpu -max_num_threads=1024 -thread_warp_size=32", "batch_matmul.cuda", [["TENSOR", [1, 2048, 256], "float32"], ["TENSOR", [1, 1, 256], "float32"]], {}], "config": {"index": 2597, "code_hash": null, "entity": [["tile_y", "sp", [-1, 1, 4]], ["tile_x", "sp", [-1, 1, 1]], ["tile_k", "sp", [-1, 64]], ["auto_unroll_max_step", "ot", 64], ["unroll_explicit", "ot", 0]]}, "result": [[4.95955592948718e-05], 0, 2.0688068866729736, 1595316896.579248], "version": 0.2, "tvm_version": "0.7.dev1"}
{"input": ["cuda -keys=cuda,gpu -max_num_threads=1024 -thread_warp_size=32", "batch_matmul.cuda", [["TENSOR", [1, 2048, 256], "float32"], ["TENSOR", [1, 1, 256], "float32"]], {}], "config": {"index": 3659, "code_hash": null, "entity": [["tile_y", "sp", [-1, 8, 256]], ["tile_x", "sp", [-1, 1, 1]], ["tile_k", "sp", [-1, 2]], ["auto_unroll_max_step", "ot", 16], ["unroll_explicit", "ot", 1]]}, "result": [[0.0025856161720430107], 0, 2.0204081535339355, 1595316898.201189], "version": 0.2, "tvm_version": "0.7.dev1"}
{"input": ["cuda -keys=cuda,gpu -max_num_threads=1024 -thread_warp_size=32", "batch_matmul.cuda", [["TENSOR", [1, 2048, 256], "float32"], ["TENSOR", [1, 1, 256], "float32"]], {}], "config": {"index": 5203, "code_hash": null, "entity": [["tile_y", "sp", [-1, 32, 32]], ["tile_x", "sp", [-1, 1, 1]], ["tile_k", "sp", [-1, 8]], ["auto_unroll_max_step", "ot", 64], ["unroll_explicit", "ot", 1]]}, "result": [[0.0005604281782407407], 0, 1.9614133834838867, 1595316899.835117], "version": 0.2, "tvm_version": "0.7.dev1"}
{"input": ["cuda -keys=cuda,gpu -max_num_threads=1024 -thread_warp_size=32", "batch_matmul.cuda", [["TENSOR", [1, 2048, 256], "float32"], ["TENSOR", [1, 1, 256], "float32"]], {}], "config": {"index": 93, "code_hash": null, "entity": [["tile_y", "sp", [-1, 8, 2]], ["tile_x", "sp", [-1, 1, 1]], ["tile_k", "sp", [-1, 2]], ["auto_unroll_max_step", "ot", 8], ["unroll_explicit", "ot", 0]]}, "result": [[3.8436812361277106e-05], 0, 1.8284425735473633, 1595316901.2935185], "version": 0.2, "tvm_version": "0.7.dev1"}
{"input": ["cuda -keys=cuda,gpu -max_num_threads=1024 -thread_warp_size=32", "batch_matmul.cuda", [["TENSOR", [1, 2048, 256], "float32"], ["TENSOR", [1, 1, 256], "float32"]], {}], "config": {"index": 4570, "code_hash": null, "entity": [["tile_y", "sp", [-1, 16, 16]], ["tile_x", "sp", [-1, 1, 1]], ["tile_k", "sp", [-1, 16]], ["auto_unroll_max_step", "ot", 32], ["unroll_explicit", "ot", 1]]}, "result": [[7.868323289518032e-05], 0, 1.9647095203399658, 1595316902.8150315], "version": 0.2, "tvm_version": "0.7.dev1"}
{"input": ["cuda -keys=cuda,gpu -max_num_threads=1024 -thread_warp_size=32", "batch_matmul.cuda", [["TENSOR", [1, 2048, 256], "float32"], ["TENSOR", [1, 1, 256], "float32"]], {}], "config": {"index": 5502, "code_hash": null, "entity": [["tile_y", "sp", [-1, 1, 16]], ["tile_x", "sp", [-1, 1, 1]], ["tile_k", "sp", [-1, 128]], ["auto_unroll_max_step", "ot", 64], ["unroll_explicit", "ot", 1]]}, "result": [[5.349400522565321e-05], 0, 2.066546678543091, 1595316904.3907924], "version": 0.2, "tvm_version": "0.7.dev1"}
{"input": ["cuda -keys=cuda,gpu -max_num_threads=1024 -thread_warp_size=32", "batch_matmul.cuda", [["TENSOR", [1, 2048, 256], "float32"], ["TENSOR", [1, 1, 256], "float32"]], {}], "config": {"index": 3735, "code_hash": null, "entity": [["tile_y", "sp", [-1, 2, 256]], ["tile_x", "sp", [-1, 1, 1]], ["tile_k", "sp", [-1, 4]], ["auto_unroll_max_step", "ot", 16], ["unroll_explicit", "ot", 1]]}, "result": [[0.0022022256521739133], 0, 1.689455270767212, 1595316905.5823762], "version": 0.2, "tvm_version": "0.7.dev1"}
{"input": ["cuda -keys=cuda,gpu -max_num_threads=1024 -thread_warp_size=32", "batch_matmul.cuda", [["TENSOR", [1, 2048, 256], "float32"], ["TENSOR", [1, 1, 256], "float32"]], {}], "config": {"index": 838, "code_hash": null, "entity": [["tile_y", "sp", [-1, 2, 64]], ["tile_x", "sp", [-1, 1, 1]], ["tile_k", "sp", [-1, 2]], ["auto_unroll_max_step", "ot", 16], ["unroll_explicit", "ot", 0]]}, "result": [[0.0001628835369357045], 0, 2.1635031700134277, 1595316907.1133344], "version": 0.2, "tvm_version": "0.7.dev1"}
{"input": ["cuda -keys=cuda,gpu -max_num_threads=1024 -thread_warp_size=32", "batch_matmul.cuda", [["TENSOR", [1, 2048, 256], "float32"], ["TENSOR", [1, 1, 256], "float32"]], {}], "config": {"index": 1623, "code_hash": null, "entity": [["tile_y", "sp", [-1, 1, 128]], ["tile_x", "sp", [-1, 1, 1]], ["tile_k", "sp", [-1, 4]], ["auto_unroll_max_step", "ot", 32], ["unroll_explicit", "ot", 0]]}, "result": [[0.0005204142780172414], 0, 2.368300199508667, 1595316908.946401], "version": 0.2, "tvm_version": "0.7.dev1"}
{"input": ["cuda -keys=cuda,gpu -max_num_threads=1024 -thread_warp_size=32", "batch_matmul.cuda", [["TENSOR", [1, 2048, 256], "float32"], ["TENSOR", [1, 1, 256], "float32"]], {}], "config": {"index": 4707, "code_hash": null, "entity": [["tile_y", "sp", [-1, 16, 4]], ["tile_x", "sp", [-1, 1, 1]], ["tile_k", "sp", [-1, 64]], ["auto_unroll_max_step", "ot", 32], ["unroll_explicit", "ot", 1]]}, "result": [[3.072868569829275e-05], 0, 1.929431438446045, 1595316910.4307163], "version": 0.2, "tvm_version": "0.7.dev1"}
{"input": ["cuda -keys=cuda,gpu -max_num_threads=1024 -thread_warp_size=32", "batch_matmul.cuda", [["TENSOR", [1, 2048, 256], "float32"], ["TENSOR", [1, 1, 256], "float32"]], {}], "config": {"index": 3132, "code_hash": null, "entity": [["tile_y", "sp", [-1, 1, 2]], ["tile_x", "sp", [-1, 1, 1]], ["tile_k", "sp", [-1, 16]], ["auto_unroll_max_step", "ot", 8], ["unroll_explicit", "ot", 1]]}, "result": [[3.88768941196465e-05], 0, 1.858870267868042, 1595316911.8845797], "version": 0.2, "tvm_version": "0.7.dev1"}
{"input": ["cuda -keys=cuda,gpu -max_num_threads=1024 -thread_warp_size=32", "batch_matmul.cuda", [["TENSOR", [1, 2048, 256], "float32"], ["TENSOR", [1, 1, 256], "float32"]], {}], "config": {"index": 2155, "code_hash": null, "entity": [["tile_y", "sp", [-1, 128, 16]], ["tile_x", "sp", [-1, 1, 1]], ["tile_k", "sp", [-1, 1]], ["auto_unroll_max_step", "ot", 64], ["unroll_explicit", "ot", 0]]}, "result": [[0.000375267746875], 0, 3.025285243988037, 1595316914.4454236], "version": 0.2, "tvm_version": "0.7.dev1"}
{"input": ["cuda -keys=cuda,gpu -max_num_threads=1024 -thread_warp_size=32", "batch_matmul.cuda", [["TENSOR", [1, 2048, 256], "float32"], ["TENSOR", [1, 1, 256], "float32"]], {}], "config": {"index": 3603, "code_hash": null, "entity": [["tile_y", "sp", [-1, 8, 2]], ["tile_x", "sp", [-1, 1, 1]], ["tile_k", "sp", [-1, 2]], ["auto_unroll_max_step", "ot", 16], ["unroll_explicit", "ot", 1]]}, "result": [[2.9877632063965307e-05], 0, 1.779109239578247, 1595316915.9253523], "version": 0.2, "tvm_version": "0.7.dev1"}
{"input": ["cuda -keys=cuda,gpu -max_num_threads=1024 -thread_warp_size=32", "batch_matmul.cuda", [["TENSOR", [1, 2048, 256], "float32"], ["TENSOR", [1, 1, 256], "float32"]], {}], "config": {"index": 5162, "code_hash": null, "entity": [["tile_y", "sp", [-1, 4, 2]], ["tile_x", "sp", [-1, 1, 1]], ["tile_k", "sp", [-1, 8]], ["auto_unroll_max_step", "ot", 64], ["unroll_explicit", "ot", 1]]}, "result": [[2.0738522217852932e-05], 0, 1.8793630599975586, 1595316917.3279083], "version": 0.2, "tvm_version": "0.7.dev1"}
{"input": ["cuda -keys=cuda,gpu -max_num_threads=1024 -thread_warp_size=32", "batch_matmul.cuda", [["TENSOR", [1, 2048, 256], "float32"], ["TENSOR", [1, 1, 256], "float32"]], {}], "config": {"index": 2542, "code_hash": null, "entity": [["tile_y", "sp", [-1, 16, 16]], ["tile_x", "sp", [-1, 1, 1]], ["tile_k", "sp", [-1, 32]], ["auto_unroll_max_step", "ot", 64], ["unroll_explicit", "ot", 0]]}, "result": [[0.00010203474382314693], 0, 1.9454092979431152, 1595316918.8280635], "version": 0.2, "tvm_version": "0.7.dev1"}
{"input": ["cuda -keys=cuda,gpu -max_num_threads=1024 -thread_warp_size=32", "batch_matmul.cuda", [["TENSOR", [1, 2048, 256], "float32"], ["TENSOR", [1, 1, 256], "float32"]], {}], "config": {"index": 3475, "code_hash": null, "entity": [["tile_y", "sp", [-1, 2, 16]], ["tile_x", "sp", [-1, 1, 1]], ["tile_k", "sp", [-1, 256]], ["auto_unroll_max_step", "ot", 8], ["unroll_explicit", "ot", 1]]}, "result": [[0.00010538491858325667], 0, 1.925297737121582, 1595316920.3714547], "version": 0.2, "tvm_version": "0.7.dev1"}
{"input": ["cuda -keys=cuda,gpu -max_num_threads=1024 -thread_warp_size=32", "batch_matmul.cuda", [["TENSOR", [1, 2048, 256], "float32"], ["TENSOR", [1, 1, 256], "float32"]], {}], "config": {"index": 2850, "code_hash": null, "entity": [["tile_y", "sp", [-1, 1, 16]], ["tile_x", "sp", [-1, 1, 1]], ["tile_k", "sp", [-1, 1]], ["auto_unroll_max_step", "ot", 8], ["unroll_explicit", "ot", 1]]}, "result": [[0.00011577291547911548], 0, 2.087003469467163, 1595316922.063684], "version": 0.2, "tvm_version": "0.7.dev1"}
{"input": ["cuda -keys=cuda,gpu -max_num_threads=1024 -thread_warp_size=32", "batch_matmul.cuda", [["TENSOR", [1, 2048, 256], "float32"], ["TENSOR", [1, 1, 256], "float32"]], {}], "config": {"index": 3221, "code_hash": null, "entity": [["tile_y", "sp", [-1, 1, 4]], ["tile_x", "sp", [-1, 1, 1]], ["tile_k", "sp", [-1, 32]], ["auto_unroll_max_step", "ot", 8], ["unroll_explicit", "ot", 1]]}, "result": [[4.762658531453819e-05], 0, 1.9572980403900146, 1595316923.6601965], "version": 0.2, "tvm_version": "0.7.dev1"}
{"input": ["cuda -keys=cuda,gpu -max_num_threads=1024 -thread_warp_size=32", "batch_matmul.cuda", [["TENSOR", [1, 2048, 256], "float32"], ["TENSOR", [1, 1, 256], "float32"]], {}], "config": {"index": 1592, "code_hash": null, "entity": [["tile_y", "sp", [-1, 512, 4]], ["tile_x", "sp", [-1, 1, 1]], ["tile_k", "sp", [-1, 4]], ["auto_unroll_max_step", "ot", 32], ["unroll_explicit", "ot", 0]]}, "result": [[0.00031799171409574467], 0, 1.9460160732269287, 1595316925.1699634], "version": 0.2, "tvm_version": "0.7.dev1"}
{"input": ["cuda -keys=cuda,gpu -max_num_threads=1024 -thread_warp_size=32", "batch_matmul.cuda", [["TENSOR", [1, 2048, 256], "float32"], ["TENSOR", [1, 1, 256], "float32"]], {}], "config": {"index": 3292, "code_hash": null, "entity": [["tile_y", "sp", [-1, 16, 2]], ["tile_x", "sp", [-1, 1, 1]], ["tile_k", "sp", [-1, 64]], ["auto_unroll_max_step", "ot", 8], ["unroll_explicit", "ot", 1]]}, "result": [[1.788507686645636e-05], 0, 1.829798698425293, 1595316926.5056138], "version": 0.2, "tvm_version": "0.7.dev1"}
{"input": ["cuda -keys=cuda,gpu -max_num_threads=1024 -thread_warp_size=32", "batch_matmul.cuda", [["TENSOR", [1, 2048, 256], "float32"], ["TENSOR", [1, 1, 256], "float32"]], {}], "config": {"index": 4217, "code_hash": null, "entity": [["tile_y", "sp", [-1, 32, 1]], ["tile_x", "sp", [-1, 1, 1]], ["tile_k", "sp", [-1, 1]], ["auto_unroll_max_step", "ot", 32], ["unroll_explicit", "ot", 1]]}, "result": [[4.4783517164330696e-05], 0, 1.9654464721679688, 1595316927.9992971], "version": 0.2, "tvm_version": "0.7.dev1"}
{"input": ["cuda -keys=cuda,gpu -max_num_threads=1024 -thread_warp_size=32", "batch_matmul.cuda", [["TENSOR", [1, 2048, 256], "float32"], ["TENSOR", [1, 1, 256], "float32"]], {}], "config": {"index": 1029, "code_hash": null, "entity": [["tile_y", "sp", [-1, 8, 2]], ["tile_x", "sp", [-1, 1, 1]], ["tile_k", "sp", [-1, 16]], ["auto_unroll_max_step", "ot", 16], ["unroll_explicit", "ot", 0]]}, "result": [[1.8480601509036674e-05], 0, 1.7965471744537354, 1595316929.3363085], "version": 0.2, "tvm_version": "0.7.dev1"}
{"input": ["cuda -keys=cuda,gpu -max_num_threads=1024 -thread_warp_size=32", "batch_matmul.cuda", [["TENSOR", [1, 2048, 256], "float32"], ["TENSOR", [1, 1, 256], "float32"]], {}], "config": {"index": 1759, "code_hash": null, "entity": [["tile_y", "sp", [-1, 2, 16]], ["tile_x", "sp", [-1, 1, 1]], ["tile_k", "sp", [-1, 16]], ["auto_unroll_max_step", "ot", 32], ["unroll_explicit", "ot", 0]]}, "result": [[5.0823652086587816e-05], 0, 1.9957914352416992, 1595316930.807527], "version": 0.2, "tvm_version": "0.7.dev1"}
{"input": ["cuda -keys=cuda,gpu -max_num_threads=1024 -thread_warp_size=32", "batch_matmul.cuda", [["TENSOR", [1, 2048, 256], "float32"], ["TENSOR", [1, 1, 256], "float32"]], {}], "config": {"index": 3944, "code_hash": null, "entity": [["tile_y", "sp", [-1, 4, 16]], ["tile_x", "sp", [-1, 1, 1]], ["tile_k", "sp", [-1, 32]], ["auto_unroll_max_step", "ot", 16], ["unroll_explicit", "ot", 1]]}, "result": [[0.0001000102073222648], 0, 1.9102656841278076, 1595316932.3114183], "version": 0.2, "tvm_version": "0.7.dev1"}
{"input": ["cuda -keys=cuda,gpu -max_num_threads=1024 -thread_warp_size=32", "batch_matmul.cuda", [["TENSOR", [1, 2048, 256], "float32"], ["TENSOR", [1, 1, 256], "float32"]], {}], "config": {"index": 2955, "code_hash": null, "entity": [["tile_y", "sp", [-1, 2, 256]], ["tile_x", "sp", [-1, 1, 1]], ["tile_k", "sp", [-1, 2]], ["auto_unroll_max_step", "ot", 8], ["unroll_explicit", "ot", 1]]}, "result": [[0.002215096588235294], 0, 1.6466412544250488, 1595316933.509768], "version": 0.2, "tvm_version": "0.7.dev1"}
{"input": ["cuda -keys=cuda,gpu -max_num_threads=1024 -thread_warp_size=32", "batch_matmul.cuda", [["TENSOR", [1, 2048, 256], "float32"], ["TENSOR", [1, 1, 256], "float32"]], {}], "config": {"index": 48, "code_hash": null, "entity": [["tile_y", "sp", [-1, 64, 16]], ["tile_x", "sp", [-1, 1, 1]], ["tile_k", "sp", [-1, 1]], ["auto_unroll_max_step", "ot", 8], ["unroll_explicit", "ot", 0]]}, "result": [[0.0002571696756176155], 0, 1.943356990814209, 1595316935.0210369], "version": 0.2, "tvm_version": "0.7.dev1"}
{"input": ["cuda -keys=cuda,gpu -max_num_threads=1024 -thread_warp_size=32", "batch_matmul.cuda", [["TENSOR", [1, 2048, 256], "float32"], ["TENSOR", [1, 1, 256], "float32"]], {}], "config": {"index": 990, "code_hash": null, "entity": [["tile_y", "sp", [-1, 16, 32]], ["tile_x", "sp", [-1, 1, 1]], ["tile_k", "sp", [-1, 8]], ["auto_unroll_max_step", "ot", 16], ["unroll_explicit", "ot", 0]]}, "result": [[0.0003689378113496932], 0, 1.9799087047576904, 1595316936.5415173], "version": 0.2, "tvm_version": "0.7.dev1"}
{"input": ["cuda -keys=cuda,gpu -max_num_threads=1024 -thread_warp_size=32", "batch_matmul.cuda", [["TENSOR", [1, 2048, 256], "float32"], ["TENSOR", [1, 1, 256], "float32"]], {}], "config": {"index": 1496, "code_hash": null, "entity": [["tile_y", "sp", [-1, 4, 2]], ["tile_x", "sp", [-1, 1, 1]], ["tile_k", "sp", [-1, 2]], ["auto_unroll_max_step", "ot", 32], ["unroll_explicit", "ot", 0]]}, "result": [[3.8077262869847785e-05], 0, 1.9130687713623047, 1595316937.988366], "version": 0.2, "tvm_version": "0.7.dev1"}
{"input": ["cuda -keys=cuda,gpu -max_num_threads=1024 -thread_warp_size=32", "batch_matmul.cuda", [["TENSOR", [1, 2048, 256], "float32"], ["TENSOR", [1, 1, 256], "float32"]], {}], "config": {"index": 3063, "code_hash": null, "entity": [["tile_y", "sp", [-1, 512, 2]], ["tile_x", "sp", [-1, 1, 1]], ["tile_k", "sp", [-1, 8]], ["auto_unroll_max_step", "ot", 8], ["unroll_explicit", "ot", 1]]}, "result": [[0.00015171476819059884], 0, 1.9458050727844238, 1595316939.4757855], "version": 0.2, "tvm_version": "0.7.dev1"}
{"input": ["cuda -keys=cuda,gpu -max_num_threads=1024 -thread_warp_size=32", "batch_matmul.cuda", [["TENSOR", [1, 2048, 256], "float32"], ["TENSOR", [1, 1, 256], "float32"]], {}], "config": {"index": 4783, "code_hash": null, "entity": [["tile_y", "sp", [-1, 4, 4]], ["tile_x", "sp", [-1, 1, 1]], ["tile_k", "sp", [-1, 128]], ["auto_unroll_max_step", "ot", 32], ["unroll_explicit", "ot", 1]]}, "result": [[2.2847607256037593e-05], 0, 1.879910945892334, 1595316940.9050238], "version": 0.2, "tvm_version": "0.7.dev1"}
{"input": ["cuda -keys=cuda,gpu -max_num_threads=1024 -thread_warp_size=32", "batch_matmul.cuda", [["TENSOR", [1, 2048, 256], "float32"], ["TENSOR", [1, 1, 256], "float32"]], {}], "config": {"index": 1884, "code_hash": null, "entity": [["tile_y", "sp", [-1, 1, 2]], ["tile_x", "sp", [-1, 1, 1]], ["tile_k", "sp", [-1, 64]], ["auto_unroll_max_step", "ot", 32], ["unroll_explicit", "ot", 0]]}, "result": [[4.2574427079377135e-05], 0, 1.946183681488037, 1595316942.4069648], "version": 0.2, "tvm_version": "0.7.dev1"}
{"input": ["cuda -keys=cuda,gpu -max_num_threads=1024 -thread_warp_size=32", "batch_matmul.cuda", [["TENSOR", [1, 2048, 256], "float32"], ["TENSOR", [1, 1, 256], "float32"]], {}], "config": {"index": 3683, "code_hash": null, "entity": [["tile_y", "sp", [-1, 32, 2]], ["tile_x", "sp", [-1, 1, 1]], ["tile_k", "sp", [-1, 4]], ["auto_unroll_max_step", "ot", 16], ["unroll_explicit", "ot", 1]]}, "result": [[3.699535612487275e-05], 0, 1.9235494136810303, 1595316943.860609], "version": 0.2, "tvm_version": "0.7.dev1"}
{"input": ["cuda -keys=cuda,gpu -max_num_threads=1024 -thread_warp_size=32", "batch_matmul.cuda", [["TENSOR", [1, 2048, 256], "float32"], ["TENSOR", [1, 1, 256], "float32"]], {}], "config": {"index": 907, "code_hash": null, "entity": [["tile_y", "sp", [-1, 128, 16]], ["tile_x", "sp", [-1, 1, 1]], ["tile_k", "sp", [-1, 4]], ["auto_unroll_max_step", "ot", 16], ["unroll_explicit", "ot", 0]]}, "result": [[0.00023716237537537536], 0, 1.8345377445220947, 1595316945.342999], "version": 0.2, "tvm_version": "0.7.dev1"}
{"input": ["cuda -keys=cuda,gpu -max_num_threads=1024 -thread_warp_size=32", "batch_matmul.cuda", [["TENSOR", [1, 2048, 256], "float32"], ["TENSOR", [1, 1, 256], "float32"]], {}], "config": {"index": 180, "code_hash": null, "entity": [["tile_y", "sp", [-1, 2, 4]], ["tile_x", "sp", [-1, 1, 1]], ["tile_k", "sp", [-1, 4]], ["auto_unroll_max_step", "ot", 8], ["unroll_explicit", "ot", 0]]}, "result": [[3.0571922485038474e-05], 0, 1.8789892196655273, 1595316946.77308], "version": 0.2, "tvm_version": "0.7.dev1"}
{"input": ["cuda -keys=cuda,gpu -max_num_threads=1024 -thread_warp_size=32", "batch_matmul.cuda", [["TENSOR", [1, 2048, 256], "float32"], ["TENSOR", [1, 1, 256], "float32"]], {}], "config": {"index": 972, "code_hash": null, "entity": [["tile_y", "sp", [-1, 8, 8]], ["tile_x", "sp", [-1, 1, 1]], ["tile_k", "sp", [-1, 8]], ["auto_unroll_max_step", "ot", 16], ["unroll_explicit", "ot", 0]]}, "result": [[5.131612864840593e-05], 0, 1.866898536682129, 1595316948.256993], "version": 0.2, "tvm_version": "0.7.dev1"}
{"input": ["cuda -keys=cuda,gpu -max_num_threads=1024 -thread_warp_size=32", "batch_matmul.cuda", [["TENSOR", [1, 2048, 256], "float32"], ["TENSOR", [1, 1, 256], "float32"]], {}], "config": {"index": 1273, "code_hash": null, "entity": [["tile_y", "sp", [-1, 4, 4]], ["tile_x", "sp", [-1, 1, 1]], ["tile_k", "sp", [-1, 128]], ["auto_unroll_max_step", "ot", 16], ["unroll_explicit", "ot", 0]]}, "result": [[2.3081560022148394e-05], 0, 1.9506049156188965, 1595316949.7916222], "version": 0.2, "tvm_version": "0.7.dev1"}
{"input": ["cuda -keys=cuda,gpu -max_num_threads=1024 -thread_warp_size=32", "batch_matmul.cuda", [["TENSOR", [1, 2048, 256], "float32"], ["TENSOR", [1, 1, 256], "float32"]], {}], "config": {"index": 2746, "code_hash": null, "entity": [["tile_y", "sp", [-1, 16, 2]], ["tile_x", "sp", [-1, 1, 1]], ["tile_k", "sp", [-1, 256]], ["auto_unroll_max_step", "ot", 64], ["unroll_explicit", "ot", 0]]}, "result": [[2.897292102746277e-05], 0, 1.815812587738037, 1595316951.1987047], "version": 0.2, "tvm_version": "0.7.dev1"}
{"input": ["cuda -keys=cuda,gpu -max_num_threads=1024 -thread_warp_size=32", "batch_matmul.cuda", [["TENSOR", [1, 2048, 256], "float32"], ["TENSOR", [1, 1, 256], "float32"]], {}], "config": {"index": 2200, "code_hash": null, "entity": [["tile_y", "sp", [-1, 16, 2]], ["tile_x", "sp", [-1, 1, 1]], ["tile_k", "sp", [-1, 2]], ["auto_unroll_max_step", "ot", 64], ["unroll_explicit", "ot", 0]]}, "result": [[4.051513298271976e-05], 0, 1.86079740524292, 1595316952.7820337], "version": 0.2, "tvm_version": "0.7.dev1"}
{"input": ["cuda -keys=cuda,gpu -max_num_threads=1024 -thread_warp_size=32", "batch_matmul.cuda", [["TENSOR", [1, 2048, 256], "float32"], ["TENSOR", [1, 1, 256], "float32"]], {}], "config": {"index": 3978, "code_hash": null, "entity": [["tile_y", "sp", [-1, 1, 1]], ["tile_x", "sp", [-1, 1, 1]], ["tile_k", "sp", [-1, 64]], ["auto_unroll_max_step", "ot", 16], ["unroll_explicit", "ot", 1]]}, "result": [[5.2083192896935935e-05], 0, 1.882627248764038, 1595316954.277044], "version": 0.2, "tvm_version": "0.7.dev1"}
{"input": ["cuda -keys=cuda,gpu -max_num_threads=1024 -thread_warp_size=32", "batch_matmul.cuda", [["TENSOR", [1, 2048, 256], "float32"], ["TENSOR", [1, 1, 256], "float32"]], {}], "config": {"index": 3013, "code_hash": null, "entity": [["tile_y", "sp", [-1, 128, 16]], ["tile_x", "sp", [-1, 1, 1]], ["tile_k", "sp", [-1, 4]], ["auto_unroll_max_step", "ot", 8], ["unroll_explicit", "ot", 1]]}, "result": [[0.00023997759738955823], 0, 1.8417513370513916, 1595316955.8937166], "version": 0.2, "tvm_version": "0.7.dev1"}
{"input": ["cuda -keys=cuda,gpu -max_num_threads=1024 -thread_warp_size=32", "batch_matmul.cuda", [["TENSOR", [1, 2048, 256], "float32"], ["TENSOR", [1, 1, 256], "float32"]], {}], "config": {"index": 3758, "code_hash": null, "entity": [["tile_y", "sp", [-1, 4, 2]], ["tile_x", "sp", [-1, 1, 1]], ["tile_k", "sp", [-1, 8]], ["auto_unroll_max_step", "ot", 16], ["unroll_explicit", "ot", 1]]}, "result": [[2.090087506668089e-05], 0, 1.7628042697906494, 1595316957.2478576], "version": 0.2, "tvm_version": "0.7.dev1"}
{"input": ["cuda -keys=cuda,gpu -max_num_threads=1024 -thread_warp_size=32", "batch_matmul.cuda", [["TENSOR", [1, 2048, 256], "float32"], ["TENSOR", [1, 1, 256], "float32"]], {}], "config": {"index": 3029, "code_hash": null, "entity": [["tile_y", "sp", [-1, 4, 128]], ["tile_x", "sp", [-1, 1, 1]], ["tile_k", "sp", [-1, 4]], ["auto_unroll_max_step", "ot", 8], ["unroll_explicit", "ot", 1]]}, "result": [[0.0007397879507692307], 0, 2.1447064876556396, 1595316958.9326787], "version": 0.2, "tvm_version": "0.7.dev1"}
{"input": ["cuda -keys=cuda,gpu -max_num_threads=1024 -thread_warp_size=32", "batch_matmul.cuda", [["TENSOR", [1, 2048, 256], "float32"], ["TENSOR", [1, 1, 256], "float32"]], {}], "config": {"index": 2337, "code_hash": null, "entity": [["tile_y", "sp", [-1, 1, 1024]], ["tile_x", "sp", [-1, 1, 1]], ["tile_k", "sp", [-1, 4]], ["auto_unroll_max_step", "ot", 64], ["unroll_explicit", "ot", 0]]}, "result": [[0.00802379552631579], 0, 2.0577938556671143, 1595316960.496464], "version": 0.2, "tvm_version": "0.7.dev1"}
{"input": ["cuda -keys=cuda,gpu -max_num_threads=1024 -thread_warp_size=32", "batch_matmul.cuda", [["TENSOR", [1, 2048, 256], "float32"], ["TENSOR", [1, 1, 256], "float32"]], {}], "config": {"index": 2942, "code_hash": null, "entity": [["tile_y", "sp", [-1, 64, 32]], ["tile_x", "sp", [-1, 1, 1]], ["tile_k", "sp", [-1, 2]], ["auto_unroll_max_step", "ot", 8], ["unroll_explicit", "ot", 1]]}, "result": [[0.0004629590809248555], 0, 1.8984134197235107, 1595316962.0059426], "version": 0.2, "tvm_version": "0.7.dev1"}
{"input": ["cuda -keys=cuda,gpu -max_num_threads=1024 -thread_warp_size=32", "batch_matmul.cuda", [["TENSOR", [1, 2048, 256], "float32"], ["TENSOR", [1, 1, 256], "float32"]], {}], "config": {"index": 558, "code_hash": null, "entity": [["tile_y", "sp", [-1, 1, 2]], ["tile_x", "sp", [-1, 1, 1]], ["tile_k", "sp", [-1, 128]], ["auto_unroll_max_step", "ot", 8], ["unroll_explicit", "ot", 0]]}, "result": [[4.158103887850467e-05], 0, 1.8792624473571777, 1595316963.5099306], "version": 0.2, "tvm_version": "0.7.dev1"}
{"input": ["cuda -keys=cuda,gpu -max_num_threads=1024 -thread_warp_size=32", "batch_matmul.cuda", [["TENSOR", [1, 2048, 256], "float32"], ["TENSOR", [1, 1, 256], "float32"]], {}], "config": {"index": 2487, "code_hash": null, "entity": [["tile_y", "sp", [-1, 2, 256]], ["tile_x", "sp", [-1, 1, 1]], ["tile_k", "sp", [-1, 16]], ["auto_unroll_max_step", "ot", 64], ["unroll_explicit", "ot", 0]]}, "result": [[0.0020868727916666667], 0, 1.496910572052002, 1595316964.6376746], "version": 0.2, "tvm_version": "0.7.dev1"}
{"input": ["cuda -keys=cuda,gpu -max_num_threads=1024 -thread_warp_size=32", "batch_matmul.cuda", [["TENSOR", [1, 2048, 256], "float32"], ["TENSOR", [1, 1, 256], "float32"]], {}], "config": {"index": 3600, "code_hash": null, "entity": [["tile_y", "sp", [-1, 1, 2]], ["tile_x", "sp", [-1, 1, 1]], ["tile_k", "sp", [-1, 2]], ["auto_unroll_max_step", "ot", 16], ["unroll_explicit", "ot", 1]]}, "result": [[5.8392405307910334e-05], 0, 2.028862953186035, 1595316966.095682], "version": 0.2, "tvm_version": "0.7.dev1"}
{"input": ["cuda -keys=cuda,gpu -max_num_threads=1024 -thread_warp_size=32", "batch_matmul.cuda", [["TENSOR", [1, 2048, 256], "float32"], ["TENSOR", [1, 1, 256], "float32"]], {}], "config": {"index": 1150, "code_hash": null, "entity": [["tile_y", "sp", [-1, 2, 64]], ["tile_x", "sp", [-1, 1, 1]], ["tile_k", "sp", [-1, 32]], ["auto_unroll_max_step", "ot", 16], ["unroll_explicit", "ot", 0]]}, "result": [[0.00016001182661290323], 0, 2.093599319458008, 1595316967.7034192], "version": 0.2, "tvm_version": "0.7.dev1"}
{"input": ["cuda -keys=cuda,gpu -max_num_threads=1024 -thread_warp_size=32", "batch_matmul.cuda", [["TENSOR", [1, 2048, 256], "float32"], ["TENSOR", [1, 1, 256], "float32"]], {}], "config": {"index": 667, "code_hash": null, "entity": [["tile_y", "sp", [-1, 2, 16]], ["tile_x", "sp", [-1, 1, 1]], ["tile_k", "sp", [-1, 256]], ["auto_unroll_max_step", "ot", 8], ["unroll_explicit", "ot", 0]]}, "result": [[0.00010616771794871795], 0, 1.9822955131530762, 1595316969.2029629], "version": 0.2, "tvm_version": "0.7.dev1"}
{"input": ["cuda -keys=cuda,gpu -max_num_threads=1024 -thread_warp_size=32", "batch_matmul.cuda", [["TENSOR", [1, 2048, 256], "float32"], ["TENSOR", [1, 1, 256], "float32"]], {}], "config": {"index": 3107, "code_hash": null, "entity": [["tile_y", "sp", [-1, 4, 128]], ["tile_x", "sp", [-1, 1, 1]], ["tile_k", "sp", [-1, 8]], ["auto_unroll_max_step", "ot", 8], ["unroll_explicit", "ot", 1]]}, "result": [[0.0007319185151515151], 0, 2.240212917327881, 1595316970.7799163], "version": 0.2, "tvm_version": "0.7.dev1"}
{"input": ["cuda -keys=cuda,gpu -max_num_threads=1024 -thread_warp_size=32", "batch_matmul.cuda", [["TENSOR", [1, 2048, 256], "float32"], ["TENSOR", [1, 1, 256], "float32"]], {}], "config": {"index": 3355, "code_hash": null, "entity": [["tile_y", "sp", [-1, 2, 1]], ["tile_x", "sp", [-1, 1, 1]], ["tile_k", "sp", [-1, 128]], ["auto_unroll_max_step", "ot", 8], ["unroll_explicit", "ot", 1]]}, "result": [[3.227098867924528e-05], 0, 1.8496179580688477, 1595316972.1388307], "version": 0.2, "tvm_version": "0.7.dev1"}
{"input": ["cuda -keys=cuda,gpu -max_num_threads=1024 -thread_warp_size=32", "batch_matmul.cuda", [["TENSOR", [1, 2048, 256], "float32"], ["TENSOR", [1, 1, 256], "float32"]], {}], "config": {"index": 2384, "code_hash": null, "entity": [["tile_y", "sp", [-1, 4, 16]], ["tile_x", "sp", [-1, 1, 1]], ["tile_k", "sp", [-1, 8]], ["auto_unroll_max_step", "ot", 64], ["unroll_explicit", "ot", 0]]}, "result": [[6.691702807328606e-05], 0, 1.9956021308898926, 1595316973.614686], "version": 0.2, "tvm_version": "0.7.dev1"}
{"input": ["cuda -keys=cuda,gpu -max_num_threads=1024 -thread_warp_size=32", "batch_matmul.cuda", [["TENSOR", [1, 2048, 256], "float32"], ["TENSOR", [1, 1, 256], "float32"]], {}], "config": {"index": 3891, "code_hash": null, "entity": [["tile_y", "sp", [-1, 2, 256]], ["tile_x", "sp", [-1, 1, 1]], ["tile_k", "sp", [-1, 16]], ["auto_unroll_max_step", "ot", 16], ["unroll_explicit", "ot", 1]]}, "result": [[0.0022612446119402983], 0, 1.603264570236206, 1595316974.7623003], "version": 0.2, "tvm_version": "0.7.dev1"}
{"input": ["cuda -keys=cuda,gpu -max_num_threads=1024 -thread_warp_size=32", "batch_matmul.cuda", [["TENSOR", [1, 2048, 256], "float32"], ["TENSOR", [1, 1, 256], "float32"]], {}], "config": {"index": 3703, "code_hash": null, "entity": [["tile_y", "sp", [-1, 16, 8]], ["tile_x", "sp", [-1, 1, 1]], ["tile_k", "sp", [-1, 4]], ["auto_unroll_max_step", "ot", 16], ["unroll_explicit", "ot", 1]]}, "result": [[6.201525463834365e-05], 0, 1.8775629997253418, 1595316976.2499015], "version": 0.2, "tvm_version": "0.7.dev1"}
{"input": ["cuda -keys=cuda,gpu -max_num_threads=1024 -thread_warp_size=32", "batch_matmul.cuda", [["TENSOR", [1, 2048, 256], "float32"], ["TENSOR", [1, 1, 256], "float32"]], {}], "config": {"index": 4539, "code_hash": null, "entity": [["tile_y", "sp", [-1, 8, 2]], ["tile_x", "sp", [-1, 1, 1]], ["tile_k", "sp", [-1, 16]], ["auto_unroll_max_step", "ot", 32], ["unroll_explicit", "ot", 1]]}, "result": [[2.0423528440574465e-05], 0, 1.725205898284912, 1595316991.419798], "version": 0.2, "tvm_version": "0.7.dev1"}
{"input": ["cuda -keys=cuda,gpu -max_num_threads=1024 -thread_warp_size=32", "batch_matmul.cuda", [["TENSOR", [1, 2048, 256], "float32"], ["TENSOR", [1, 1, 256], "float32"]], {}], "config": {"index": 5241, "code_hash": null, "entity": [["tile_y", "sp", [-1, 8, 2]], ["tile_x", "sp", [-1, 1, 1]], ["tile_k", "sp", [-1, 16]], ["auto_unroll_max_step", "ot", 64], ["unroll_explicit", "ot", 1]]}, "result": [[1.8318168963943405e-05], 0, 1.6792404651641846, 1595316992.6978927], "version": 0.2, "tvm_version": "0.7.dev1"}
{"input": ["cuda -keys=cuda,gpu -max_num_threads=1024 -thread_warp_size=32", "batch_matmul.cuda", [["TENSOR", [1, 2048, 256], "float32"], ["TENSOR", [1, 1, 256], "float32"]], {}], "config": {"index": 3837, "code_hash": null, "entity": [["tile_y", "sp", [-1, 8, 2]], ["tile_x", "sp", [-1, 1, 1]], ["tile_k", "sp", [-1, 16]], ["auto_unroll_max_step", "ot", 16], ["unroll_explicit", "ot", 1]]}, "result": [[1.831582031180401e-05], 0, 2.006859302520752, 1595316994.2704725], "version": 0.2, "tvm_version": "0.7.dev1"}
{"input": ["cuda -keys=cuda,gpu -max_num_threads=1024 -thread_warp_size=32", "batch_matmul.cuda", [["TENSOR", [1, 2048, 256], "float32"], ["TENSOR", [1, 1, 256], "float32"]], {}], "config": {"index": 3135, "code_hash": null, "entity": [["tile_y", "sp", [-1, 8, 2]], ["tile_x", "sp", [-1, 1, 1]], ["tile_k", "sp", [-1, 16]], ["auto_unroll_max_step", "ot", 8], ["unroll_explicit", "ot", 1]]}, "result": [[1.832974608678423e-05], 0, 1.8543775081634521, 1595316995.7296877], "version": 0.2, "tvm_version": "0.7.dev1"}
{"input": ["cuda -keys=cuda,gpu -max_num_threads=1024 -thread_warp_size=32", "batch_matmul.cuda", [["TENSOR", [1, 2048, 256], "float32"], ["TENSOR", [1, 1, 256], "float32"]], {}], "config": {"index": 4538, "code_hash": null, "entity": [["tile_y", "sp", [-1, 4, 2]], ["tile_x", "sp", [-1, 1, 1]], ["tile_k", "sp", [-1, 16]], ["auto_unroll_max_step", "ot", 32], ["unroll_explicit", "ot", 1]]}, "result": [[1.9686383571502005e-05], 0, 1.719236135482788, 1595316997.0572493], "version": 0.2, "tvm_version": "0.7.dev1"}
{"input": ["cuda -keys=cuda,gpu -max_num_threads=1024 -thread_warp_size=32", "batch_matmul.cuda", [["TENSOR", [1, 2048, 256], "float32"], ["TENSOR", [1, 1, 256], "float32"]], {}], "config": {"index": 4617, "code_hash": null, "entity": [["tile_y", "sp", [-1, 8, 2]], ["tile_x", "sp", [-1, 1, 1]], ["tile_k", "sp", [-1, 32]], ["auto_unroll_max_step", "ot", 32], ["unroll_explicit", "ot", 1]]}, "result": [[1.6917289084298638e-05], 0, 1.961808443069458, 1595316998.373939], "version": 0.2, "tvm_version": "0.7.dev1"}
{"input": ["cuda -keys=cuda,gpu -max_num_threads=1024 -thread_warp_size=32", "batch_matmul.cuda", [["TENSOR", [1, 2048, 256], "float32"], ["TENSOR", [1, 1, 256], "float32"]], {}], "config": {"index": 5240, "code_hash": null, "entity": [["tile_y", "sp", [-1, 4, 2]], ["tile_x", "sp", [-1, 1, 1]], ["tile_k", "sp", [-1, 16]], ["auto_unroll_max_step", "ot", 64], ["unroll_explicit", "ot", 1]]}, "result": [[1.9704613333333333e-05], 0, 1.9168238639831543, 1595316999.6651099], "version": 0.2, "tvm_version": "0.7.dev1"}
{"input": ["cuda -keys=cuda,gpu -max_num_threads=1024 -thread_warp_size=32", "batch_matmul.cuda", [["TENSOR", [1, 2048, 256], "float32"], ["TENSOR", [1, 1, 256], "float32"]], {}], "config": {"index": 3836, "code_hash": null, "entity": [["tile_y", "sp", [-1, 4, 2]], ["tile_x", "sp", [-1, 1, 1]], ["tile_k", "sp", [-1, 16]], ["auto_unroll_max_step", "ot", 16], ["unroll_explicit", "ot", 1]]}, "result": [[1.970001194956718e-05], 0, 1.7276232242584229, 1595317001.028437], "version": 0.2, "tvm_version": "0.7.dev1"}
{"input": ["cuda -keys=cuda,gpu -max_num_threads=1024 -thread_warp_size=32", "batch_matmul.cuda", [["TENSOR", [1, 2048, 256], "float32"], ["TENSOR", [1, 1, 256], "float32"]], {}], "config": {"index": 1731, "code_hash": null, "entity": [["tile_y", "sp", [-1, 8, 2]], ["tile_x", "sp", [-1, 1, 1]], ["tile_k", "sp", [-1, 16]], ["auto_unroll_max_step", "ot", 32], ["unroll_explicit", "ot", 0]]}, "result": [[1.864252710962145e-05], 0, 1.5708551406860352, 1595317002.27325], "version": 0.2, "tvm_version": "0.7.dev1"}
{"input": ["cuda -keys=cuda,gpu -max_num_threads=1024 -thread_warp_size=32", "batch_matmul.cuda", [["TENSOR", [1, 2048, 256], "float32"], ["TENSOR", [1, 1, 256], "float32"]], {}], "config": {"index": 4695, "code_hash": null, "entity": [["tile_y", "sp", [-1, 8, 2]], ["tile_x", "sp", [-1, 1, 1]], ["tile_k", "sp", [-1, 64]], ["auto_unroll_max_step", "ot", 32], ["unroll_explicit", "ot", 1]]}, "result": [[1.6746098708751793e-05], 0, 1.8951139450073242, 1595317003.5741322], "version": 0.2, "tvm_version": "0.7.dev1"}
{"input": ["cuda -keys=cuda,gpu -max_num_threads=1024 -thread_warp_size=32", "batch_matmul.cuda", [["TENSOR", [1, 2048, 256], "float32"], ["TENSOR", [1, 1, 256], "float32"]], {}], "config": {"index": 3057, "code_hash": null, "entity": [["tile_y", "sp", [-1, 8, 2]], ["tile_x", "sp", [-1, 1, 1]], ["tile_k", "sp", [-1, 8]], ["auto_unroll_max_step", "ot", 8], ["unroll_explicit", "ot", 1]]}, "result": [[2.0545607718612606e-05], 0, 1.8527123928070068, 1595317004.9740767], "version": 0.2, "tvm_version": "0.7.dev1"}
{"input": ["cuda -keys=cuda,gpu -max_num_threads=1024 -thread_warp_size=32", "batch_matmul.cuda", [["TENSOR", [1, 2048, 256], "float32"], ["TENSOR", [1, 1, 256], "float32"]], {}], "config": {"index": 3134, "code_hash": null, "entity": [["tile_y", "sp", [-1, 4, 2]], ["tile_x", "sp", [-1, 1, 1]], ["tile_k", "sp", [-1, 16]], ["auto_unroll_max_step", "ot", 8], ["unroll_explicit", "ot", 1]]}, "result": [[1.97151536133182e-05], 0, 1.7713263034820557, 1595317006.2686536], "version": 0.2, "tvm_version": "0.7.dev1"}
{"input": ["cuda -keys=cuda,gpu -max_num_threads=1024 -thread_warp_size=32", "batch_matmul.cuda", [["TENSOR", [1, 2048, 256], "float32"], ["TENSOR", [1, 1, 256], "float32"]], {}], "config": {"index": 5319, "code_hash": null, "entity": [["tile_y", "sp", [-1, 8, 2]], ["tile_x", "sp", [-1, 1, 1]], ["tile_k", "sp", [-1, 32]], ["auto_unroll_max_step", "ot", 64], ["unroll_explicit", "ot", 1]]}, "result": [[1.7175469184027778e-05], 0, 2.220499038696289, 1595317007.9053016], "version": 0.2, "tvm_version": "0.7.dev1"}
{"input": ["cuda -keys=cuda,gpu -max_num_threads=1024 -thread_warp_size=32", "batch_matmul.cuda", [["TENSOR", [1, 2048, 256], "float32"], ["TENSOR", [1, 1, 256], "float32"]], {}], "config": {"index": 4616, "code_hash": null, "entity": [["tile_y", "sp", [-1, 4, 2]], ["tile_x", "sp", [-1, 1, 1]], ["tile_k", "sp", [-1, 32]], ["auto_unroll_max_step", "ot", 32], ["unroll_explicit", "ot", 1]]}, "result": [[1.745407743321502e-05], 0, 1.8177154064178467, 1595317009.2124705], "version": 0.2, "tvm_version": "0.7.dev1"}
{"input": ["cuda -keys=cuda,gpu -max_num_threads=1024 -thread_warp_size=32", "batch_matmul.cuda", [["TENSOR", [1, 2048, 256], "float32"], ["TENSOR", [1, 1, 256], "float32"]], {}], "config": {"index": 3915, "code_hash": null, "entity": [["tile_y", "sp", [-1, 8, 2]], ["tile_x", "sp", [-1, 1, 1]], ["tile_k", "sp", [-1, 32]], ["auto_unroll_max_step", "ot", 16], ["unroll_explicit", "ot", 1]]}, "result": [[1.653924125569228e-05], 0, 1.658118486404419, 1595317010.520163], "version": 0.2, "tvm_version": "0.7.dev1"}
{"input": ["cuda -keys=cuda,gpu -max_num_threads=1024 -thread_warp_size=32", "batch_matmul.cuda", [["TENSOR", [1, 2048, 256], "float32"], ["TENSOR", [1, 1, 256], "float32"]], {}], "config": {"index": 2433, "code_hash": null, "entity": [["tile_y", "sp", [-1, 8, 2]], ["tile_x", "sp", [-1, 1, 1]], ["tile_k", "sp", [-1, 16]], ["auto_unroll_max_step", "ot", 64], ["unroll_explicit", "ot", 0]]}, "result": [[1.8647108740847872e-05], 0, 1.6596403121948242, 1595317011.7970288], "version": 0.2, "tvm_version": "0.7.dev1"}
{"input": ["cuda -keys=cuda,gpu -max_num_threads=1024 -thread_warp_size=32", "batch_matmul.cuda", [["TENSOR", [1, 2048, 256], "float32"], ["TENSOR", [1, 1, 256], "float32"]], {}], "config": {"index": 5397, "code_hash": null, "entity": [["tile_y", "sp", [-1, 8, 2]], ["tile_x", "sp", [-1, 1, 1]], ["tile_k", "sp", [-1, 64]], ["auto_unroll_max_step", "ot", 64], ["unroll_explicit", "ot", 1]]}, "result": [[1.676700026850443e-05], 0, 1.9579260349273682, 1595317013.1345937], "version": 0.2, "tvm_version": "0.7.dev1"}
{"input": ["cuda -keys=cuda,gpu -max_num_threads=1024 -thread_warp_size=32", "batch_matmul.cuda", [["TENSOR", [1, 2048, 256], "float32"], ["TENSOR", [1, 1, 256], "float32"]], {}], "config": {"index": 3213, "code_hash": null, "entity": [["tile_y", "sp", [-1, 8, 2]], ["tile_x", "sp", [-1, 1, 1]], ["tile_k", "sp", [-1, 32]], ["auto_unroll_max_step", "ot", 8], ["unroll_explicit", "ot", 1]]}, "result": [[1.7229653314121037e-05], 0, 2.0879456996917725, 1595317014.6396363], "version": 0.2, "tvm_version": "0.7.dev1"}
{"input": ["cuda -keys=cuda,gpu -max_num_threads=1024 -thread_warp_size=32", "batch_matmul.cuda", [["TENSOR", [1, 2048, 256], "float32"], ["TENSOR", [1, 1, 256], "float32"]], {}], "config": {"index": 3993, "code_hash": null, "entity": [["tile_y", "sp", [-1, 8, 2]], ["tile_x", "sp", [-1, 1, 1]], ["tile_k", "sp", [-1, 64]], ["auto_unroll_max_step", "ot", 16], ["unroll_explicit", "ot", 1]]}, "result": [[1.5492055637375224e-05], 0, 1.7399969100952148, 1595317015.955194], "version": 0.2, "tvm_version": "0.7.dev1"}
