tvm/matmul.log
{"input": ["cuda -keys=cuda,gpu -max_num_threads=1024 -thread_warp_size=32", "tutorial/matmul", [2048, 2048, 2048, "float32"], {}], "config": {"index": 0, "code_hash": null, "entity": []}, "result": [[0.0039422136], 0, 3.1886959075927734, 1595212583.4891746], "version": 0.2, "tvm_version": "0.7.dev1"}
{"input": ["cuda -keys=cuda,gpu -max_num_threads=1024 -thread_warp_size=32", "tutorial/matmul", [2048, 2048, 2048, "float32"], {}], "config": {"index": 0, "code_hash": null, "entity": []}, "result": [[0.0039211622], 0, 1.285714864730835, 1595227661.8897612], "version": 0.2, "tvm_version": "0.7.dev1"}
{"input": ["cuda -keys=cuda,gpu -max_num_threads=1024 -thread_warp_size=32", "batch_matmul.cuda", [["TENSOR", [1, 2048, 2048], "float32"], ["TENSOR", [1, 1, 2048], "float32"]], {}], "config": {"index": 442, "code_hash": null, "entity": [["tile_y", "sp", [-1, 4, 32]], ["tile_x", "sp", [-1, 1, 1]], ["tile_k", "sp", [-1, 32]], ["auto_unroll_max_step", "ot", 8], ["unroll_explicit", "ot", 0]]}, "result": [[0.0013775628], 0, 1.0466289520263672, 1595230664.7802703], "version": 0.2, "tvm_version": "0.7.dev1"}
{"input": ["cuda -keys=cuda,gpu -max_num_threads=1024 -thread_warp_size=32", "batch_matmul.cuda", [["TENSOR", [1, 2048, 2048], "float32"], ["TENSOR", [1, 1, 2048], "float32"]], {}], "config": {"index": 5854, "code_hash": null, "entity": [["tile_y", "sp", [-1, 16, 1]], ["tile_x", "sp", [-1, 1, 1]], ["tile_k", "sp", [-1, 8]], ["auto_unroll_max_step", "ot", 32], ["unroll_explicit", "ot", 1]]}, "result": [[0.0001876492], 0, 1.0762810707092285, 1595230665.4823823], "version": 0.2, "tvm_version": "0.7.dev1"}
{"input": ["cuda -keys=cuda,gpu -max_num_threads=1024 -thread_warp_size=32", "batch_matmul.cuda", [["TENSOR", [1, 2048, 2048], "float32"], ["TENSOR", [1, 1, 2048], "float32"]], {}], "config": {"index": 4994, "code_hash": null, "entity": [["tile_y", "sp", [-1, 4, 1]], ["tile_x", "sp", [-1, 1, 1]], ["tile_k", "sp", [-1, 16]], ["auto_unroll_max_step", "ot", 16], ["unroll_explicit", "ot", 1]]}, "result": [[0.00020804040000000002], 0, 1.0931854248046875, 1595230666.1769645], "version": 0.2, "tvm_version": "0.7.dev1"}
{"input": ["cuda -keys=cuda,gpu -max_num_threads=1024 -thread_warp_size=32", "batch_matmul.cuda", [["TENSOR", [1, 2048, 2048], "float32"], ["TENSOR", [1, 1, 2048], "float32"]], {}], "config": {"index": 4471, "code_hash": null, "entity": [["tile_y", "sp", [-1, 4, 4]], ["tile_x", "sp", [-1, 1, 1]], ["tile_k", "sp", [-1, 512]], ["auto_unroll_max_step", "ot", 8], ["unroll_explicit", "ot", 1]]}, "result": [[0.0010792824], 0, 1.1964335441589355, 1595230666.9104989], "version": 0.2, "tvm_version": "0.7.dev1"}
{"input": ["cuda -keys=cuda,gpu -max_num_threads=1024 -thread_warp_size=32", "batch_matmul.cuda", [["TENSOR", [1, 2048, 2048], "float32"], ["TENSOR", [1, 1, 2048], "float32"]], {}], "config": {"index": 5909, "code_hash": null, "entity": [["tile_y", "sp", [-1, 4, 64]], ["tile_x", "sp", [-1, 1, 1]], ["tile_k", "sp", [-1, 8]], ["auto_unroll_max_step", "ot", 32], ["unroll_explicit", "ot", 1]]}, "result": [[0.0037394534], 0, 1.2217495441436768, 1595230667.8023605], "version": 0.2, "tvm_version": "0.7.dev1"}
{"input": ["cuda -keys=cuda,gpu -max_num_threads=1024 -thread_warp_size=32", "batch_matmul.cuda", [["TENSOR", [1, 2048, 2048], "float32"], ["TENSOR", [1, 1, 2048], "float32"]], {}], "config": {"index": 1894, "code_hash": null, "entity": [["tile_y", "sp", [-1, 1024, 2]], ["tile_x", "sp", [-1, 1, 1]], ["tile_k", "sp", [-1, 1]], ["auto_unroll_max_step", "ot", 32], ["unroll_explicit", "ot", 0]]}, "result": [[0.0033274982], 0, 1.060744047164917, 1595230668.4889715], "version": 0.2, "tvm_version": "0.7.dev1"}
{"input": ["cuda -keys=cuda,gpu -max_num_threads=1024 -thread_warp_size=32", "batch_matmul.cuda", [["TENSOR", [1, 2048, 2048], "float32"], ["TENSOR", [1, 1, 2048], "float32"]], {}], "config": {"index": 3998, "code_hash": null, "entity": [["tile_y", "sp", [-1, 256, 2]], ["tile_x", "sp", [-1, 1, 1]], ["tile_k", "sp", [-1, 8]], ["auto_unroll_max_step", "ot", 8], ["unroll_explicit", "ot", 1]]}, "result": [[0.000631637], 0, 1.0303237438201904, 1595230669.2748814], "version": 0.2, "tvm_version": "0.7.dev1"}
{"input": ["cuda -keys=cuda,gpu -max_num_threads=1024 -thread_warp_size=32", "batch_matmul.cuda", [["TENSOR", [1, 2048, 2048], "float32"], ["TENSOR", [1, 1, 2048], "float32"]], {}], "config": {"index": 4171, "code_hash": null, "entity": [["tile_y", "sp", [-1, 16, 8]], ["tile_x", "sp", [-1, 1, 1]], ["tile_k", "sp", [-1, 32]], ["auto_unroll_max_step", "ot", 8], ["unroll_explicit", "ot", 1]]}, "result": [[0.000697082], 0, 0.9915866851806641, 1595230669.9722834], "version": 0.2, "tvm_version": "0.7.dev1"}
{"input": ["cuda -keys=cuda,gpu -max_num_threads=1024 -thread_warp_size=32", "batch_matmul.cuda", [["TENSOR", [1, 2048, 2048], "float32"], ["TENSOR", [1, 1, 2048], "float32"]], {}], "config": {"index": 1363, "code_hash": null, "entity": [["tile_y", "sp", [-1, 16, 8]], ["tile_x", "sp", [-1, 1, 1]], ["tile_k", "sp", [-1, 32]], ["auto_unroll_max_step", "ot", 16], ["unroll_explicit", "ot", 0]]}, "result": [[0.0006983607999999999], 0, 1.030679702758789, 1595230670.8931913], "version": 0.2, "tvm_version": "0.7.dev1"}
{"input": ["cuda -keys=cuda,gpu -max_num_threads=1024 -thread_warp_size=32", "batch_matmul.cuda", [["TENSOR", [1, 2048, 2048], "float32"], ["TENSOR", [1, 1, 2048], "float32"]], {}], "config": {"index": 2823, "code_hash": null, "entity": [["tile_y", "sp", [-1, 8, 2]], ["tile_x", "sp", [-1, 1, 1]], ["tile_k", "sp", [-1, 1]], ["auto_unroll_max_step", "ot", 64], ["unroll_explicit", "ot", 0]]}, "result": [[0.0004873382], 0, 0.9963212013244629, 1595231768.1087387], "version": 0.2, "tvm_version": "0.7.dev1"}
{"input": ["cuda -keys=cuda,gpu -max_num_threads=1024 -thread_warp_size=32", "batch_matmul.cuda", [["TENSOR", [1, 2048, 2048], "float32"], ["TENSOR", [1, 1, 2048], "float32"]], {}], "config": {"index": 955, "code_hash": null, "entity": [["tile_y", "sp", [-1, 128, 2]], ["tile_x", "sp", [-1, 1, 1]], ["tile_k", "sp", [-1, 1]], ["auto_unroll_max_step", "ot", 16], ["unroll_explicit", "ot", 0]]}, "result": [[0.0005826119999999999], 0, 1.1198337078094482, 1595231768.8296406], "version": 0.2, "tvm_version": "0.7.dev1"}
{"input": ["cuda -keys=cuda,gpu -max_num_threads=1024 -thread_warp_size=32", "batch_matmul.cuda", [["TENSOR", [1, 2048, 2048], "float32"], ["TENSOR", [1, 1, 2048], "float32"]], {}], "config": {"index": 3812, "code_hash": null, "entity": [["tile_y", "sp", [-1, 1, 256]], ["tile_x", "sp", [-1, 1, 1]], ["tile_k", "sp", [-1, 1]], ["auto_unroll_max_step", "ot", 8], ["unroll_explicit", "ot", 1]]}, "result": [[0.0196878364], 0, 1.3385169506072998, 1595231769.8332677], "version": 0.2, "tvm_version": "0.7.dev1"}
{"input": ["cuda -keys=cuda,gpu -max_num_threads=1024 -thread_warp_size=32", "batch_matmul.cuda", [["TENSOR", [1, 2048, 2048], "float32"], ["TENSOR", [1, 1, 2048], "float32"]], {}], "config": {"index": 136, "code_hash": null, "entity": [["tile_y", "sp", [-1, 2, 64]], ["tile_x", "sp", [-1, 1, 1]], ["tile_k", "sp", [-1, 2]], ["auto_unroll_max_step", "ot", 8], ["unroll_explicit", "ot", 0]]}, "result": [[0.001594835], 0, 1.1169750690460205, 1595231770.5461416], "version": 0.2, "tvm_version": "0.7.dev1"}
{"input": ["cuda -keys=cuda,gpu -max_num_threads=1024 -thread_warp_size=32", "batch_matmul.cuda", [["TENSOR", [1, 2048, 2048], "float32"], ["TENSOR", [1, 1, 2048], "float32"]], {}], "config": {"index": 3243, "code_hash": null, "entity": [["tile_y", "sp", [-1, 8, 16]], ["tile_x", "sp", [-1, 1, 1]], ["tile_k", "sp", [-1, 32]], ["auto_unroll_max_step", "ot", 64], ["unroll_explicit", "ot", 0]]}, "result": [[0.0009299534], 0, 1.099501609802246, 1595231771.212832], "version": 0.2, "tvm_version": "0.7.dev1"}
{"input": ["cuda -keys=cuda,gpu -max_num_threads=1024 -thread_warp_size=32", "batch_matmul.cuda", [["TENSOR", [1, 2048, 2048], "float32"], ["TENSOR", [1, 1, 2048], "float32"]], {}], "config": {"index": 7277, "code_hash": null, "entity": [["tile_y", "sp", [-1, 1, 4]], ["tile_x", "sp", [-1, 1, 1]], ["tile_k", "sp", [-1, 512]], ["auto_unroll_max_step", "ot", 64], ["unroll_explicit", "ot", 1]]}, "result": [[0.0006758244], 0, 3.693927764892578, 1595231774.537706], "version": 0.2, "tvm_version": "0.7.dev1"}
{"input": ["cuda -keys=cuda,gpu -max_num_threads=1024 -thread_warp_size=32", "batch_matmul.cuda", [["TENSOR", [1, 2048, 2048], "float32"], ["TENSOR", [1, 1, 2048], "float32"]], {}], "config": {"index": 3827, "code_hash": null, "entity": [["tile_y", "sp", [-1, 32, 1]], ["tile_x", "sp", [-1, 1, 1]], ["tile_k", "sp", [-1, 2]], ["auto_unroll_max_step", "ot", 8], ["unroll_explicit", "ot", 1]]}, "result": [[0.0003321638], 0, 1.0678129196166992, 1595231775.1979935], "version": 0.2, "tvm_version": "0.7.dev1"}
{"input": ["cuda -keys=cuda,gpu -max_num_threads=1024 -thread_warp_size=32", "batch_matmul.cuda", [["TENSOR", [1, 2048, 2048], "float32"], ["TENSOR", [1, 1, 2048], "float32"]], {}], "config": {"index": 5484, "code_hash": null, "entity": [["tile_y", "sp", [-1, 2, 4]], ["tile_x", "sp", [-1, 1, 1]], ["tile_k", "sp", [-1, 1024]], ["auto_unroll_max_step", "ot", 16], ["unroll_explicit", "ot", 1]]}, "result": [[0.0011716936000000001], 0, 1.1200947761535645, 1595231775.890762], "version": 0.2, "tvm_version": "0.7.dev1"}
{"input": ["cuda -keys=cuda,gpu -max_num_threads=1024 -thread_warp_size=32", "batch_matmul.cuda", [["TENSOR", [1, 2048, 2048], "float32"], ["TENSOR", [1, 1, 2048], "float32"]], {}], "config": {"index": 6899, "code_hash": null, "entity": [["tile_y", "sp", [-1, 4, 8]], ["tile_x", "sp", [-1, 1, 1]], ["tile_k", "sp", [-1, 16]], ["auto_unroll_max_step", "ot", 64], ["unroll_explicit", "ot", 1]]}, "result": [[0.0006058822], 0, 1.0418052673339844, 1595231776.6402528], "version": 0.2, "tvm_version": "0.7.dev1"}
{"input": ["cuda -keys=cuda,gpu -max_num_threads=1024 -thread_warp_size=32", "batch_matmul.cuda", [["TENSOR", [1, 2048, 2048], "float32"], ["TENSOR", [1, 1, 2048], "float32"]], {}], "config": {"index": 178, "code_hash": null, "entity": [["tile_y", "sp", [-1, 1024, 2]], ["tile_x", "sp", [-1, 1, 1]], ["tile_k", "sp", [-1, 4]], ["auto_unroll_max_step", "ot", 8], ["unroll_explicit", "ot", 0]]}, "result": [[0.0029051014], 0, 1.0432822704315186, 1595231777.36559], "version": 0.2, "tvm_version": "0.7.dev1"}
{"input": ["cuda -keys=cuda,gpu -max_num_threads=1024 -thread_warp_size=32", "batch_matmul.cuda", [["TENSOR", [1, 2048, 2048], "float32"], ["TENSOR", [1, 1, 2048], "float32"]], {}], "config": {"index": 1067, "code_hash": null, "entity": [["tile_y", "sp", [-1, 8, 32]], ["tile_x", "sp", [-1, 1, 1]], ["tile_k", "sp", [-1, 2]], ["auto_unroll_max_step", "ot", 16], ["unroll_explicit", "ot", 0]]}, "result": [[0.0017347554], 0, 1.023575782775879, 1595231778.0344865], "version": 0.2, "tvm_version": "0.7.dev1"}
{"input": ["cuda -keys=cuda,gpu -max_num_threads=1024 -thread_warp_size=32", "batch_matmul.cuda", [["TENSOR", [1, 2048, 2048], "float32"], ["TENSOR", [1, 1, 2048], "float32"]], {}], "config": {"index": 3226, "code_hash": null, "entity": [["tile_y", "sp", [-1, 32, 4]], ["tile_x", "sp", [-1, 1, 1]], ["tile_k", "sp", [-1, 32]], ["auto_unroll_max_step", "ot", 64], ["unroll_explicit", "ot", 0]]}, "result": [[0.000433923], 0, 1.07535982131958, 1595231778.7553792], "version": 0.2, "tvm_version": "0.7.dev1"}
{"input": ["cuda -keys=cuda,gpu -max_num_threads=1024 -thread_warp_size=32", "batch_matmul.cuda", [["TENSOR", [1, 2048, 2048], "float32"], ["TENSOR", [1, 1, 2048], "float32"]], {}], "config": {"index": 2814, "code_hash": null, "entity": [["tile_y", "sp", [-1, 64, 1]], ["tile_x", "sp", [-1, 1, 1]], ["tile_k", "sp", [-1, 1]], ["auto_unroll_max_step", "ot", 64], ["unroll_explicit", "ot", 0]]}, "result": [[0.0005120198], 0, 0.9768002033233643, 1595231779.401367], "version": 0.2, "tvm_version": "0.7.dev1"}
{"input": ["cuda -keys=cuda,gpu -max_num_threads=1024 -thread_warp_size=32", "batch_matmul.cuda", [["TENSOR", [1, 2048, 2048], "float32"], ["TENSOR", [1, 1, 2048], "float32"]], {}], "config": {"index": 149, "code_hash": null, "entity": [["tile_y", "sp", [-1, 8, 256]], ["tile_x", "sp", [-1, 1, 1]], ["tile_k", "sp", [-1, 2]], ["auto_unroll_max_step", "ot", 8], ["unroll_explicit", "ot", 0]]}, "result": [[0.0253970242], 0, 1.576892375946045, 1595231846.664923], "version": 0.2, "tvm_version": "0.7.dev1"}
{"input": ["cuda -keys=cuda,gpu -max_num_threads=1024 -thread_warp_size=32", "batch_matmul.cuda", [["TENSOR", [1, 2048, 2048], "float32"], ["TENSOR", [1, 1, 2048], "float32"]], {}], "config": {"index": 3920, "code_hash": null, "entity": [["tile_y", "sp", [-1, 256, 2]], ["tile_x", "sp", [-1, 1, 1]], ["tile_k", "sp", [-1, 4]], ["auto_unroll_max_step", "ot", 8], ["unroll_explicit", "ot", 1]]}, "result": [[0.0005542575999999999], 0, 1.0796630382537842, 1595231847.3985288], "version": 0.2, "tvm_version": "0.7.dev1"}
{"input": ["cuda -keys=cuda,gpu -max_num_threads=1024 -thread_warp_size=32", "batch_matmul.cuda", [["TENSOR", [1, 2048, 2048], "float32"], ["TENSOR", [1, 1, 2048], "float32"]], {}], "config": {"index": 5060, "code_hash": null, "entity": [["tile_y", "sp", [-1, 1, 256]], ["tile_x", "sp", [-1, 1, 1]], ["tile_k", "sp", [-1, 16]], ["auto_unroll_max_step", "ot", 16], ["unroll_explicit", "ot", 1]]}, "result": [[0.0184982728], 0, 1.4236807823181152, 1595231848.4741552], "version": 0.2, "tvm_version": "0.7.dev1"}
{"input": ["cuda -keys=cuda,gpu -max_num_threads=1024 -thread_warp_size=32", "batch_matmul.cuda", [["TENSOR", [1, 2048, 2048], "float32"], ["TENSOR", [1, 1, 2048], "float32"]], {}], "config": {"index": 2007, "code_hash": null, "entity": [["tile_y", "sp", [-1, 1, 64]], ["tile_x", "sp", [-1, 1, 1]], ["tile_k", "sp", [-1, 2]], ["auto_unroll_max_step", "ot", 32], ["unroll_explicit", "ot", 0]]}, "result": [[0.0018263002], 0, 1.1280121803283691, 1595231849.2056494], "version": 0.2, "tvm_version": "0.7.dev1"}
{"input": ["cuda -keys=cuda,gpu -max_num_threads=1024 -thread_warp_size=32", "batch_matmul.cuda", [["TENSOR", [1, 2048, 2048], "float32"], ["TENSOR", [1, 1, 2048], "float32"]], {}], "config": {"index": 3922, "code_hash": null, "entity": [["tile_y", "sp", [-1, 1024, 2]], ["tile_x", "sp", [-1, 1, 1]], ["tile_k", "sp", [-1, 4]], ["auto_unroll_max_step", "ot", 8], ["unroll_explicit", "ot", 1]]}, "result": [[0.0022799216], 0, 1.162825345993042, 1595231850.1702104], "version": 0.2, "tvm_version": "0.7.dev1"}
{"input": ["cuda -keys=cuda,gpu -max_num_threads=1024 -thread_warp_size=32", "batch_matmul.cuda", [["TENSOR", [1, 2048, 2048], "float32"], ["TENSOR", [1, 1, 2048], "float32"]], {}], "config": {"index": 5856, "code_hash": null, "entity": [["tile_y", "sp", [-1, 64, 1]], ["tile_x", "sp", [-1, 1, 1]], ["tile_k", "sp", [-1, 8]], ["auto_unroll_max_step", "ot", 32], ["unroll_explicit", "ot", 1]]}, "result": [[0.0002101184], 0, 1.0907015800476074, 1595231850.8891027], "version": 0.2, "tvm_version": "0.7.dev1"}
{"input": ["cuda -keys=cuda,gpu -max_num_threads=1024 -thread_warp_size=32", "batch_matmul.cuda", [["TENSOR", [1, 2048, 2048], "float32"], ["TENSOR", [1, 1, 2048], "float32"]], {}], "config": {"index": 2743, "code_hash": null, "entity": [["tile_y", "sp", [-1, 2, 2]], ["tile_x", "sp", [-1, 1, 1]], ["tile_k", "sp", [-1, 2048]], ["auto_unroll_max_step", "ot", 32], ["unroll_explicit", "ot", 0]]}, "result": [[0.0011684378], 0, 1.0148663520812988, 1595231851.5686202], "version": 0.2, "tvm_version": "0.7.dev1"}
{"input": ["cuda -keys=cuda,gpu -max_num_threads=1024 -thread_warp_size=32", "batch_matmul.cuda", [["TENSOR", [1, 2048, 2048], "float32"], ["TENSOR", [1, 1, 2048], "float32"]], {}], "config": {"index": 4048, "code_hash": null, "entity": [["tile_y", "sp", [-1, 4, 256]], ["tile_x", "sp", [-1, 1, 1]], ["tile_k", "sp", [-1, 8]], ["auto_unroll_max_step", "ot", 8], ["unroll_explicit", "ot", 1]]}, "result": [[0.0250881232], 0, 1.6802325248718262, 1595231852.753111], "version": 0.2, "tvm_version": "0.7.dev1"}
{"input": ["cuda -keys=cuda,gpu -max_num_threads=1024 -thread_warp_size=32", "batch_matmul.cuda", [["TENSOR", [1, 2048, 2048], "float32"], ["TENSOR", [1, 1, 2048], "float32"]], {}], "config": {"index": 5722, "code_hash": null, "entity": [["tile_y", "sp", [-1, 32, 4]], ["tile_x", "sp", [-1, 1, 1]], ["tile_k", "sp", [-1, 2]], ["auto_unroll_max_step", "ot", 32], ["unroll_explicit", "ot", 1]]}, "result": [[0.000431694], 0, 0.9857368469238281, 1595231853.4267642], "version": 0.2, "tvm_version": "0.7.dev1"}
{"input": ["cuda -keys=cuda,gpu -max_num_threads=1024 -thread_warp_size=32", "batch_matmul.cuda", [["TENSOR", [1, 2048, 2048], "float32"], ["TENSOR", [1, 1, 2048], "float32"]], {}], "config": {"index": 4245, "code_hash": null, "entity": [["tile_y", "sp", [-1, 1, 8]], ["tile_x", "sp", [-1, 1, 1]], ["tile_k", "sp", [-1, 64]], ["auto_unroll_max_step", "ot", 8], ["unroll_explicit", "ot", 1]]}, "result": [[0.000385112], 0, 1.1339235305786133, 1595231880.975116], "version": 0.2, "tvm_version": "0.7.dev1"}
{"input": ["cuda -keys=cuda,gpu -max_num_threads=1024 -thread_warp_size=32", "batch_matmul.cuda", [["TENSOR", [1, 2048, 2048], "float32"], ["TENSOR", [1, 1, 2048], "float32"]], {}], "config": {"index": 1120, "code_hash": null, "entity": [["tile_y", "sp", [-1, 32, 4]], ["tile_x", "sp", [-1, 1, 1]], ["tile_k", "sp", [-1, 4]], ["auto_unroll_max_step", "ot", 16], ["unroll_explicit", "ot", 0]]}, "result": [[0.0004008474], 0, 1.1074507236480713, 1595231881.6930723], "version": 0.2, "tvm_version": "0.7.dev1"}
{"input": ["cuda -keys=cuda,gpu -max_num_threads=1024 -thread_warp_size=32", "batch_matmul.cuda", [["TENSOR", [1, 2048, 2048], "float32"], ["TENSOR", [1, 1, 2048], "float32"]], {}], "config": {"index": 7266, "code_hash": null, "entity": [["tile_y", "sp", [-1, 1, 2]], ["tile_x", "sp", [-1, 1, 1]], ["tile_k", "sp", [-1, 512]], ["auto_unroll_max_step", "ot", 64], ["unroll_explicit", "ot", 1]]}, "result": [[0.0008286445999999999], 0, 2.3422229290008545, 1595231883.6443226], "version": 0.2, "tvm_version": "0.7.dev1"}
{"input": ["cuda -keys=cuda,gpu -max_num_threads=1024 -thread_warp_size=32", "batch_matmul.cuda", [["TENSOR", [1, 2048, 2048], "float32"], ["TENSOR", [1, 1, 2048], "float32"]], {}], "config": {"index": 7044, "code_hash": null, "entity": [["tile_y", "sp", [-1, 2, 4]], ["tile_x", "sp", [-1, 1, 1]], ["tile_k", "sp", [-1, 64]], ["auto_unroll_max_step", "ot", 64], ["unroll_explicit", "ot", 1]]}, "result": [[0.000258468], 0, 1.207500696182251, 1595231884.3063326], "version": 0.2, "tvm_version": "0.7.dev1"}
{"input": ["cuda -keys=cuda,gpu -max_num_threads=1024 -thread_warp_size=32", "batch_matmul.cuda", [["TENSOR", [1, 2048, 2048], "float32"], ["TENSOR", [1, 1, 2048], "float32"]], {}], "config": {"index": 1662, "code_hash": null, "entity": [["tile_y", "sp", [-1, 2, 4]], ["tile_x", "sp", [-1, 1, 1]], ["tile_k", "sp", [-1, 512]], ["auto_unroll_max_step", "ot", 16], ["unroll_explicit", "ot", 0]]}, "result": [[0.0006361068], 0, 1.1647300720214844, 1595231885.1193867], "version": 0.2, "tvm_version": "0.7.dev1"}
{"input": ["cuda -keys=cuda,gpu -max_num_threads=1024 -thread_warp_size=32", "batch_matmul.cuda", [["TENSOR", [1, 2048, 2048], "float32"], ["TENSOR", [1, 1, 2048], "float32"]], {}], "config": {"index": 36, "code_hash": null, "entity": [["tile_y", "sp", [-1, 8, 8]], ["tile_x", "sp", [-1, 1, 1]], ["tile_k", "sp", [-1, 1]], ["auto_unroll_max_step", "ot", 8], ["unroll_explicit", "ot", 0]]}, "result": [[0.0004968012], 0, 1.1743049621582031, 1595231885.8996503], "version": 0.2, "tvm_version": "0.7.dev1"}
{"input": ["cuda -keys=cuda,gpu -max_num_threads=1024 -thread_warp_size=32", "batch_matmul.cuda", [["TENSOR", [1, 2048, 2048], "float32"], ["TENSOR", [1, 1, 2048], "float32"]], {}], "config": {"index": 7344, "code_hash": null, "entity": [["tile_y", "sp", [-1, 1, 2]], ["tile_x", "sp", [-1, 1, 1]], ["tile_k", "sp", [-1, 1024]], ["auto_unroll_max_step", "ot", 64], ["unroll_explicit", "ot", 1]]}, "result": [[0.0010148654], 0, 2.7916195392608643, 1595231888.2492812], "version": 0.2, "tvm_version": "0.7.dev1"}
{"input": ["cuda -keys=cuda,gpu -max_num_threads=1024 -thread_warp_size=32", "batch_matmul.cuda", [["TENSOR", [1, 2048, 2048], "float32"], ["TENSOR", [1, 1, 2048], "float32"]], {}], "config": {"index": 1169, "code_hash": null, "entity": [["tile_y", "sp", [-1, 1, 2048]], ["tile_x", "sp", [-1, 1, 1]], ["tile_k", "sp", [-1, 4]], ["auto_unroll_max_step", "ot", 16], ["unroll_explicit", "ot", 0]]}, "result": [[0.1040008084], 0, 3.2896292209625244, 1595231891.053697], "version": 0.2, "tvm_version": "0.7.dev1"}
{"input": ["cuda -keys=cuda,gpu -max_num_threads=1024 -thread_warp_size=32", "batch_matmul.cuda", [["TENSOR", [1, 2048, 2048], "float32"], ["TENSOR", [1, 1, 2048], "float32"]], {}], "config": {"index": 5877, "code_hash": null, "entity": [["tile_y", "sp", [-1, 16, 4]], ["tile_x", "sp", [-1, 1, 1]], ["tile_k", "sp", [-1, 8]], ["auto_unroll_max_step", "ot", 32], ["unroll_explicit", "ot", 1]]}, "result": [[0.0003963172], 0, 1.104511022567749, 1595231891.7201905], "version": 0.2, "tvm_version": "0.7.dev1"}
{"input": ["cuda -keys=cuda,gpu -max_num_threads=1024 -thread_warp_size=32", "batch_matmul.cuda", [["TENSOR", [1, 2048, 2048], "float32"], ["TENSOR", [1, 1, 2048], "float32"]], {}], "config": {"index": 1018, "code_hash": null, "entity": [["tile_y", "sp", [-1, 16, 1]], ["tile_x", "sp", [-1, 1, 1]], ["tile_k", "sp", [-1, 2]], ["auto_unroll_max_step", "ot", 16], ["unroll_explicit", "ot", 0]]}, "result": [[0.00024899739999999996], 0, 0.9509193897247314, 1595231892.5316966], "version": 0.2, "tvm_version": "0.7.dev1"}
{"input": ["cuda -keys=cuda,gpu -max_num_threads=1024 -thread_warp_size=32", "batch_matmul.cuda", [["TENSOR", [1, 2048, 2048], "float32"], ["TENSOR", [1, 1, 2048], "float32"]], {}], "config": {"index": 1878, "code_hash": null, "entity": [["tile_y", "sp", [-1, 64, 1]], ["tile_x", "sp", [-1, 1, 1]], ["tile_k", "sp", [-1, 1]], ["auto_unroll_max_step", "ot", 32], ["unroll_explicit", "ot", 0]]}, "result": [[0.00040268480000000005], 0, 0.8949007987976074, 1595231893.1602042], "version": 0.2, "tvm_version": "0.7.dev1"}
{"input": ["cuda -keys=cuda,gpu -max_num_threads=1024 -thread_warp_size=32", "batch_matmul.cuda", [["TENSOR", [1, 2048, 2048], "float32"], ["TENSOR", [1, 1, 2048], "float32"]], {}], "config": {"index": 1023, "code_hash": null, "entity": [["tile_y", "sp", [-1, 512, 1]], ["tile_x", "sp", [-1, 1, 1]], ["tile_k", "sp", [-1, 2]], ["auto_unroll_max_step", "ot", 16], ["unroll_explicit", "ot", 0]]}, "result": [[0.0005222254], 0, 1.0265169143676758, 1595231893.8857884], "version": 0.2, "tvm_version": "0.7.dev1"}
{"input": ["cuda -keys=cuda,gpu -max_num_threads=1024 -thread_warp_size=32", "batch_matmul.cuda", [["TENSOR", [1, 2048, 2048], "float32"], ["TENSOR", [1, 1, 2048], "float32"]], {}], "config": {"index": 3940, "code_hash": null, "entity": [["tile_y", "sp", [-1, 128, 8]], ["tile_x", "sp", [-1, 1, 1]], ["tile_k", "sp", [-1, 4]], ["auto_unroll_max_step", "ot", 8], ["unroll_explicit", "ot", 1]]}, "result": [[0.0015979009999999999], 0, 1.069319248199463, 1595231950.154443], "version": 0.2, "tvm_version": "0.7.dev1"}
{"input": ["cuda -keys=cuda,gpu -max_num_threads=1024 -thread_warp_size=32", "batch_matmul.cuda", [["TENSOR", [1, 2048, 2048], "float32"], ["TENSOR", [1, 1, 2048], "float32"]], {}], "config": {"index": 2122, "code_hash": null, "entity": [["tile_y", "sp", [-1, 16, 2]], ["tile_x", "sp", [-1, 1, 1]], ["tile_k", "sp", [-1, 8]], ["auto_unroll_max_step", "ot", 32], ["unroll_explicit", "ot", 0]]}, "result": [[0.0002738084], 0, 1.0434019565582275, 1595231950.8127232], "version": 0.2, "tvm_version": "0.7.dev1"}
{"input": ["cuda -keys=cuda,gpu -max_num_threads=1024 -thread_warp_size=32", "batch_matmul.cuda", [["TENSOR", [1, 2048, 2048], "float32"], ["TENSOR", [1, 1, 2048], "float32"]], {}], "config": {"index": 1112, "code_hash": null, "entity": [["tile_y", "sp", [-1, 256, 2]], ["tile_x", "sp", [-1, 1, 1]], ["tile_k", "sp", [-1, 4]], ["auto_unroll_max_step", "ot", 16], ["unroll_explicit", "ot", 0]]}, "result": [[0.0007147464], 0, 1.0349740982055664, 1595231951.4446661], "version": 0.2, "tvm_version": "0.7.dev1"}
{"input": ["cuda -keys=cuda,gpu -max_num_threads=1024 -thread_warp_size=32", "batch_matmul.cuda", [["TENSOR", [1, 2048, 2048], "float32"], ["TENSOR", [1, 1, 2048], "float32"]], {}], "config": {"index": 6659, "code_hash": null, "entity": [["tile_y", "sp", [-1, 64, 4]], ["tile_x", "sp", [-1, 1, 1]], ["tile_k", "sp", [-1, 2]], ["auto_unroll_max_step", "ot", 64], ["unroll_explicit", "ot", 1]]}, "result": [[0.0007301256], 0, 1.0575344562530518, 1595231952.1047018], "version": 0.2, "tvm_version": "0.7.dev1"}
{"input": ["cuda -keys=cuda,gpu -max_num_threads=1024 -thread_warp_size=32", "batch_matmul.cuda", [["TENSOR", [1, 2048, 2048], "float32"], ["TENSOR", [1, 1, 2048], "float32"]], {}], "config": {"index": 124, "code_hash": null, "entity": [["tile_y", "sp", [-1, 16, 16]], ["tile_x", "sp", [-1, 1, 1]], ["tile_k", "sp", [-1, 2]], ["auto_unroll_max_step", "ot", 8], ["unroll_explicit", "ot", 0]]}, "result": [[0.0017442204], 0, 1.1028361320495605, 1595231952.80206], "version": 0.2, "tvm_version": "0.7.dev1"}
{"input": ["cuda -keys=cuda,gpu -max_num_threads=1024 -thread_warp_size=32", "batch_matmul.cuda", [["TENSOR", [1, 2048, 2048], "float32"], ["TENSOR", [1, 1, 2048], "float32"]], {}], "config": {"index": 1487, "code_hash": null, "entity": [["tile_y", "sp", [-1, 32, 1]], ["tile_x", "sp", [-1, 1, 1]], ["tile_k", "sp", [-1, 128]], ["auto_unroll_max_step", "ot", 16], ["unroll_explicit", "ot", 0]]}, "result": [[0.000210485], 0, 1.0565545558929443, 1595231953.4398396], "version": 0.2, "tvm_version": "0.7.dev1"}
{"input": ["cuda -keys=cuda,gpu -max_num_threads=1024 -thread_warp_size=32", "batch_matmul.cuda", [["TENSOR", [1, 2048, 2048], "float32"], ["TENSOR", [1, 1, 2048], "float32"]], {}], "config": {"index": 6695, "code_hash": null, "entity": [["tile_y", "sp", [-1, 4, 128]], ["tile_x", "sp", [-1, 1, 1]], ["tile_k", "sp", [-1, 2]], ["auto_unroll_max_step", "ot", 64], ["unroll_explicit", "ot", 1]]}, "result": [[0.0085201966], 0, 1.4800641536712646, 1595231954.4243236], "version": 0.2, "tvm_version": "0.7.dev1"}
{"input": ["cuda -keys=cuda,gpu -max_num_threads=1024 -thread_warp_size=32", "batch_matmul.cuda", [["TENSOR", [1, 2048, 2048], "float32"], ["TENSOR", [1, 1, 2048], "float32"]], {}], "config": {"index": 3966, "code_hash": null, "entity": [["tile_y", "sp", [-1, 8, 128]], ["tile_x", "sp", [-1, 1, 1]], ["tile_k", "sp", [-1, 4]], ["auto_unroll_max_step", "ot", 8], ["unroll_explicit", "ot", 1]]}, "result": [[0.0095402796], 0, 1.428403377532959, 1595231955.2962883], "version": 0.2, "tvm_version": "0.7.dev1"}
{"input": ["cuda -keys=cuda,gpu -max_num_threads=1024 -thread_warp_size=32", "batch_matmul.cuda", [["TENSOR", [1, 2048, 2048], "float32"], ["TENSOR", [1, 1, 2048], "float32"]], {}], "config": {"index": 2115, "code_hash": null, "entity": [["tile_y", "sp", [-1, 512, 1]], ["tile_x", "sp", [-1, 1, 1]], ["tile_k", "sp", [-1, 8]], ["auto_unroll_max_step", "ot", 32], ["unroll_explicit", "ot", 0]]}, "result": [[0.0006420999999999999], 0, 1.0459740161895752, 1595231956.089538], "version": 0.2, "tvm_version": "0.7.dev1"}
{"input": ["cuda -keys=cuda,gpu -max_num_threads=1024 -thread_warp_size=32", "batch_matmul.cuda", [["TENSOR", [1, 2048, 2048], "float32"], ["TENSOR", [1, 1, 2048], "float32"]], {}], "config": {"index": 3241, "code_hash": null, "entity": [["tile_y", "sp", [-1, 2, 16]], ["tile_x", "sp", [-1, 1, 1]], ["tile_k", "sp", [-1, 32]], ["auto_unroll_max_step", "ot", 64], ["unroll_explicit", "ot", 0]]}, "result": [[0.0008750722], 0, 1.1384778022766113, 1595231956.823994], "version": 0.2, "tvm_version": "0.7.dev1"}
{"input": ["cuda -keys=cuda,gpu -max_num_threads=1024 -thread_warp_size=32", "batch_matmul.cuda", [["TENSOR", [1, 2048, 2048], "float32"], ["TENSOR", [1, 1, 2048], "float32"]], {}], "config": {"index": 3124, "code_hash": null, "entity": [["tile_y", "sp", [-1, 16, 1]], ["tile_x", "sp", [-1, 1, 1]], ["tile_k", "sp", [-1, 16]], ["auto_unroll_max_step", "ot", 64], ["unroll_explicit", "ot", 0]]}, "result": [[0.0001510778], 0, 0.9923489093780518, 1595231957.5370672], "version": 0.2, "tvm_version": "0.7.dev1"}
{"input": ["cuda -keys=cuda,gpu -max_num_threads=1024 -thread_warp_size=32", "batch_matmul.cuda", [["TENSOR", [1, 2048, 2048], "float32"], ["TENSOR", [1, 1, 2048], "float32"]], {}], "config": {"index": 3923, "code_hash": null, "entity": [["tile_y", "sp", [-1, 1, 4]], ["tile_x", "sp", [-1, 1, 1]], ["tile_k", "sp", [-1, 4]], ["auto_unroll_max_step", "ot", 8], ["unroll_explicit", "ot", 1]]}, "result": [[0.00048768020000000006], 0, 1.0083558559417725, 1595231996.1475875], "version": 0.2, "tvm_version": "0.7.dev1"}
{"input": ["cuda -keys=cuda,gpu -max_num_threads=1024 -thread_warp_size=32", "batch_matmul.cuda", [["TENSOR", [1, 2048, 2048], "float32"], ["TENSOR", [1, 1, 2048], "float32"]], {}], "config": {"index": 6654, "code_hash": null, "entity": [["tile_y", "sp", [-1, 2, 4]], ["tile_x", "sp", [-1, 1, 1]], ["tile_k", "sp", [-1, 2]], ["auto_unroll_max_step", "ot", 64], ["unroll_explicit", "ot", 1]]}, "result": [[0.00039225120000000005], 0, 0.9996011257171631, 1595231996.8044643], "version": 0.2, "tvm_version": "0.7.dev1"}
{"input": ["cuda -keys=cuda,gpu -max_num_threads=1024 -thread_warp_size=32", "batch_matmul.cuda", [["TENSOR", [1, 2048, 2048], "float32"], ["TENSOR", [1, 1, 2048], "float32"]], {}], "config": {"index": 6109, "code_hash": null, "entity": [["tile_y", "sp", [-1, 4, 4]], ["tile_x", "sp", [-1, 1, 1]], ["tile_k", "sp", [-1, 64]], ["auto_unroll_max_step", "ot", 32], ["unroll_explicit", "ot", 1]]}, "result": [[0.00021674620000000002], 0, 1.1601955890655518, 1595231997.5362532], "version": 0.2, "tvm_version": "0.7.dev1"}
{"input": ["cuda -keys=cuda,gpu -max_num_threads=1024 -thread_warp_size=32", "batch_matmul.cuda", [["TENSOR", [1, 2048, 2048], "float32"], ["TENSOR", [1, 1, 2048], "float32"]], {}], "config": {"index": 3107, "code_hash": null, "entity": [["tile_y", "sp", [-1, 4, 128]], ["tile_x", "sp", [-1, 1, 1]], ["tile_k", "sp", [-1, 8]], ["auto_unroll_max_step", "ot", 64], ["unroll_explicit", "ot", 0]]}, "result": [[0.0094563744], 0, 1.3654890060424805, 1595231998.4374292], "version": 0.2, "tvm_version": "0.7.dev1"}
{"input": ["cuda -keys=cuda,gpu -max_num_threads=1024 -thread_warp_size=32", "batch_matmul.cuda", [["TENSOR", [1, 2048, 2048], "float32"], ["TENSOR", [1, 1, 2048], "float32"]], {}], "config": {"index": 4910, "code_hash": null, "entity": [["tile_y", "sp", [-1, 4, 512]], ["tile_x", "sp", [-1, 1, 1]], ["tile_k", "sp", [-1, 4]], ["auto_unroll_max_step", "ot", 16], ["unroll_explicit", "ot", 1]]}, "result": [[0.0402792568], 0, 1.914867639541626, 1595231999.860092], "version": 0.2, "tvm_version": "0.7.dev1"}
{"input": ["cuda -keys=cuda,gpu -max_num_threads=1024 -thread_warp_size=32", "batch_matmul.cuda", [["TENSOR", [1, 2048, 2048], "float32"], ["TENSOR", [1, 1, 2048], "float32"]], {}], "config": {"index": 1333, "code_hash": null, "entity": [["tile_y", "sp", [-1, 128, 1]], ["tile_x", "sp", [-1, 1, 1]], ["tile_k", "sp", [-1, 32]], ["auto_unroll_max_step", "ot", 16], ["unroll_explicit", "ot", 0]]}, "result": [[0.0001747118], 0, 1.0457470417022705, 1595232000.4946446], "version": 0.2, "tvm_version": "0.7.dev1"}
{"input": ["cuda -keys=cuda,gpu -max_num_threads=1024 -thread_warp_size=32", "batch_matmul.cuda", [["TENSOR", [1, 2048, 2048], "float32"], ["TENSOR", [1, 1, 2048], "float32"]], {}], "config": {"index": 7054, "code_hash": null, "entity": [["tile_y", "sp", [-1, 2, 8]], ["tile_x", "sp", [-1, 1, 1]], ["tile_k", "sp", [-1, 64]], ["auto_unroll_max_step", "ot", 64], ["unroll_explicit", "ot", 1]]}, "result": [[0.000457912], 0, 1.1838352680206299, 1595232001.2013967], "version": 0.2, "tvm_version": "0.7.dev1"}
{"input": ["cuda -keys=cuda,gpu -max_num_threads=1024 -thread_warp_size=32", "batch_matmul.cuda", [["TENSOR", [1, 2048, 2048], "float32"], ["TENSOR", [1, 1, 2048], "float32"]], {}], "config": {"index": 4051, "code_hash": null, "entity": [["tile_y", "sp", [-1, 2, 512]], ["tile_x", "sp", [-1, 1, 1]], ["tile_k", "sp", [-1, 8]], ["auto_unroll_max_step", "ot", 8], ["unroll_explicit", "ot", 1]]}, "result": [[0.0388646058], 0, 2.032095432281494, 1595232002.6326413], "version": 0.2, "tvm_version": "0.7.dev1"}
{"input": ["cuda -keys=cuda,gpu -max_num_threads=1024 -thread_warp_size=32", "batch_matmul.cuda", [["TENSOR", [1, 2048, 2048], "float32"], ["TENSOR", [1, 1, 2048], "float32"]], {}], "config": {"index": 4931, "code_hash": null, "entity": [["tile_y", "sp", [-1, 32, 2]], ["tile_x", "sp", [-1, 1, 1]], ["tile_k", "sp", [-1, 8]], ["auto_unroll_max_step", "ot", 16], ["unroll_explicit", "ot", 1]]}, "result": [[0.0003098682], 0, 0.8952460289001465, 1595232003.2768533], "version": 0.2, "tvm_version": "0.7.dev1"}
{"input": ["cuda -keys=cuda,gpu -max_num_threads=1024 -thread_warp_size=32", "batch_matmul.cuda", [["TENSOR", [1, 2048, 2048], "float32"], ["TENSOR", [1, 1, 2048], "float32"]], {}], "config": {"index": 288, "code_hash": null, "entity": [["tile_y", "sp", [-1, 16, 32]], ["tile_x", "sp", [-1, 1, 1]], ["tile_k", "sp", [-1, 8]], ["auto_unroll_max_step", "ot", 8], ["unroll_explicit", "ot", 0]]}, "result": [[0.0039459738000000005], 0, 1.0376145839691162, 1595232004.0017228], "version": 0.2, "tvm_version": "0.7.dev1"}
{"input": ["cuda -keys=cuda,gpu -max_num_threads=1024 -thread_warp_size=32", "batch_matmul.cuda", [["TENSOR", [1, 2048, 2048], "float32"], ["TENSOR", [1, 1, 2048], "float32"]], {}], "config": {"index": 5463, "code_hash": null, "entity": [["tile_y", "sp", [-1, 8, 1]], ["tile_x", "sp", [-1, 1, 1]], ["tile_k", "sp", [-1, 1024]], ["auto_unroll_max_step", "ot", 16], ["unroll_explicit", "ot", 1]]}, "result": [[0.0005591086], 0, 1.0429761409759521, 1595232004.7150638], "version": 0.2, "tvm_version": "0.7.dev1"}
{"input": ["cuda -keys=cuda,gpu -max_num_threads=1024 -thread_warp_size=32", "batch_matmul.cuda", [["TENSOR", [1, 2048, 2048], "float32"], ["TENSOR", [1, 1, 2048], "float32"]], {}], "config": {"index": 39, "code_hash": null, "entity": [["tile_y", "sp", [-1, 64, 8]], ["tile_x", "sp", [-1, 1, 1]], ["tile_k", "sp", [-1, 1]], ["auto_unroll_max_step", "ot", 8], ["unroll_explicit", "ot", 0]]}, "result": [[0.0012945959999999999], 0, 1.049384593963623, 1595232005.3975542], "version": 0.2, "tvm_version": "0.7.dev1"}
{"input": ["cuda -keys=cuda,gpu -max_num_threads=1024 -thread_warp_size=32", "batch_matmul.cuda", [["TENSOR", [1, 2048, 2048], "float32"], ["TENSOR", [1, 1, 2048], "float32"]], {}], "config": {"index": 6599, "code_hash": null, "entity": [["tile_y", "sp", [-1, 32, 16]], ["tile_x", "sp", [-1, 1, 1]], ["tile_k", "sp", [-1, 1]], ["auto_unroll_max_step", "ot", 64], ["unroll_explicit", "ot", 1]]}, "result": [[0.0017328968], 0, 1.1191949844360352, 1595232006.1968288], "version": 0.2, "tvm_version": "0.7.dev1"}
{"input": ["cuda -keys=cuda,gpu -max_num_threads=1024 -thread_warp_size=32", "batch_matmul.cuda", [["TENSOR", [1, 2048, 2048], "float32"], ["TENSOR", [1, 1, 2048], "float32"]], {}], "config": {"index": 5406, "code_hash": null, "entity": [["tile_y", "sp", [-1, 2, 4]], ["tile_x", "sp", [-1, 1, 1]], ["tile_k", "sp", [-1, 512]], ["auto_unroll_max_step", "ot", 16], ["unroll_explicit", "ot", 1]]}, "result": [[0.0007324724], 0, 1.1175310611724854, 1595232462.3981686], "version": 0.2, "tvm_version": "0.7.dev1"}
{"input": ["cuda -keys=cuda,gpu -max_num_threads=1024 -thread_warp_size=32", "batch_matmul.cuda", [["TENSOR", [1, 2048, 2048], "float32"], ["TENSOR", [1, 1, 2048], "float32"]], {}], "config": {"index": 448, "code_hash": null, "entity": [["tile_y", "sp", [-1, 2, 64]], ["tile_x", "sp", [-1, 1, 1]], ["tile_k", "sp", [-1, 32]], ["auto_unroll_max_step", "ot", 8], ["unroll_explicit", "ot", 0]]}, "result": [[0.0021923526], 0, 1.1113972663879395, 1595232463.1180513], "version": 0.2, "tvm_version": "0.7.dev1"}
{"input": ["cuda -keys=cuda,gpu -max_num_threads=1024 -thread_warp_size=32", "batch_matmul.cuda", [["TENSOR", [1, 2048, 2048], "float32"], ["TENSOR", [1, 1, 2048], "float32"]], {}], "config": {"index": 4877, "code_hash": null, "entity": [["tile_y", "sp", [-1, 256, 8]], ["tile_x", "sp", [-1, 1, 1]], ["tile_k", "sp", [-1, 4]], ["auto_unroll_max_step", "ot", 16], ["unroll_explicit", "ot", 1]]}, "result": [[0.0025631882], 0, 1.0844173431396484, 1595232463.9781215], "version": 0.2, "tvm_version": "0.7.dev1"}
{"input": ["cuda -keys=cuda,gpu -max_num_threads=1024 -thread_warp_size=32", "batch_matmul.cuda", [["TENSOR", [1, 2048, 2048], "float32"], ["TENSOR", [1, 1, 2048], "float32"]], {}], "config": {"index": 4146, "code_hash": null, "entity": [["tile_y", "sp", [-1, 1, 2]], ["tile_x", "sp", [-1, 1, 1]], ["tile_k", "sp", [-1, 32]], ["auto_unroll_max_step", "ot", 8], ["unroll_explicit", "ot", 1]]}, "result": [[0.0007556802], 0, 1.9378721714019775, 1595232465.5226467], "version": 0.2, "tvm_version": "0.7.dev1"}
{"input": ["cuda -keys=cuda,gpu -max_num_threads=1024 -thread_warp_size=32", "batch_matmul.cuda", [["TENSOR", [1, 2048, 2048], "float32"], ["TENSOR", [1, 1, 2048], "float32"]], {}], "config": {"index": 356, "code_hash": null, "entity": [["tile_y", "sp", [-1, 4, 16]], ["tile_x", "sp", [-1, 1, 1]], ["tile_k", "sp", [-1, 16]], ["auto_unroll_max_step", "ot", 8], ["unroll_explicit", "ot", 0]]}, "result": [[0.0008591084000000001], 0, 1.0561439990997314, 1595232466.2749345], "version": 0.2, "tvm_version": "0.7.dev1"}
{"input": ["cuda -keys=cuda,gpu -max_num_threads=1024 -thread_warp_size=32", "batch_matmul.cuda", [["TENSOR", [1, 2048, 2048], "float32"], ["TENSOR", [1, 1, 2048], "float32"]], {}], "config": {"index": 81, "code_hash": null, "entity": [["tile_y", "sp", [-1, 8, 1]], ["tile_x", "sp", [-1, 1, 1]], ["tile_k", "sp", [-1, 2]], ["auto_unroll_max_step", "ot", 8], ["unroll_explicit", "ot", 0]]}, "result": [[0.0003291212], 0, 0.9970424175262451, 1595232466.8852432], "version": 0.2, "tvm_version": "0.7.dev1"}
{"input": ["cuda -keys=cuda,gpu -max_num_threads=1024 -thread_warp_size=32", "batch_matmul.cuda", [["TENSOR", [1, 2048, 2048], "float32"], ["TENSOR", [1, 1, 2048], "float32"]], {}], "config": {"index": 6568, "code_hash": null, "entity": [["tile_y", "sp", [-1, 16, 2]], ["tile_x", "sp", [-1, 1, 1]], ["tile_k", "sp", [-1, 1]], ["auto_unroll_max_step", "ot", 64], ["unroll_explicit", "ot", 1]]}, "result": [[0.00048706460000000004], 0, 0.9384772777557373, 1595232467.5683374], "version": 0.2, "tvm_version": "0.7.dev1"}
{"input": ["cuda -keys=cuda,gpu -max_num_threads=1024 -thread_warp_size=32", "batch_matmul.cuda", [["TENSOR", [1, 2048, 2048], "float32"], ["TENSOR", [1, 1, 2048], "float32"]], {}], "config": {"index": 3057, "code_hash": null, "entity": [["tile_y", "sp", [-1, 8, 2]], ["tile_x", "sp", [-1, 1, 1]], ["tile_k", "sp", [-1, 8]], ["auto_unroll_max_step", "ot", 64], ["unroll_explicit", "ot", 0]]}, "result": [[0.00024588560000000004], 0, 0.9893174171447754, 1595232468.1909997], "version": 0.2, "tvm_version": "0.7.dev1"}
{"input": ["cuda -keys=cuda,gpu -max_num_threads=1024 -thread_warp_size=32", "batch_matmul.cuda", [["TENSOR", [1, 2048, 2048], "float32"], ["TENSOR", [1, 1, 2048], "float32"]], {}], "config": {"index": 1085, "code_hash": null, "entity": [["tile_y", "sp", [-1, 8, 256]], ["tile_x", "sp", [-1, 1, 1]], ["tile_k", "sp", [-1, 2]], ["auto_unroll_max_step", "ot", 16], ["unroll_explicit", "ot", 0]]}, "result": [[0.0233152576], 0, 1.2994611263275146, 1595232469.1872106], "version": 0.2, "tvm_version": "0.7.dev1"}
{"input": ["cuda -keys=cuda,gpu -max_num_threads=1024 -thread_warp_size=32", "batch_matmul.cuda", [["TENSOR", [1, 2048, 2048], "float32"], ["TENSOR", [1, 1, 2048], "float32"]], {}], "config": {"index": 1326, "code_hash": null, "entity": [["tile_y", "sp", [-1, 1, 1]], ["tile_x", "sp", [-1, 1, 1]], ["tile_k", "sp", [-1, 32]], ["auto_unroll_max_step", "ot", 16], ["unroll_explicit", "ot", 0]]}, "result": [[0.0005148452000000001], 0, 1.0561623573303223, 1595232469.8803618], "version": 0.2, "tvm_version": "0.7.dev1"}
{"input": ["cuda -keys=cuda,gpu -max_num_threads=1024 -thread_warp_size=32", "batch_matmul.cuda", [["TENSOR", [1, 2048, 2048], "float32"], ["TENSOR", [1, 1, 2048], "float32"]], {}], "config": {"index": 4806, "code_hash": null, "entity": [["tile_y", "sp", [-1, 64, 16]], ["tile_x", "sp", [-1, 1, 1]], ["tile_k", "sp", [-1, 2]], ["auto_unroll_max_step", "ot", 16], ["unroll_explicit", "ot", 1]]}, "result": [[0.0024227800000000002], 0, 1.0187735557556152, 1595232560.264508], "version": 0.2, "tvm_version": "0.7.dev1"}
{"input": ["cuda -keys=cuda,gpu -max_num_threads=1024 -thread_warp_size=32", "batch_matmul.cuda", [["TENSOR", [1, 2048, 2048], "float32"], ["TENSOR", [1, 1, 2048], "float32"]], {}], "config": {"index": 7258, "code_hash": null, "entity": [["tile_y", "sp", [-1, 16, 1]], ["tile_x", "sp", [-1, 1, 1]], ["tile_k", "sp", [-1, 512]], ["auto_unroll_max_step", "ot", 64], ["unroll_explicit", "ot", 1]]}, "result": [[0.0004741742], 0, 1.0156280994415283, 1595232560.9268312], "version": 0.2, "tvm_version": "0.7.dev1"}
{"input": ["cuda -keys=cuda,gpu -max_num_threads=1024 -thread_warp_size=32", "batch_matmul.cuda", [["TENSOR", [1, 2048, 2048], "float32"], ["TENSOR", [1, 1, 2048], "float32"]], {}], "config": {"index": 3319, "code_hash": null, "entity": [["tile_y", "sp", [-1, 2, 16]], ["tile_x", "sp", [-1, 1, 1]], ["tile_k", "sp", [-1, 64]], ["auto_unroll_max_step", "ot", 64], ["unroll_explicit", "ot", 0]]}, "result": [[0.0011450106], 0, 1.1572470664978027, 1595232561.6829174], "version": 0.2, "tvm_version": "0.7.dev1"}
{"input": ["cuda -keys=cuda,gpu -max_num_threads=1024 -thread_warp_size=32", "batch_matmul.cuda", [["TENSOR", [1, 2048, 2048], "float32"], ["TENSOR", [1, 1, 2048], "float32"]], {}], "config": {"index": 6606, "code_hash": null, "entity": [["tile_y", "sp", [-1, 16, 32]], ["tile_x", "sp", [-1, 1, 1]], ["tile_k", "sp", [-1, 1]], ["auto_unroll_max_step", "ot", 64], ["unroll_explicit", "ot", 1]]}, "result": [[0.0031526400000000004], 0, 1.1126794815063477, 1595232562.379786], "version": 0.2, "tvm_version": "0.7.dev1"}
{"input": ["cuda -keys=cuda,gpu -max_num_threads=1024 -thread_warp_size=32", "batch_matmul.cuda", [["TENSOR", [1, 2048, 2048], "float32"], ["TENSOR", [1, 1, 2048], "float32"]], {}], "config": {"index": 5050, "code_hash": null, "entity": [["tile_y", "sp", [-1, 2, 64]], ["tile_x", "sp", [-1, 1, 1]], ["tile_k", "sp", [-1, 16]], ["auto_unroll_max_step", "ot", 16], ["unroll_explicit", "ot", 1]]}, "result": [[0.0038301036], 0, 1.1568424701690674, 1595232563.1453784], "version": 0.2, "tvm_version": "0.7.dev1"}
{"input": ["cuda -keys=cuda,gpu -max_num_threads=1024 -thread_warp_size=32", "batch_matmul.cuda", [["TENSOR", [1, 2048, 2048], "float32"], ["TENSOR", [1, 1, 2048], "float32"]], {}], "config": {"index": 6101, "code_hash": null, "entity": [["tile_y", "sp", [-1, 32, 2]], ["tile_x", "sp", [-1, 1, 1]], ["tile_k", "sp", [-1, 64]], ["auto_unroll_max_step", "ot", 32], ["unroll_explicit", "ot", 1]]}, "result": [[0.0003115028], 0, 1.1166179180145264, 1595232563.8272943], "version": 0.2, "tvm_version": "0.7.dev1"}
{"input": ["cuda -keys=cuda,gpu -max_num_threads=1024 -thread_warp_size=32", "batch_matmul.cuda", [["TENSOR", [1, 2048, 2048], "float32"], ["TENSOR", [1, 1, 2048], "float32"]], {}], "config": {"index": 5039, "code_hash": null, "entity": [["tile_y", "sp", [-1, 32, 16]], ["tile_x", "sp", [-1, 1, 1]], ["tile_k", "sp", [-1, 16]], ["auto_unroll_max_step", "ot", 16], ["unroll_explicit", "ot", 1]]}, "result": [[0.0014857488000000001], 0, 1.2300078868865967, 1595232564.6190493], "version": 0.2, "tvm_version": "0.7.dev1"}
{"input": ["cuda -keys=cuda,gpu -max_num_threads=1024 -thread_warp_size=32", "batch_matmul.cuda", [["TENSOR", [1, 2048, 2048], "float32"], ["TENSOR", [1, 1, 2048], "float32"]], {}], "config": {"index": 5953, "code_hash": null, "entity": [["tile_y", "sp", [-1, 4, 4]], ["tile_x", "sp", [-1, 1, 1]], ["tile_k", "sp", [-1, 16]], ["auto_unroll_max_step", "ot", 32], ["unroll_explicit", "ot", 1]]}, "result": [[0.0003052438], 0, 1.0229742527008057, 1595232565.2766154], "version": 0.2, "tvm_version": "0.7.dev1"}
{"input": ["cuda -keys=cuda,gpu -max_num_threads=1024 -thread_warp_size=32", "batch_matmul.cuda", [["TENSOR", [1, 2048, 2048], "float32"], ["TENSOR", [1, 1, 2048], "float32"]], {}], "config": {"index": 3828, "code_hash": null, "entity": [["tile_y", "sp", [-1, 64, 1]], ["tile_x", "sp", [-1, 1, 1]], ["tile_k", "sp", [-1, 2]], ["auto_unroll_max_step", "ot", 8], ["unroll_explicit", "ot", 1]]}, "result": [[0.0003424384], 0, 0.9410371780395508, 1595232565.8930006], "version": 0.2, "tvm_version": "0.7.dev1"}
{"input": ["cuda -keys=cuda,gpu -max_num_threads=1024 -thread_warp_size=32", "batch_matmul.cuda", [["TENSOR", [1, 2048, 2048], "float32"], ["TENSOR", [1, 1, 2048], "float32"]], {}], "config": {"index": 1980, "code_hash": null, "entity": [["tile_y", "sp", [-1, 128, 4]], ["tile_x", "sp", [-1, 1, 1]], ["tile_k", "sp", [-1, 2]], ["auto_unroll_max_step", "ot", 32], ["unroll_explicit", "ot", 0]]}, "result": [[0.0009693982000000001], 0, 1.0047259330749512, 1595232566.588954], "version": 0.2, "tvm_version": "0.7.dev1"}
{"input": ["cuda -keys=cuda,gpu -max_num_threads=1024 -thread_warp_size=32", "batch_matmul.cuda", [["TENSOR", [1, 2048, 2048], "float32"], ["TENSOR", [1, 1, 2048], "float32"]], {}], "config": {"index": 547, "code_hash": null, "entity": [["tile_y", "sp", [-1, 2, 1]], ["tile_x", "sp", [-1, 1, 1]], ["tile_k", "sp", [-1, 128]], ["auto_unroll_max_step", "ot", 8], ["unroll_explicit", "ot", 0]]}, "result": [[0.00043024659999999995], 0, 0.982924222946167, 1595232567.3204982], "version": 0.2, "tvm_version": "0.7.dev1"}
{"input": ["cuda -keys=cuda,gpu -max_num_threads=1024 -thread_warp_size=32", "batch_matmul.cuda", [["TENSOR", [1, 2048, 2048], "float32"], ["TENSOR", [1, 1, 2048], "float32"]], {}], "config": {"index": 6265, "code_hash": null, "entity": [["tile_y", "sp", [-1, 4, 4]], ["tile_x", "sp", [-1, 1, 1]], ["tile_k", "sp", [-1, 256]], ["auto_unroll_max_step", "ot", 32], ["unroll_explicit", "ot", 1]]}, "result": [[0.0003773576], 0, 0.9840643405914307, 1595232568.0597935], "version": 0.2, "tvm_version": "0.7.dev1"}
{"input": ["cuda -keys=cuda,gpu -max_num_threads=1024 -thread_warp_size=32", "batch_matmul.cuda", [["TENSOR", [1, 2048, 2048], "float32"], ["TENSOR", [1, 1, 2048], "float32"]], {}], "config": {"index": 2249, "code_hash": null, "entity": [["tile_y", "sp", [-1, 4, 128]], ["tile_x", "sp", [-1, 1, 1]], ["tile_k", "sp", [-1, 16]], ["auto_unroll_max_step", "ot", 32], ["unroll_explicit", "ot", 0]]}, "result": [[0.009486268400000001], 0, 1.3237309455871582, 1595232728.3580241], "version": 0.2, "tvm_version": "0.7.dev1"}
{"input": ["cuda -keys=cuda,gpu -max_num_threads=1024 -thread_warp_size=32", "batch_matmul.cuda", [["TENSOR", [1, 2048, 2048], "float32"], ["TENSOR", [1, 1, 2048], "float32"]], {}], "config": {"index": 6796, "code_hash": null, "entity": [["tile_y", "sp", [-1, 1024, 1]], ["tile_x", "sp", [-1, 1, 1]], ["tile_k", "sp", [-1, 8]], ["auto_unroll_max_step", "ot", 64], ["unroll_explicit", "ot", 1]]}, "result": [[0.0014219924], 0, 1.002601146697998, 1595232729.0124624], "version": 0.2, "tvm_version": "0.7.dev1"}
{"input": ["cuda -keys=cuda,gpu -max_num_threads=1024 -thread_warp_size=32", "batch_matmul.cuda", [["TENSOR", [1, 2048, 2048], "float32"], ["TENSOR", [1, 1, 2048], "float32"]], {}], "config": {"index": 2077, "code_hash": null, "entity": [["tile_y", "sp", [-1, 128, 16]], ["tile_x", "sp", [-1, 1, 1]], ["tile_k", "sp", [-1, 4]], ["auto_unroll_max_step", "ot", 32], ["unroll_explicit", "ot", 0]]}, "result": [[0.0024084608], 0, 1.1669325828552246, 1595232729.79516], "version": 0.2, "tvm_version": "0.7.dev1"}
{"input": ["cuda -keys=cuda,gpu -max_num_threads=1024 -thread_warp_size=32", "batch_matmul.cuda", [["TENSOR", [1, 2048, 2048], "float32"], ["TENSOR", [1, 1, 2048], "float32"]], {}], "config": {"index": 6882, "code_hash": null, "entity": [["tile_y", "sp", [-1, 64, 2]], ["tile_x", "sp", [-1, 1, 1]], ["tile_k", "sp", [-1, 16]], ["auto_unroll_max_step", "ot", 64], ["unroll_explicit", "ot", 1]]}, "result": [[0.000378887], 0, 1.053034782409668, 1595232730.4599862], "version": 0.2, "tvm_version": "0.7.dev1"}
{"input": ["cuda -keys=cuda,gpu -max_num_threads=1024 -thread_warp_size=32", "batch_matmul.cuda", [["TENSOR", [1, 2048, 2048], "float32"], ["TENSOR", [1, 1, 2048], "float32"]], {}], "config": {"index": 395, "code_hash": null, "entity": [["tile_y", "sp", [-1, 32, 1]], ["tile_x", "sp", [-1, 1, 1]], ["tile_k", "sp", [-1, 32]], ["auto_unroll_max_step", "ot", 8], ["unroll_explicit", "ot", 0]]}, "result": [[0.0001930368], 0, 1.0689435005187988, 1595232731.1264374], "version": 0.2, "tvm_version": "0.7.dev1"}
{"input": ["cuda -keys=cuda,gpu -max_num_threads=1024 -thread_warp_size=32", "batch_matmul.cuda", [["TENSOR", [1, 2048, 2048], "float32"], ["TENSOR", [1, 1, 2048], "float32"]], {}], "config": {"index": 6746, "code_hash": null, "entity": [["tile_y", "sp", [-1, 32, 8]], ["tile_x", "sp", [-1, 1, 1]], ["tile_k", "sp", [-1, 4]], ["auto_unroll_max_step", "ot", 64], ["unroll_explicit", "ot", 1]]}, "result": [[0.0011333914], 0, 1.0945594310760498, 1595232731.8890014], "version": 0.2, "tvm_version": "0.7.dev1"}
{"input": ["cuda -keys=cuda,gpu -max_num_threads=1024 -thread_warp_size=32", "batch_matmul.cuda", [["TENSOR", [1, 2048, 2048], "float32"], ["TENSOR", [1, 1, 2048], "float32"]], {}], "config": {"index": 2053, "code_hash": null, "entity": [["tile_y", "sp", [-1, 4, 4]], ["tile_x", "sp", [-1, 1, 1]], ["tile_k", "sp", [-1, 4]], ["auto_unroll_max_step", "ot", 32], ["unroll_explicit", "ot", 0]]}, "result": [[0.0003344674], 0, 1.08406662940979, 1595232732.585357], "version": 0.2, "tvm_version": "0.7.dev1"}
{"input": ["cuda -keys=cuda,gpu -max_num_threads=1024 -thread_warp_size=32", "batch_matmul.cuda", [["TENSOR", [1, 2048, 2048], "float32"], ["TENSOR", [1, 1, 2048], "float32"]], {}], "config": {"index": 5176, "code_hash": null, "entity": [["tile_y", "sp", [-1, 32, 4]], ["tile_x", "sp", [-1, 1, 1]], ["tile_k", "sp", [-1, 64]], ["auto_unroll_max_step", "ot", 16], ["unroll_explicit", "ot", 1]]}, "result": [[0.0003686664], 0, 1.0807366371154785, 1595232733.3138134], "version": 0.2, "tvm_version": "0.7.dev1"}
{"input": ["cuda -keys=cuda,gpu -max_num_threads=1024 -thread_warp_size=32", "batch_matmul.cuda", [["TENSOR", [1, 2048, 2048], "float32"], ["TENSOR", [1, 1, 2048], "float32"]], {}], "config": {"index": 4290, "code_hash": null, "entity": [["tile_y", "sp", [-1, 1, 1]], ["tile_x", "sp", [-1, 1, 1]], ["tile_k", "sp", [-1, 128]], ["auto_unroll_max_step", "ot", 8], ["unroll_explicit", "ot", 1]]}, "result": [[0.0007892092], 0, 1.4148163795471191, 1595232734.4912684], "version": 0.2, "tvm_version": "0.7.dev1"}
{"input": ["cuda -keys=cuda,gpu -max_num_threads=1024 -thread_warp_size=32", "batch_matmul.cuda", [["TENSOR", [1, 2048, 2048], "float32"], ["TENSOR", [1, 1, 2048], "float32"]], {}], "config": {"index": 7279, "code_hash": null, "entity": [["tile_y", "sp", [-1, 4, 4]], ["tile_x", "sp", [-1, 1, 1]], ["tile_k", "sp", [-1, 512]], ["auto_unroll_max_step", "ot", 64], ["unroll_explicit", "ot", 1]]}, "result": [[0.0010816132], 0, 0.9582698345184326, 1595232735.1014056], "version": 0.2, "tvm_version": "0.7.dev1"}
{"input": ["cuda -keys=cuda,gpu -max_num_threads=1024 -thread_warp_size=32", "batch_matmul.cuda", [["TENSOR", [1, 2048, 2048], "float32"], ["TENSOR", [1, 1, 2048], "float32"]], {}], "config": {"index": 1090, "code_hash": null, "entity": [["tile_y", "sp", [-1, 2, 1024]], ["tile_x", "sp", [-1, 1, 1]], ["tile_k", "sp", [-1, 2]], ["auto_unroll_max_step", "ot", 16], ["unroll_explicit", "ot", 0]]}, "result": [[0.07041565], 0, 2.3309710025787354, 1595232737.006605], "version": 0.2, "tvm_version": "0.7.dev1"}
{"input": ["cuda -keys=cuda,gpu -max_num_threads=1024 -thread_warp_size=32", "batch_matmul.cuda", [["TENSOR", [1, 2048, 2048], "float32"], ["TENSOR", [1, 1, 2048], "float32"]], {}], "config": {"index": 2070, "code_hash": null, "entity": [["tile_y", "sp", [-1, 1, 16]], ["tile_x", "sp", [-1, 1, 1]], ["tile_k", "sp", [-1, 4]], ["auto_unroll_max_step", "ot", 32], ["unroll_explicit", "ot", 0]]}, "result": [[0.000596984], 0, 0.9881422519683838, 1595232737.7265363], "version": 0.2, "tvm_version": "0.7.dev1"}
{"input": ["cuda -keys=cuda,gpu -max_num_threads=1024 -thread_warp_size=32", "batch_matmul.cuda", [["TENSOR", [1, 2048, 2048], "float32"], ["TENSOR", [1, 1, 2048], "float32"]], {}], "config": {"index": 70, "code_hash": null, "entity": [["tile_y", "sp", [-1, 4, 256]], ["tile_x", "sp", [-1, 1, 1]], ["tile_k", "sp", [-1, 1]], ["auto_unroll_max_step", "ot", 8], ["unroll_explicit", "ot", 0]]}, "result": [[0.0180321178], 0, 1.295313835144043, 1595232738.6557128], "version": 0.2, "tvm_version": "0.7.dev1"}
{"input": ["cuda -keys=cuda,gpu -max_num_threads=1024 -thread_warp_size=32", "batch_matmul.cuda", [["TENSOR", [1, 2048, 2048], "float32"], ["TENSOR", [1, 1, 2048], "float32"]], {}], "config": {"index": 6023, "code_hash": null, "entity": [["tile_y", "sp", [-1, 32, 2]], ["tile_x", "sp", [-1, 1, 1]], ["tile_k", "sp", [-1, 32]], ["auto_unroll_max_step", "ot", 32], ["unroll_explicit", "ot", 1]]}, "result": [[0.0002596028], 0, 1.0111069679260254, 1595232739.269904], "version": 0.2, "tvm_version": "0.7.dev1"}
{"input": ["cuda -keys=cuda,gpu -max_num_threads=1024 -thread_warp_size=32", "batch_matmul.cuda", [["TENSOR", [1, 2048, 2048], "float32"], ["TENSOR", [1, 1, 2048], "float32"]], {}], "config": {"index": 1884, "code_hash": null, "entity": [["tile_y", "sp", [-1, 1, 2]], ["tile_x", "sp", [-1, 1, 1]], ["tile_k", "sp", [-1, 1]], ["auto_unroll_max_step", "ot", 32], ["unroll_explicit", "ot", 0]]}, "result": [[0.0010471082], 0, 1.0163929462432861, 1595232788.0595696], "version": 0.2, "tvm_version": "0.7.dev1"}
{"input": ["cuda -keys=cuda,gpu -max_num_threads=1024 -thread_warp_size=32", "batch_matmul.cuda", [["TENSOR", [1, 2048, 2048], "float32"], ["TENSOR", [1, 1, 2048], "float32"]], {}], "config": {"index": 5193, "code_hash": null, "entity": [["tile_y", "sp", [-1, 8, 16]], ["tile_x", "sp", [-1, 1, 1]], ["tile_k", "sp", [-1, 64]], ["auto_unroll_max_step", "ot", 16], ["unroll_explicit", "ot", 1]]}, "result": [[0.0011185224], 0, 1.105299472808838, 1595232788.8118987], "version": 0.2, "tvm_version": "0.7.dev1"}
{"input": ["cuda -keys=cuda,gpu -max_num_threads=1024 -thread_warp_size=32", "batch_matmul.cuda", [["TENSOR", [1, 2048, 2048], "float32"], ["TENSOR", [1, 1, 2048], "float32"]], {}], "config": {"index": 319, "code_hash": null, "entity": [["tile_y", "sp", [-1, 128, 1]], ["tile_x", "sp", [-1, 1, 1]], ["tile_k", "sp", [-1, 16]], ["auto_unroll_max_step", "ot", 8], ["unroll_explicit", "ot", 0]]}, "result": [[0.0002457554], 0, 1.166367769241333, 1595232789.7676795], "version": 0.2, "tvm_version": "0.7.dev1"}
{"input": ["cuda -keys=cuda,gpu -max_num_threads=1024 -thread_warp_size=32", "batch_matmul.cuda", [["TENSOR", [1, 2048, 2048], "float32"], ["TENSOR", [1, 1, 2048], "float32"]], {}], "config": {"index": 3437, "code_hash": null, "entity": [["tile_y", "sp", [-1, 32, 1]], ["tile_x", "sp", [-1, 1, 1]], ["tile_k", "sp", [-1, 256]], ["auto_unroll_max_step", "ot", 64], ["unroll_explicit", "ot", 0]]}, "result": [[0.0003974992], 0, 1.1157453060150146, 1595232790.4654918], "version": 0.2, "tvm_version": "0.7.dev1"}
{"input": ["cuda -keys=cuda,gpu -max_num_threads=1024 -thread_warp_size=32", "batch_matmul.cuda", [["TENSOR", [1, 2048, 2048], "float32"], ["TENSOR", [1, 1, 2048], "float32"]], {}], "config": {"index": 2991, "code_hash": null, "entity": [["tile_y", "sp", [-1, 16, 4]], ["tile_x", "sp", [-1, 1, 1]], ["tile_k", "sp", [-1, 4]], ["auto_unroll_max_step", "ot", 64], ["unroll_explicit", "ot", 0]]}, "result": [[0.00048680260000000003], 0, 1.0151727199554443, 1595232791.0970886], "version": 0.2, "tvm_version": "0.7.dev1"}
{"input": ["cuda -keys=cuda,gpu -max_num_threads=1024 -thread_warp_size=32", "batch_matmul.cuda", [["TENSOR", [1, 2048, 2048], "float32"], ["TENSOR", [1, 1, 2048], "float32"]], {}], "config": {"index": 5012, "code_hash": null, "entity": [["tile_y", "sp", [-1, 256, 2]], ["tile_x", "sp", [-1, 1, 1]], ["tile_k", "sp", [-1, 16]], ["auto_unroll_max_step", "ot", 16], ["unroll_explicit", "ot", 1]]}, "result": [[0.0006641342], 0, 1.1295511722564697, 1595232791.9149854], "version": 0.2, "tvm_version": "0.7.dev1"}
{"input": ["cuda -keys=cuda,gpu -max_num_threads=1024 -thread_warp_size=32", "batch_matmul.cuda", [["TENSOR", [1, 2048, 2048], "float32"], ["TENSOR", [1, 1, 2048], "float32"]], {}], "config": {"index": 2655, "code_hash": null, "entity": [["tile_y", "sp", [-1, 8, 1]], ["tile_x", "sp", [-1, 1, 1]], ["tile_k", "sp", [-1, 1024]], ["auto_unroll_max_step", "ot", 32], ["unroll_explicit", "ot", 0]]}, "result": [[0.0006861552], 0, 0.9727017879486084, 1595232792.5082254], "version": 0.2, "tvm_version": "0.7.dev1"}
{"input": ["cuda -keys=cuda,gpu -max_num_threads=1024 -thread_warp_size=32", "batch_matmul.cuda", [["TENSOR", [1, 2048, 2048], "float32"], ["TENSOR", [1, 1, 2048], "float32"]], {}], "config": {"index": 6558, "code_hash": null, "entity": [["tile_y", "sp", [-1, 64, 1]], ["tile_x", "sp", [-1, 1, 1]], ["tile_k", "sp", [-1, 1]], ["auto_unroll_max_step", "ot", 64], ["unroll_explicit", "ot", 1]]}, "result": [[0.0005132312], 0, 0.9054150581359863, 1595232793.2154303], "version": 0.2, "tvm_version": "0.7.dev1"}
{"input": ["cuda -keys=cuda,gpu -max_num_threads=1024 -thread_warp_size=32", "batch_matmul.cuda", [["TENSOR", [1, 2048, 2048], "float32"], ["TENSOR", [1, 1, 2048], "float32"]], {}], "config": {"index": 1449, "code_hash": null, "entity": [["tile_y", "sp", [-1, 8, 16]], ["tile_x", "sp", [-1, 1, 1]], ["tile_k", "sp", [-1, 64]], ["auto_unroll_max_step", "ot", 16], ["unroll_explicit", "ot", 0]]}, "result": [[0.0017040561999999999], 0, 0.9839773178100586, 1595232793.9824355], "version": 0.2, "tvm_version": "0.7.dev1"}
{"input": ["cuda -keys=cuda,gpu -max_num_threads=1024 -thread_warp_size=32", "batch_matmul.cuda", [["TENSOR", [1, 2048, 2048], "float32"], ["TENSOR", [1, 1, 2048], "float32"]], {}], "config": {"index": 4996, "code_hash": null, "entity": [["tile_y", "sp", [-1, 16, 1]], ["tile_x", "sp", [-1, 1, 1]], ["tile_k", "sp", [-1, 16]], ["auto_unroll_max_step", "ot", 16], ["unroll_explicit", "ot", 1]]}, "result": [[0.0001689878], 0, 1.0642218589782715, 1595232794.7533479], "version": 0.2, "tvm_version": "0.7.dev1"}
{"input": ["cuda -keys=cuda,gpu -max_num_threads=1024 -thread_warp_size=32", "batch_matmul.cuda", [["TENSOR", [1, 2048, 2048], "float32"], ["TENSOR", [1, 1, 2048], "float32"]], {}], "config": {"index": 5848, "code_hash": null, "entity": [["tile_y", "sp", [-1, 2, 1024]], ["tile_x", "sp", [-1, 1, 1]], ["tile_k", "sp", [-1, 4]], ["auto_unroll_max_step", "ot", 32], ["unroll_explicit", "ot", 1]]}, "result": [[0.07237066340000001], 0, 2.453761100769043, 1595233219.179243], "version": 0.2, "tvm_version": "0.7.dev1"}
{"input": ["cuda -keys=cuda,gpu -max_num_threads=1024 -thread_warp_size=32", "batch_matmul.cuda", [["TENSOR", [1, 2048, 2048], "float32"], ["TENSOR", [1, 1, 2048], "float32"]], {}], "config": {"index": 1257, "code_hash": null, "entity": [["tile_y", "sp", [-1, 512, 1]], ["tile_x", "sp", [-1, 1, 1]], ["tile_k", "sp", [-1, 16]], ["auto_unroll_max_step", "ot", 16], ["unroll_explicit", "ot", 0]]}, "result": [[0.000608893], 0, 1.0641038417816162, 1595233219.805246], "version": 0.2, "tvm_version": "0.7.dev1"}
{"input": ["cuda -keys=cuda,gpu -max_num_threads=1024 -thread_warp_size=32", "batch_matmul.cuda", [["TENSOR", [1, 2048, 2048], "float32"], ["TENSOR", [1, 1, 2048], "float32"]], {}], "config": {"index": 1165, "code_hash": null, "entity": [["tile_y", "sp", [-1, 2, 512]], ["tile_x", "sp", [-1, 1, 1]], ["tile_k", "sp", [-1, 4]], ["auto_unroll_max_step", "ot", 16], ["unroll_explicit", "ot", 0]]}, "result": [[0.0375388092], 0, 1.8441088199615479, 1595233221.1497936], "version": 0.2, "tvm_version": "0.7.dev1"}
{"input": ["cuda -keys=cuda,gpu -max_num_threads=1024 -thread_warp_size=32", "batch_matmul.cuda", [["TENSOR", [1, 2048, 2048], "float32"], ["TENSOR", [1, 1, 2048], "float32"]], {}], "config": {"index": 6589, "code_hash": null, "entity": [["tile_y", "sp", [-1, 16, 8]], ["tile_x", "sp", [-1, 1, 1]], ["tile_k", "sp", [-1, 1]], ["auto_unroll_max_step", "ot", 64], ["unroll_explicit", "ot", 1]]}, "result": [[0.0005278926], 0, 1.0726444721221924, 1595233221.8298311], "version": 0.2, "tvm_version": "0.7.dev1"}
{"input": ["cuda -keys=cuda,gpu -max_num_threads=1024 -thread_warp_size=32", "batch_matmul.cuda", [["TENSOR", [1, 2048, 2048], "float32"], ["TENSOR", [1, 1, 2048], "float32"]], {}], "config": {"index": 319, "code_hash": null, "entity": [["tile_y", "sp", [-1, 128, 1]], ["tile_x", "sp", [-1, 1, 1]], ["tile_k", "sp", [-1, 16]], ["auto_unroll_max_step", "ot", 8], ["unroll_explicit", "ot", 0]]}, "result": [[0.00019941500000000001], 0, 0.9957897663116455, 1595233222.4437644], "version": 0.2, "tvm_version": "0.7.dev1"}
{"input": ["cuda -keys=cuda,gpu -max_num_threads=1024 -thread_warp_size=32", "batch_matmul.cuda", [["TENSOR", [1, 2048, 2048], "float32"], ["TENSOR", [1, 1, 2048], "float32"]], {}], "config": {"index": 6879, "code_hash": null, "entity": [["tile_y", "sp", [-1, 8, 2]], ["tile_x", "sp", [-1, 1, 1]], ["tile_k", "sp", [-1, 16]], ["auto_unroll_max_step", "ot", 64], ["unroll_explicit", "ot", 1]]}, "result": [[0.00018223460000000002], 0, 1.1858136653900146, 1595233223.3343651], "version": 0.2, "tvm_version": "0.7.dev1"}
{"input": ["cuda -keys=cuda,gpu -max_num_threads=1024 -thread_warp_size=32", "batch_matmul.cuda", [["TENSOR", [1, 2048, 2048], "float32"], ["TENSOR", [1, 1, 2048], "float32"]], {}], "config": {"index": 6933, "code_hash": null, "entity": [["tile_y", "sp", [-1, 2, 256]], ["tile_x", "sp", [-1, 1, 1]], ["tile_k", "sp", [-1, 16]], ["auto_unroll_max_step", "ot", 64], ["unroll_explicit", "ot", 1]]}, "result": [[0.0250002116], 0, 1.825441598892212, 1595233224.7185504], "version": 0.2, "tvm_version": "0.7.dev1"}
{"input": ["cuda -keys=cuda,gpu -max_num_threads=1024 -thread_warp_size=32", "batch_matmul.cuda", [["TENSOR", [1, 2048, 2048], "float32"], ["TENSOR", [1, 1, 2048], "float32"]], {}], "config": {"index": 2397, "code_hash": null, "entity": [["tile_y", "sp", [-1, 1, 64]], ["tile_x", "sp", [-1, 1, 1]], ["tile_k", "sp", [-1, 64]], ["auto_unroll_max_step", "ot", 32], ["unroll_explicit", "ot", 0]]}, "result": [[0.003168873], 0, 1.0301806926727295, 1595233225.530228], "version": 0.2, "tvm_version": "0.7.dev1"}
{"input": ["cuda -keys=cuda,gpu -max_num_threads=1024 -thread_warp_size=32", "batch_matmul.cuda", [["TENSOR", [1, 2048, 2048], "float32"], ["TENSOR", [1, 1, 2048], "float32"]], {}], "config": {"index": 5686, "code_hash": null, "entity": [["tile_y", "sp", [-1, 4, 256]], ["tile_x", "sp", [-1, 1, 1]], ["tile_k", "sp", [-1, 1]], ["auto_unroll_max_step", "ot", 32], ["unroll_explicit", "ot", 1]]}, "result": [[0.017998001], 0, 1.2852814197540283, 1595233226.4584496], "version": 0.2, "tvm_version": "0.7.dev1"}
{"input": ["cuda -keys=cuda,gpu -max_num_threads=1024 -thread_warp_size=32", "batch_matmul.cuda", [["TENSOR", [1, 2048, 2048], "float32"], ["TENSOR", [1, 1, 2048], "float32"]], {}], "config": {"index": 1410, "code_hash": null, "entity": [["tile_y", "sp", [-1, 64, 1]], ["tile_x", "sp", [-1, 1, 1]], ["tile_k", "sp", [-1, 64]], ["auto_unroll_max_step", "ot", 16], ["unroll_explicit", "ot", 0]]}, "result": [[0.0001529056], 0, 1.0111703872680664, 1595233227.2759204], "version": 0.2, "tvm_version": "0.7.dev1"}
{"input": ["cuda -keys=cuda,gpu -max_num_threads=1024 -thread_warp_size=32", "batch_matmul.cuda", [["TENSOR", [1, 2048, 2048], "float32"], ["TENSOR", [1, 1, 2048], "float32"]], {}], "config": {"index": 4800, "code_hash": null, "entity": [["tile_y", "sp", [-1, 1, 16]], ["tile_x", "sp", [-1, 1, 1]], ["tile_k", "sp", [-1, 2]], ["auto_unroll_max_step", "ot", 16], ["unroll_explicit", "ot", 1]]}, "result": [[0.0015331925999999998], 0, 1.095350742340088, 1595233248.1166868], "version": 0.2, "tvm_version": "0.7.dev1"}
