tvm/matmul_(64,2048,1,512).log
{"input": ["cuda -keys=cuda,gpu -max_num_threads=1024 -thread_warp_size=32", "batch_matmul.cuda", [["TENSOR", [64, 2048, 512], "float32"], ["TENSOR", [64, 1, 512], "float32"]], {}], "config": {"index": 4213, "code_hash": null, "entity": [["tile_y", "sp", [-1, 2, 1]], ["tile_x", "sp", [-1, 1, 1]], ["tile_k", "sp", [-1, 16]], ["auto_unroll_max_step", "ot", 16], ["unroll_explicit", "ot", 1]]}, "result": [[0.004128782381818181], 0, 1.884042739868164, 1595308123.2120047], "version": 0.2, "tvm_version": "0.7.dev1"}
{"input": ["cuda -keys=cuda,gpu -max_num_threads=1024 -thread_warp_size=32", "batch_matmul.cuda", [["TENSOR", [64, 2048, 512], "float32"], ["TENSOR", [64, 1, 512], "float32"]], {}], "config": {"index": 9, "code_hash": null, "entity": [["tile_y", "sp", [-1, 512, 1]], ["tile_x", "sp", [-1, 1, 1]], ["tile_k", "sp", [-1, 1]], ["auto_unroll_max_step", "ot", 8], ["unroll_explicit", "ot", 0]]}, "result": [[0.0022917851492537315], 0, 1.5426464080810547, 1595308124.3803306], "version": 0.2, "tvm_version": "0.7.dev1"}
{"input": ["cuda -keys=cuda,gpu -max_num_threads=1024 -thread_warp_size=32", "batch_matmul.cuda", [["TENSOR", [64, 2048, 512], "float32"], ["TENSOR", [64, 1, 512], "float32"]], {}], "config": {"index": 3203, "code_hash": null, "entity": [["tile_y", "sp", [-1, 32, 1]], ["tile_x", "sp", [-1, 1, 1]], ["tile_k", "sp", [-1, 2]], ["auto_unroll_max_step", "ot", 8], ["unroll_explicit", "ot", 1]]}, "result": [[0.001853807925925926], 0, 1.5113036632537842, 1595308125.514089], "version": 0.2, "tvm_version": "0.7.dev1"}
{"input": ["cuda -keys=cuda,gpu -max_num_threads=1024 -thread_warp_size=32", "batch_matmul.cuda", [["TENSOR", [64, 2048, 512], "float32"], ["TENSOR", [64, 1, 512], "float32"]], {}], "config": {"index": 4250, "code_hash": null, "entity": [["tile_y", "sp", [-1, 32, 8]], ["tile_x", "sp", [-1, 1, 1]], ["tile_k", "sp", [-1, 16]], ["auto_unroll_max_step", "ot", 16], ["unroll_explicit", "ot", 1]]}, "result": [[0.001298384623655914], 0, 2.0279836654663086, 1595308127.1667187], "version": 0.2, "tvm_version": "0.7.dev1"}
{"input": ["cuda -keys=cuda,gpu -max_num_threads=1024 -thread_warp_size=32", "batch_matmul.cuda", [["TENSOR", [64, 2048, 512], "float32"], ["TENSOR", [64, 1, 512], "float32"]], {}], "config": {"index": 5598, "code_hash": null, "entity": [["tile_y", "sp", [-1, 8, 64]], ["tile_x", "sp", [-1, 1, 1]], ["tile_k", "sp", [-1, 2]], ["auto_unroll_max_step", "ot", 64], ["unroll_explicit", "ot", 1]]}, "result": [[0.013116457416666666], 0, 1.7060770988464355, 1595308128.3573668], "version": 0.2, "tvm_version": "0.7.dev1"}
{"input": ["cuda -keys=cuda,gpu -max_num_threads=1024 -thread_warp_size=32", "batch_matmul.cuda", [["TENSOR", [64, 2048, 512], "float32"], ["TENSOR", [64, 1, 512], "float32"]], {}], "config": {"index": 5719, "code_hash": null, "entity": [["tile_y", "sp", [-1, 4, 4]], ["tile_x", "sp", [-1, 1, 1]], ["tile_k", "sp", [-1, 8]], ["auto_unroll_max_step", "ot", 64], ["unroll_explicit", "ot", 1]]}, "result": [[0.0021014926805555554], 0, 1.541243314743042, 1595308129.560305], "version": 0.2, "tvm_version": "0.7.dev1"}
{"input": ["cuda -keys=cuda,gpu -max_num_threads=1024 -thread_warp_size=32", "batch_matmul.cuda", [["TENSOR", [64, 2048, 512], "float32"], ["TENSOR", [64, 1, 512], "float32"]], {}], "config": {"index": 3180, "code_hash": null, "entity": [["tile_y", "sp", [-1, 8, 64]], ["tile_x", "sp", [-1, 1, 1]], ["tile_k", "sp", [-1, 1]], ["auto_unroll_max_step", "ot", 8], ["unroll_explicit", "ot", 1]]}, "result": [[0.025560757], 0, 1.68772292137146, 1595308130.829532], "version": 0.2, "tvm_version": "0.7.dev1"}
{"input": ["cuda -keys=cuda,gpu -max_num_threads=1024 -thread_warp_size=32", "batch_matmul.cuda", [["TENSOR", [64, 2048, 512], "float32"], ["TENSOR", [64, 1, 512], "float32"]], {}], "config": {"index": 5693, "code_hash": null, "entity": [["tile_y", "sp", [-1, 1, 2048]], ["tile_x", "sp", [-1, 1, 1]], ["tile_k", "sp", [-1, 4]], ["auto_unroll_max_step", "ot", 64], ["unroll_explicit", "ot", 1]]}, "result": [[0.08485816875], 0, 2.9126009941101074, 1595308133.170597], "version": 0.2, "tvm_version": "0.7.dev1"}
{"input": ["cuda -keys=cuda,gpu -max_num_threads=1024 -thread_warp_size=32", "batch_matmul.cuda", [["TENSOR", [64, 2048, 512], "float32"], ["TENSOR", [64, 1, 512], "float32"]], {}], "config": {"index": 2568, "code_hash": null, "entity": [["tile_y", "sp", [-1, 1, 512]], ["tile_x", "sp", [-1, 1, 1]], ["tile_k", "sp", [-1, 4]], ["auto_unroll_max_step", "ot", 64], ["unroll_explicit", "ot", 0]]}, "result": [[0.05783507575], 0, 2.088263988494873, 1595308134.7526479], "version": 0.2, "tvm_version": "0.7.dev1"}
{"input": ["cuda -keys=cuda,gpu -max_num_threads=1024 -thread_warp_size=32", "batch_matmul.cuda", [["TENSOR", [64, 2048, 512], "float32"], ["TENSOR", [64, 1, 512], "float32"]], {}], "config": {"index": 1820, "code_hash": null, "entity": [["tile_y", "sp", [-1, 8, 4]], ["tile_x", "sp", [-1, 1, 1]], ["tile_k", "sp", [-1, 8]], ["auto_unroll_max_step", "ot", 32], ["unroll_explicit", "ot", 0]]}, "result": [[0.002008132613333333], 0, 1.5495169162750244, 1595308135.8513703], "version": 0.2, "tvm_version": "0.7.dev1"}
{"input": ["cuda -keys=cuda,gpu -max_num_threads=1024 -thread_warp_size=32", "batch_matmul.cuda", [["TENSOR", [64, 2048, 512], "float32"], ["TENSOR", [64, 1, 512], "float32"]], {}], "config": {"index": 2909, "code_hash": null, "entity": [["tile_y", "sp", [-1, 1, 4]], ["tile_x", "sp", [-1, 1, 1]], ["tile_k", "sp", [-1, 128]], ["auto_unroll_max_step", "ot", 64], ["unroll_explicit", "ot", 0]]}, "result": [[0.0048340101875], 0, 2.043931722640991, 1595308137.4679813], "version": 0.2, "tvm_version": "0.7.dev1"}
{"input": ["cuda -keys=cuda,gpu -max_num_threads=1024 -thread_warp_size=32", "batch_matmul.cuda", [["TENSOR", [64, 2048, 512], "float32"], ["TENSOR", [64, 1, 512], "float32"]], {}], "config": {"index": 1758, "code_hash": null, "entity": [["tile_y", "sp", [-1, 1, 16]], ["tile_x", "sp", [-1, 1, 1]], ["tile_k", "sp", [-1, 4]], ["auto_unroll_max_step", "ot", 32], ["unroll_explicit", "ot", 0]]}, "result": [[0.004681921078431373], 0, 1.9634010791778564, 1595308139.1202364], "version": 0.2, "tvm_version": "0.7.dev1"}
{"input": ["cuda -keys=cuda,gpu -max_num_threads=1024 -thread_warp_size=32", "batch_matmul.cuda", [["TENSOR", [64, 2048, 512], "float32"], ["TENSOR", [64, 1, 512], "float32"]], {}], "config": {"index": 4012, "code_hash": null, "entity": [["tile_y", "sp", [-1, 2, 8]], ["tile_x", "sp", [-1, 1, 1]], ["tile_k", "sp", [-1, 2]], ["auto_unroll_max_step", "ot", 16], ["unroll_explicit", "ot", 1]]}, "result": [[0.002604724068965517], 0, 1.5449466705322266, 1595308140.209604], "version": 0.2, "tvm_version": "0.7.dev1"}
{"input": ["cuda -keys=cuda,gpu -max_num_threads=1024 -thread_warp_size=32", "batch_matmul.cuda", [["TENSOR", [64, 2048, 512], "float32"], ["TENSOR", [64, 1, 512], "float32"]], {}], "config": {"index": 1582, "code_hash": null, "entity": [["tile_y", "sp", [-1, 1024, 2]], ["tile_x", "sp", [-1, 1, 1]], ["tile_k", "sp", [-1, 1]], ["auto_unroll_max_step", "ot", 32], ["unroll_explicit", "ot", 0]]}, "result": [[0.021915089857142855], 0, 1.56895112991333, 1595308141.4842472], "version": 0.2, "tvm_version": "0.7.dev1"}
{"input": ["cuda -keys=cuda,gpu -max_num_threads=1024 -thread_warp_size=32", "batch_matmul.cuda", [["TENSOR", [64, 2048, 512], "float32"], ["TENSOR", [64, 1, 512], "float32"]], {}], "config": {"index": 4303, "code_hash": null, "entity": [["tile_y", "sp", [-1, 2, 2]], ["tile_x", "sp", [-1, 1, 1]], ["tile_k", "sp", [-1, 32]], ["auto_unroll_max_step", "ot", 16], ["unroll_explicit", "ot", 1]]}, "result": [[0.0036788453902439028], 0, 1.508704423904419, 1595308142.63609], "version": 0.2, "tvm_version": "0.7.dev1"}
{"input": ["cuda -keys=cuda,gpu -max_num_threads=1024 -thread_warp_size=32", "batch_matmul.cuda", [["TENSOR", [64, 2048, 512], "float32"], ["TENSOR", [64, 1, 512], "float32"]], {}], "config": {"index": 799, "code_hash": null, "entity": [["tile_y", "sp", [-1, 128, 2]], ["tile_x", "sp", [-1, 1, 1]], ["tile_k", "sp", [-1, 1]], ["auto_unroll_max_step", "ot", 16], ["unroll_explicit", "ot", 0]]}, "result": [[0.018656133444444445], 0, 1.6460602283477783, 1595308143.8650556], "version": 0.2, "tvm_version": "0.7.dev1"}
{"input": ["cuda -keys=cuda,gpu -max_num_threads=1024 -thread_warp_size=32", "batch_matmul.cuda", [["TENSOR", [64, 2048, 512], "float32"], ["TENSOR", [64, 1, 512], "float32"]], {}], "config": {"index": 2851, "code_hash": null, "entity": [["tile_y", "sp", [-1, 2, 16]], ["tile_x", "sp", [-1, 1, 1]], ["tile_k", "sp", [-1, 64]], ["auto_unroll_max_step", "ot", 64], ["unroll_explicit", "ot", 0]]}, "result": [[0.003139356666666667], 0, 1.7329990863800049, 1595308145.0548148], "version": 0.2, "tvm_version": "0.7.dev1"}
{"input": ["cuda -keys=cuda,gpu -max_num_threads=1024 -thread_warp_size=32", "batch_matmul.cuda", [["TENSOR", [64, 2048, 512], "float32"], ["TENSOR", [64, 1, 512], "float32"]], {}], "config": {"index": 2903, "code_hash": null, "entity": [["tile_y", "sp", [-1, 32, 2]], ["tile_x", "sp", [-1, 1, 1]], ["tile_k", "sp", [-1, 128]], ["auto_unroll_max_step", "ot", 64], ["unroll_explicit", "ot", 0]]}, "result": [[0.0024241833400000003], 0, 1.992429494857788, 1595308146.6233792], "version": 0.2, "tvm_version": "0.7.dev1"}
{"input": ["cuda -keys=cuda,gpu -max_num_threads=1024 -thread_warp_size=32", "batch_matmul.cuda", [["TENSOR", [64, 2048, 512], "float32"], ["TENSOR", [64, 1, 512], "float32"]], {}], "config": {"index": 5563, "code_hash": null, "entity": [["tile_y", "sp", [-1, 4, 4]], ["tile_x", "sp", [-1, 1, 1]], ["tile_k", "sp", [-1, 2]], ["auto_unroll_max_step", "ot", 64], ["unroll_explicit", "ot", 1]]}, "result": [[0.00202090468], 0, 1.4309828281402588, 1595308147.7545812], "version": 0.2, "tvm_version": "0.7.dev1"}
{"input": ["cuda -keys=cuda,gpu -max_num_threads=1024 -thread_warp_size=32", "batch_matmul.cuda", [["TENSOR", [64, 2048, 512], "float32"], ["TENSOR", [64, 1, 512], "float32"]], {}], "config": {"index": 3343, "code_hash": null, "entity": [["tile_y", "sp", [-1, 16, 128]], ["tile_x", "sp", [-1, 1, 1]], ["tile_k", "sp", [-1, 4]], ["auto_unroll_max_step", "ot", 8], ["unroll_explicit", "ot", 1]]}, "result": [[0.0098938413125], 0, 1.779923915863037, 1595308148.9746392], "version": 0.2, "tvm_version": "0.7.dev1"}
{"input": ["cuda -keys=cuda,gpu -max_num_threads=1024 -thread_warp_size=32", "batch_matmul.cuda", [["TENSOR", [64, 2048, 512], "float32"], ["TENSOR", [64, 1, 512], "float32"]], {}], "config": {"index": 2524, "code_hash": null, "entity": [["tile_y", "sp", [-1, 32, 4]], ["tile_x", "sp", [-1, 1, 1]], ["tile_k", "sp", [-1, 4]], ["auto_unroll_max_step", "ot", 64], ["unroll_explicit", "ot", 0]]}, "result": [[0.005218421866666667], 0, 1.5914573669433594, 1595308150.2096462], "version": 0.2, "tvm_version": "0.7.dev1"}
{"input": ["cuda -keys=cuda,gpu -max_num_threads=1024 -thread_warp_size=32", "batch_matmul.cuda", [["TENSOR", [64, 2048, 512], "float32"], ["TENSOR", [64, 1, 512], "float32"]], {}], "config": {"index": 5242, "code_hash": null, "entity": [["tile_y", "sp", [-1, 16, 2]], ["tile_x", "sp", [-1, 1, 1]], ["tile_k", "sp", [-1, 128]], ["auto_unroll_max_step", "ot", 32], ["unroll_explicit", "ot", 1]]}, "result": [[0.001631282], 0, 1.5052592754364014, 1595308151.391696], "version": 0.2, "tvm_version": "0.7.dev1"}
{"input": ["cuda -keys=cuda,gpu -max_num_threads=1024 -thread_warp_size=32", "batch_matmul.cuda", [["TENSOR", [64, 2048, 512], "float32"], ["TENSOR", [64, 1, 512], "float32"]], {}], "config": {"index": 1831, "code_hash": null, "entity": [["tile_y", "sp", [-1, 16, 8]], ["tile_x", "sp", [-1, 1, 1]], ["tile_k", "sp", [-1, 8]], ["auto_unroll_max_step", "ot", 32], ["unroll_explicit", "ot", 0]]}, "result": [[0.0018909199448818898], 0, 1.8827226161956787, 1595308152.9061613], "version": 0.2, "tvm_version": "0.7.dev1"}
{"input": ["cuda -keys=cuda,gpu -max_num_threads=1024 -thread_warp_size=32", "batch_matmul.cuda", [["TENSOR", [64, 2048, 512], "float32"], ["TENSOR", [64, 1, 512], "float32"]], {}], "config": {"index": 3670, "code_hash": null, "entity": [["tile_y", "sp", [-1, 16, 1]], ["tile_x", "sp", [-1, 1, 1]], ["tile_k", "sp", [-1, 128]], ["auto_unroll_max_step", "ot", 8], ["unroll_explicit", "ot", 1]]}, "result": [[0.0014367716380952382], 0, 1.7101404666900635, 1595308154.172529], "version": 0.2, "tvm_version": "0.7.dev1"}
{"input": ["cuda -keys=cuda,gpu -max_num_threads=1024 -thread_warp_size=32", "batch_matmul.cuda", [["TENSOR", [64, 2048, 512], "float32"], ["TENSOR", [64, 1, 512], "float32"]], {}], "config": {"index": 4136, "code_hash": null, "entity": [["tile_y", "sp", [-1, 4, 1]], ["tile_x", "sp", [-1, 1, 1]], ["tile_k", "sp", [-1, 8]], ["auto_unroll_max_step", "ot", 16], ["unroll_explicit", "ot", 1]]}, "result": [[0.003260224027027027], 0, 1.8262412548065186, 1595308155.604388], "version": 0.2, "tvm_version": "0.7.dev1"}
{"input": ["cuda -keys=cuda,gpu -max_num_threads=1024 -thread_warp_size=32", "batch_matmul.cuda", [["TENSOR", [64, 2048, 512], "float32"], ["TENSOR", [64, 1, 512], "float32"]], {}], "config": {"index": 4264, "code_hash": null, "entity": [["tile_y", "sp", [-1, 4, 32]], ["tile_x", "sp", [-1, 1, 1]], ["tile_k", "sp", [-1, 16]], ["auto_unroll_max_step", "ot", 16], ["unroll_explicit", "ot", 1]]}, "result": [[0.00478239234375], 0, 1.5357797145843506, 1595308156.7329648], "version": 0.2, "tvm_version": "0.7.dev1"}
{"input": ["cuda -keys=cuda,gpu -max_num_threads=1024 -thread_warp_size=32", "batch_matmul.cuda", [["TENSOR", [64, 2048, 512], "float32"], ["TENSOR", [64, 1, 512], "float32"]], {}], "config": {"index": 4765, "code_hash": null, "entity": [["tile_y", "sp", [-1, 128, 1]], ["tile_x", "sp", [-1, 1, 1]], ["tile_k", "sp", [-1, 2]], ["auto_unroll_max_step", "ot", 32], ["unroll_explicit", "ot", 1]]}, "result": [[0.002470902868852459], 0, 1.415485143661499, 1595308157.8704138], "version": 0.2, "tvm_version": "0.7.dev1"}
{"input": ["cuda -keys=cuda,gpu -max_num_threads=1024 -thread_warp_size=32", "batch_matmul.cuda", [["TENSOR", [64, 2048, 512], "float32"], ["TENSOR", [64, 1, 512], "float32"]], {}], "config": {"index": 3997, "code_hash": null, "entity": [["tile_y", "sp", [-1, 128, 2]], ["tile_x", "sp", [-1, 1, 1]], ["tile_k", "sp", [-1, 2]], ["auto_unroll_max_step", "ot", 16], ["unroll_explicit", "ot", 1]]}, "result": [[0.008515093555555554], 0, 1.6409242153167725, 1595308159.2500777], "version": 0.2, "tvm_version": "0.7.dev1"}
{"input": ["cuda -keys=cuda,gpu -max_num_threads=1024 -thread_warp_size=32", "batch_matmul.cuda", [["TENSOR", [64, 2048, 512], "float32"], ["TENSOR", [64, 1, 512], "float32"]], {}], "config": {"index": 1898, "code_hash": null, "entity": [["tile_y", "sp", [-1, 8, 4]], ["tile_x", "sp", [-1, 1, 1]], ["tile_k", "sp", [-1, 16]], ["auto_unroll_max_step", "ot", 32], ["unroll_explicit", "ot", 0]]}, "result": [[0.0015939710842105264], 0, 1.6444313526153564, 1595308160.4172657], "version": 0.2, "tvm_version": "0.7.dev1"}
{"input": ["cuda -keys=cuda,gpu -max_num_threads=1024 -thread_warp_size=32", "batch_matmul.cuda", [["TENSOR", [64, 2048, 512], "float32"], ["TENSOR", [64, 1, 512], "float32"]], {}], "config": {"index": 1852, "code_hash": null, "entity": [["tile_y", "sp", [-1, 2, 64]], ["tile_x", "sp", [-1, 1, 1]], ["tile_k", "sp", [-1, 8]], ["auto_unroll_max_step", "ot", 32], ["unroll_explicit", "ot", 0]]}, "result": [[0.003802574275], 0, 1.5223422050476074, 1595308161.6002913], "version": 0.2, "tvm_version": "0.7.dev1"}
{"input": ["cuda -keys=cuda,gpu -max_num_threads=1024 -thread_warp_size=32", "batch_matmul.cuda", [["TENSOR", [64, 2048, 512], "float32"], ["TENSOR", [64, 1, 512], "float32"]], {}], "config": {"index": 178, "code_hash": null, "entity": [["tile_y", "sp", [-1, 1024, 2]], ["tile_x", "sp", [-1, 1, 1]], ["tile_k", "sp", [-1, 4]], ["auto_unroll_max_step", "ot", 8], ["unroll_explicit", "ot", 0]]}, "result": [[0.006216764210526316], 0, 1.8400616645812988, 1595308163.1638188], "version": 0.2, "tvm_version": "0.7.dev1"}
{"input": ["cuda -keys=cuda,gpu -max_num_threads=1024 -thread_warp_size=32", "batch_matmul.cuda", [["TENSOR", [64, 2048, 512], "float32"], ["TENSOR", [64, 1, 512], "float32"]], {}], "config": {"index": 1594, "code_hash": null, "entity": [["tile_y", "sp", [-1, 2, 8]], ["tile_x", "sp", [-1, 1, 1]], ["tile_k", "sp", [-1, 1]], ["auto_unroll_max_step", "ot", 32], ["unroll_explicit", "ot", 0]]}, "result": [[0.002750919], 0, 1.4552924633026123, 1595308164.2668688], "version": 0.2, "tvm_version": "0.7.dev1"}
{"input": ["cuda -keys=cuda,gpu -max_num_threads=1024 -thread_warp_size=32", "batch_matmul.cuda", [["TENSOR", [64, 2048, 512], "float32"], ["TENSOR", [64, 1, 512], "float32"]], {}], "config": {"index": 92, "code_hash": null, "entity": [["tile_y", "sp", [-1, 4, 2]], ["tile_x", "sp", [-1, 1, 1]], ["tile_k", "sp", [-1, 2]], ["auto_unroll_max_step", "ot", 8], ["unroll_explicit", "ot", 0]]}, "result": [[0.003467147818181818], 0, 1.5097763538360596, 1595308165.4046302], "version": 0.2, "tvm_version": "0.7.dev1"}
{"input": ["cuda -keys=cuda,gpu -max_num_threads=1024 -thread_warp_size=32", "batch_matmul.cuda", [["TENSOR", [64, 2048, 512], "float32"], ["TENSOR", [64, 1, 512], "float32"]], {}], "config": {"index": 5112, "code_hash": null, "entity": [["tile_y", "sp", [-1, 1, 16]], ["tile_x", "sp", [-1, 1, 1]], ["tile_k", "sp", [-1, 32]], ["auto_unroll_max_step", "ot", 32], ["unroll_explicit", "ot", 1]]}, "result": [[0.0044933715], 0, 1.7101776599884033, 1595308166.634724], "version": 0.2, "tvm_version": "0.7.dev1"}
{"input": ["cuda -keys=cuda,gpu -max_num_threads=1024 -thread_warp_size=32", "batch_matmul.cuda", [["TENSOR", [64, 2048, 512], "float32"], ["TENSOR", [64, 1, 512], "float32"]], {}], "config": {"index": 1082, "code_hash": null, "entity": [["tile_y", "sp", [-1, 1, 256]], ["tile_x", "sp", [-1, 1, 1]], ["tile_k", "sp", [-1, 8]], ["auto_unroll_max_step", "ot", 16], ["unroll_explicit", "ot", 0]]}, "result": [[0.05601059], 0, 2.114612102508545, 1595308168.274071], "version": 0.2, "tvm_version": "0.7.dev1"}
{"input": ["cuda -keys=cuda,gpu -max_num_threads=1024 -thread_warp_size=32", "batch_matmul.cuda", [["TENSOR", [64, 2048, 512], "float32"], ["TENSOR", [64, 1, 512], "float32"]], {}], "config": {"index": 1572, "code_hash": null, "entity": [["tile_y", "sp", [-1, 1, 2]], ["tile_x", "sp", [-1, 1, 1]], ["tile_k", "sp", [-1, 1]], ["auto_unroll_max_step", "ot", 32], ["unroll_explicit", "ot", 0]]}, "result": [[0.0077870384], 0, 1.526620864868164, 1595308169.487196], "version": 0.2, "tvm_version": "0.7.dev1"}
{"input": ["cuda -keys=cuda,gpu -max_num_threads=1024 -thread_warp_size=32", "batch_matmul.cuda", [["TENSOR", [64, 2048, 512], "float32"], ["TENSOR", [64, 1, 512], "float32"]], {}], "config": {"index": 5944, "code_hash": null, "entity": [["tile_y", "sp", [-1, 16, 2]], ["tile_x", "sp", [-1, 1, 1]], ["tile_k", "sp", [-1, 64]], ["auto_unroll_max_step", "ot", 64], ["unroll_explicit", "ot", 1]]}, "result": [[0.0011245929906976743], 0, 2.01670503616333, 1595308171.0757086], "version": 0.2, "tvm_version": "0.7.dev1"}
{"input": ["cuda -keys=cuda,gpu -max_num_threads=1024 -thread_warp_size=32", "batch_matmul.cuda", [["TENSOR", [64, 2048, 512], "float32"], ["TENSOR", [64, 1, 512], "float32"]], {}], "config": {"index": 2388, "code_hash": null, "entity": [["tile_y", "sp", [-1, 64, 16]], ["tile_x", "sp", [-1, 1, 1]], ["tile_k", "sp", [-1, 1]], ["auto_unroll_max_step", "ot", 64], ["unroll_explicit", "ot", 0]]}, "result": [[0.027287757333333332], 0, 1.6708121299743652, 1595308172.3605137], "version": 0.2, "tvm_version": "0.7.dev1"}
{"input": ["cuda -keys=cuda,gpu -max_num_threads=1024 -thread_warp_size=32", "batch_matmul.cuda", [["TENSOR", [64, 2048, 512], "float32"], ["TENSOR", [64, 1, 512], "float32"]], {}], "config": {"index": 5786, "code_hash": null, "entity": [["tile_y", "sp", [-1, 4, 2]], ["tile_x", "sp", [-1, 1, 1]], ["tile_k", "sp", [-1, 16]], ["auto_unroll_max_step", "ot", 64], ["unroll_explicit", "ot", 1]]}, "result": [[0.0031442636874999996], 0, 1.4683563709259033, 1595308173.4593363], "version": 0.2, "tvm_version": "0.7.dev1"}
{"input": ["cuda -keys=cuda,gpu -max_num_threads=1024 -thread_warp_size=32", "batch_matmul.cuda", [["TENSOR", [64, 2048, 512], "float32"], ["TENSOR", [64, 1, 512], "float32"]], {}], "config": {"index": 1660, "code_hash": null, "entity": [["tile_y", "sp", [-1, 1024, 2]], ["tile_x", "sp", [-1, 1, 1]], ["tile_k", "sp", [-1, 2]], ["auto_unroll_max_step", "ot", 32], ["unroll_explicit", "ot", 0]]}, "result": [[0.010449841866666667], 0, 1.5241224765777588, 1595308174.8170843], "version": 0.2, "tvm_version": "0.7.dev1"}
{"input": ["cuda -keys=cuda,gpu -max_num_threads=1024 -thread_warp_size=32", "batch_matmul.cuda", [["TENSOR", [64, 2048, 512], "float32"], ["TENSOR", [64, 1, 512], "float32"]], {}], "config": {"index": 2467, "code_hash": null, "entity": [["tile_y", "sp", [-1, 128, 16]], ["tile_x", "sp", [-1, 1, 1]], ["tile_k", "sp", [-1, 2]], ["auto_unroll_max_step", "ot", 64], ["unroll_explicit", "ot", 0]]}, "result": [[0.013705715636363636], 0, 1.5965442657470703, 1595308176.0430636], "version": 0.2, "tvm_version": "0.7.dev1"}
{"input": ["cuda -keys=cuda,gpu -max_num_threads=1024 -thread_warp_size=32", "batch_matmul.cuda", [["TENSOR", [64, 2048, 512], "float32"], ["TENSOR", [64, 1, 512], "float32"]], {}], "config": {"index": 3604, "code_hash": null, "entity": [["tile_y", "sp", [-1, 16, 2]], ["tile_x", "sp", [-1, 1, 1]], ["tile_k", "sp", [-1, 64]], ["auto_unroll_max_step", "ot", 8], ["unroll_explicit", "ot", 1]]}, "result": [[0.00113876803125], 0, 1.884918212890625, 1595308190.736636], "version": 0.2, "tvm_version": "0.7.dev1"}
{"input": ["cuda -keys=cuda,gpu -max_num_threads=1024 -thread_warp_size=32", "batch_matmul.cuda", [["TENSOR", [64, 2048, 512], "float32"], ["TENSOR", [64, 1, 512], "float32"]], {}], "config": {"index": 4384, "code_hash": null, "entity": [["tile_y", "sp", [-1, 16, 2]], ["tile_x", "sp", [-1, 1, 1]], ["tile_k", "sp", [-1, 64]], ["auto_unroll_max_step", "ot", 16], ["unroll_explicit", "ot", 1]]}, "result": [[0.0011385140200000001], 0, 1.7842161655426025, 1595308192.1154692], "version": 0.2, "tvm_version": "0.7.dev1"}
{"input": ["cuda -keys=cuda,gpu -max_num_threads=1024 -thread_warp_size=32", "batch_matmul.cuda", [["TENSOR", [64, 2048, 512], "float32"], ["TENSOR", [64, 1, 512], "float32"]], {}], "config": {"index": 5164, "code_hash": null, "entity": [["tile_y", "sp", [-1, 16, 2]], ["tile_x", "sp", [-1, 1, 1]], ["tile_k", "sp", [-1, 64]], ["auto_unroll_max_step", "ot", 32], ["unroll_explicit", "ot", 1]]}, "result": [[0.001138245005], 0, 1.797654628753662, 1595308193.5074818], "version": 0.2, "tvm_version": "0.7.dev1"}
{"input": ["cuda -keys=cuda,gpu -max_num_threads=1024 -thread_warp_size=32", "batch_matmul.cuda", [["TENSOR", [64, 2048, 512], "float32"], ["TENSOR", [64, 1, 512], "float32"]], {}], "config": {"index": 4316, "code_hash": null, "entity": [["tile_y", "sp", [-1, 8, 4]], ["tile_x", "sp", [-1, 1, 1]], ["tile_k", "sp", [-1, 32]], ["auto_unroll_max_step", "ot", 16], ["unroll_explicit", "ot", 1]]}, "result": [[0.0015629357870967741], 0, 1.8133857250213623, 1595308194.9673767], "version": 0.2, "tvm_version": "0.7.dev1"}
{"input": ["cuda -keys=cuda,gpu -max_num_threads=1024 -thread_warp_size=32", "batch_matmul.cuda", [["TENSOR", [64, 2048, 512], "float32"], ["TENSOR", [64, 1, 512], "float32"]], {}], "config": {"index": 5096, "code_hash": null, "entity": [["tile_y", "sp", [-1, 8, 4]], ["tile_x", "sp", [-1, 1, 1]], ["tile_k", "sp", [-1, 32]], ["auto_unroll_max_step", "ot", 32], ["unroll_explicit", "ot", 1]]}, "result": [[0.0015473476288659796], 0, 1.7700397968292236, 1595308196.2214434], "version": 0.2, "tvm_version": "0.7.dev1"}
{"input": ["cuda -keys=cuda,gpu -max_num_threads=1024 -thread_warp_size=32", "batch_matmul.cuda", [["TENSOR", [64, 2048, 512], "float32"], ["TENSOR", [64, 1, 512], "float32"]], {}], "config": {"index": 5086, "code_hash": null, "entity": [["tile_y", "sp", [-1, 16, 2]], ["tile_x", "sp", [-1, 1, 1]], ["tile_k", "sp", [-1, 32]], ["auto_unroll_max_step", "ot", 32], ["unroll_explicit", "ot", 1]]}, "result": [[0.0013717675818181818], 0, 1.544553279876709, 1595308197.297275], "version": 0.2, "tvm_version": "0.7.dev1"}
{"input": ["cuda -keys=cuda,gpu -max_num_threads=1024 -thread_warp_size=32", "batch_matmul.cuda", [["TENSOR", [64, 2048, 512], "float32"], ["TENSOR", [64, 1, 512], "float32"]], {}], "config": {"index": 5866, "code_hash": null, "entity": [["tile_y", "sp", [-1, 16, 2]], ["tile_x", "sp", [-1, 1, 1]], ["tile_k", "sp", [-1, 32]], ["auto_unroll_max_step", "ot", 64], ["unroll_explicit", "ot", 1]]}, "result": [[0.0013791847981651376], 0, 1.5144686698913574, 1595308198.3922508], "version": 0.2, "tvm_version": "0.7.dev1"}
{"input": ["cuda -keys=cuda,gpu -max_num_threads=1024 -thread_warp_size=32", "batch_matmul.cuda", [["TENSOR", [64, 2048, 512], "float32"], ["TENSOR", [64, 1, 512], "float32"]], {}], "config": {"index": 4306, "code_hash": null, "entity": [["tile_y", "sp", [-1, 16, 2]], ["tile_x", "sp", [-1, 1, 1]], ["tile_k", "sp", [-1, 32]], ["auto_unroll_max_step", "ot", 16], ["unroll_explicit", "ot", 1]]}, "result": [[0.0015236177676767678], 0, 1.5624446868896484, 1595308199.5133023], "version": 0.2, "tvm_version": "0.7.dev1"}
{"input": ["cuda -keys=cuda,gpu -max_num_threads=1024 -thread_warp_size=32", "batch_matmul.cuda", [["TENSOR", [64, 2048, 512], "float32"], ["TENSOR", [64, 1, 512], "float32"]], {}], "config": {"index": 3536, "code_hash": null, "entity": [["tile_y", "sp", [-1, 8, 4]], ["tile_x", "sp", [-1, 1, 1]], ["tile_k", "sp", [-1, 32]], ["auto_unroll_max_step", "ot", 8], ["unroll_explicit", "ot", 1]]}, "result": [[0.0015627877823129253], 0, 1.8629813194274902, 1595308200.9156785], "version": 0.2, "tvm_version": "0.7.dev1"}
{"input": ["cuda -keys=cuda,gpu -max_num_threads=1024 -thread_warp_size=32", "batch_matmul.cuda", [["TENSOR", [64, 2048, 512], "float32"], ["TENSOR", [64, 1, 512], "float32"]], {}], "config": {"index": 5027, "code_hash": null, "entity": [["tile_y", "sp", [-1, 4, 8]], ["tile_x", "sp", [-1, 1, 1]], ["tile_k", "sp", [-1, 16]], ["auto_unroll_max_step", "ot", 32], ["unroll_explicit", "ot", 1]]}, "result": [[0.0019254043797468355], 0, 1.6807806491851807, 1595308202.1074023], "version": 0.2, "tvm_version": "0.7.dev1"}
{"input": ["cuda -keys=cuda,gpu -max_num_threads=1024 -thread_warp_size=32", "batch_matmul.cuda", [["TENSOR", [64, 2048, 512], "float32"], ["TENSOR", [64, 1, 512], "float32"]], {}], "config": {"index": 4247, "code_hash": null, "entity": [["tile_y", "sp", [-1, 4, 8]], ["tile_x", "sp", [-1, 1, 1]], ["tile_k", "sp", [-1, 16]], ["auto_unroll_max_step", "ot", 16], ["unroll_explicit", "ot", 1]]}, "result": [[0.0019273292066115703], 0, 1.855496883392334, 1595308203.557554], "version": 0.2, "tvm_version": "0.7.dev1"}
{"input": ["cuda -keys=cuda,gpu -max_num_threads=1024 -thread_warp_size=32", "batch_matmul.cuda", [["TENSOR", [64, 2048, 512], "float32"], ["TENSOR", [64, 1, 512], "float32"]], {}], "config": {"index": 5807, "code_hash": null, "entity": [["tile_y", "sp", [-1, 4, 8]], ["tile_x", "sp", [-1, 1, 1]], ["tile_k", "sp", [-1, 16]], ["auto_unroll_max_step", "ot", 64], ["unroll_explicit", "ot", 1]]}, "result": [[0.001928151396694215], 0, 1.9050986766815186, 1595308204.993367], "version": 0.2, "tvm_version": "0.7.dev1"}
{"input": ["cuda -keys=cuda,gpu -max_num_threads=1024 -thread_warp_size=32", "batch_matmul.cuda", [["TENSOR", [64, 2048, 512], "float32"], ["TENSOR", [64, 1, 512], "float32"]], {}], "config": {"index": 3526, "code_hash": null, "entity": [["tile_y", "sp", [-1, 16, 2]], ["tile_x", "sp", [-1, 1, 1]], ["tile_k", "sp", [-1, 32]], ["auto_unroll_max_step", "ot", 8], ["unroll_explicit", "ot", 1]]}, "result": [[0.0015235261644736841], 0, 1.8826937675476074, 1595308206.5236125], "version": 0.2, "tvm_version": "0.7.dev1"}
{"input": ["cuda -keys=cuda,gpu -max_num_threads=1024 -thread_warp_size=32", "batch_matmul.cuda", [["TENSOR", [64, 2048, 512], "float32"], ["TENSOR", [64, 1, 512], "float32"]], {}], "config": {"index": 5876, "code_hash": null, "entity": [["tile_y", "sp", [-1, 8, 4]], ["tile_x", "sp", [-1, 1, 1]], ["tile_k", "sp", [-1, 32]], ["auto_unroll_max_step", "ot", 64], ["unroll_explicit", "ot", 1]]}, "result": [[0.0015479545405405405], 0, 1.9787204265594482, 1595308207.9445634], "version": 0.2, "tvm_version": "0.7.dev1"}
{"input": ["cuda -keys=cuda,gpu -max_num_threads=1024 -thread_warp_size=32", "batch_matmul.cuda", [["TENSOR", [64, 2048, 512], "float32"], ["TENSOR", [64, 1, 512], "float32"]], {}], "config": {"index": 484, "code_hash": null, "entity": [["tile_y", "sp", [-1, 16, 2]], ["tile_x", "sp", [-1, 1, 1]], ["tile_k", "sp", [-1, 64]], ["auto_unroll_max_step", "ot", 8], ["unroll_explicit", "ot", 0]]}, "result": [[0.001139797739336493], 0, 2.0106537342071533, 1595308209.5094206], "version": 0.2, "tvm_version": "0.7.dev1"}
{"input": ["cuda -keys=cuda,gpu -max_num_threads=1024 -thread_warp_size=32", "batch_matmul.cuda", [["TENSOR", [64, 2048, 512], "float32"], ["TENSOR", [64, 1, 512], "float32"]], {}], "config": {"index": 4246, "code_hash": null, "entity": [["tile_y", "sp", [-1, 2, 8]], ["tile_x", "sp", [-1, 1, 1]], ["tile_k", "sp", [-1, 16]], ["auto_unroll_max_step", "ot", 16], ["unroll_explicit", "ot", 1]]}, "result": [[0.002390068365079365], 0, 1.5583570003509521, 1595308210.5895424], "version": 0.2, "tvm_version": "0.7.dev1"}
{"input": ["cuda -keys=cuda,gpu -max_num_threads=1024 -thread_warp_size=32", "batch_matmul.cuda", [["TENSOR", [64, 2048, 512], "float32"], ["TENSOR", [64, 1, 512], "float32"]], {}], "config": {"index": 5026, "code_hash": null, "entity": [["tile_y", "sp", [-1, 2, 8]], ["tile_x", "sp", [-1, 1, 1]], ["tile_k", "sp", [-1, 16]], ["auto_unroll_max_step", "ot", 32], ["unroll_explicit", "ot", 1]]}, "result": [[0.0023894172346938776], 0, 1.8820807933807373, 1595308212.0401409], "version": 0.2, "tvm_version": "0.7.dev1"}
{"input": ["cuda -keys=cuda,gpu -max_num_threads=1024 -thread_warp_size=32", "batch_matmul.cuda", [["TENSOR", [64, 2048, 512], "float32"], ["TENSOR", [64, 1, 512], "float32"]], {}], "config": {"index": 2824, "code_hash": null, "entity": [["tile_y", "sp", [-1, 16, 2]], ["tile_x", "sp", [-1, 1, 1]], ["tile_k", "sp", [-1, 64]], ["auto_unroll_max_step", "ot", 64], ["unroll_explicit", "ot", 0]]}, "result": [[0.0011268516093023255], 0, 2.169999837875366, 1595308213.6793852], "version": 0.2, "tvm_version": "0.7.dev1"}
{"input": ["cuda -keys=cuda,gpu -max_num_threads=1024 -thread_warp_size=32", "batch_matmul.cuda", [["TENSOR", [64, 2048, 512], "float32"], ["TENSOR", [64, 1, 512], "float32"]], {}], "config": {"index": 2044, "code_hash": null, "entity": [["tile_y", "sp", [-1, 16, 2]], ["tile_x", "sp", [-1, 1, 1]], ["tile_k", "sp", [-1, 64]], ["auto_unroll_max_step", "ot", 32], ["unroll_explicit", "ot", 0]]}, "result": [[0.0011391567638190955], 0, 1.7931084632873535, 1595308215.069215], "version": 0.2, "tvm_version": "0.7.dev1"}
{"input": ["cuda -keys=cuda,gpu -max_num_threads=1024 -thread_warp_size=32", "batch_matmul.cuda", [["TENSOR", [64, 2048, 512], "float32"], ["TENSOR", [64, 1, 512], "float32"]], {}], "config": {"index": 1264, "code_hash": null, "entity": [["tile_y", "sp", [-1, 16, 2]], ["tile_x", "sp", [-1, 1, 1]], ["tile_k", "sp", [-1, 64]], ["auto_unroll_max_step", "ot", 16], ["unroll_explicit", "ot", 0]]}, "result": [[0.00113990178], 0, 1.8499352931976318, 1595308216.528477], "version": 0.2, "tvm_version": "0.7.dev1"}
{"input": ["cuda -keys=cuda,gpu -max_num_threads=1024 -thread_warp_size=32", "batch_matmul.cuda", [["TENSOR", [64, 2048, 512], "float32"], ["TENSOR", [64, 1, 512], "float32"]], {}], "config": {"index": 6022, "code_hash": null, "entity": [["tile_y", "sp", [-1, 16, 2]], ["tile_x", "sp", [-1, 1, 1]], ["tile_k", "sp", [-1, 128]], ["auto_unroll_max_step", "ot", 64], ["unroll_explicit", "ot", 1]]}, "result": [[0.0016385413680555555], 0, 1.845137357711792, 1595308217.9750013], "version": 0.2, "tvm_version": "0.7.dev1"}
{"input": ["cuda -keys=cuda,gpu -max_num_threads=1024 -thread_warp_size=32", "batch_matmul.cuda", [["TENSOR", [64, 2048, 512], "float32"], ["TENSOR", [64, 1, 512], "float32"]], {}], "config": {"index": 4462, "code_hash": null, "entity": [["tile_y", "sp", [-1, 16, 2]], ["tile_x", "sp", [-1, 1, 1]], ["tile_k", "sp", [-1, 128]], ["auto_unroll_max_step", "ot", 16], ["unroll_explicit", "ot", 1]]}, "result": [[0.0016369899166666668], 0, 2.0319595336914062, 1595308219.5381615], "version": 0.2, "tvm_version": "0.7.dev1"}
{"input": ["cuda -keys=cuda,gpu -max_num_threads=1024 -thread_warp_size=32", "batch_matmul.cuda", [["TENSOR", [64, 2048, 512], "float32"], ["TENSOR", [64, 1, 512], "float32"]], {}], "config": {"index": 5806, "code_hash": null, "entity": [["tile_y", "sp", [-1, 2, 8]], ["tile_x", "sp", [-1, 1, 1]], ["tile_k", "sp", [-1, 16]], ["auto_unroll_max_step", "ot", 64], ["unroll_explicit", "ot", 1]]}, "result": [[0.00238912849], 0, 1.935154914855957, 1595308221.010859], "version": 0.2, "tvm_version": "0.7.dev1"}
{"input": ["cuda -keys=cuda,gpu -max_num_threads=1024 -thread_warp_size=32", "batch_matmul.cuda", [["TENSOR", [64, 2048, 512], "float32"], ["TENSOR", [64, 1, 512], "float32"]], {}], "config": {"index": 4325, "code_hash": null, "entity": [["tile_y", "sp", [-1, 4, 8]], ["tile_x", "sp", [-1, 1, 1]], ["tile_k", "sp", [-1, 32]], ["auto_unroll_max_step", "ot", 16], ["unroll_explicit", "ot", 1]]}, "result": [[0.0017146948863636365], 0, 1.713886022567749, 1595308222.2635689], "version": 0.2, "tvm_version": "0.7.dev1"}
{"input": ["cuda -keys=cuda,gpu -max_num_threads=1024 -thread_warp_size=32", "batch_matmul.cuda", [["TENSOR", [64, 2048, 512], "float32"], ["TENSOR", [64, 1, 512], "float32"]], {}], "config": {"index": 5105, "code_hash": null, "entity": [["tile_y", "sp", [-1, 4, 8]], ["tile_x", "sp", [-1, 1, 1]], ["tile_k", "sp", [-1, 32]], ["auto_unroll_max_step", "ot", 32], ["unroll_explicit", "ot", 1]]}, "result": [[0.001708039375], 0, 1.7030055522918701, 1595308223.4040291], "version": 0.2, "tvm_version": "0.7.dev1"}
{"input": ["cuda -keys=cuda,gpu -max_num_threads=1024 -thread_warp_size=32", "batch_matmul.cuda", [["TENSOR", [64, 2048, 512], "float32"], ["TENSOR", [64, 1, 512], "float32"]], {}], "config": {"index": 4315, "code_hash": null, "entity": [["tile_y", "sp", [-1, 4, 4]], ["tile_x", "sp", [-1, 1, 1]], ["tile_k", "sp", [-1, 32]], ["auto_unroll_max_step", "ot", 16], ["unroll_explicit", "ot", 1]]}, "result": [[0.0018473952560975608], 0, 1.5571675300598145, 1595308224.5191913], "version": 0.2, "tvm_version": "0.7.dev1"}
{"input": ["cuda -keys=cuda,gpu -max_num_threads=1024 -thread_warp_size=32", "batch_matmul.cuda", [["TENSOR", [64, 2048, 512], "float32"], ["TENSOR", [64, 1, 512], "float32"]], {}], "config": {"index": 5095, "code_hash": null, "entity": [["tile_y", "sp", [-1, 4, 4]], ["tile_x", "sp", [-1, 1, 1]], ["tile_k", "sp", [-1, 32]], ["auto_unroll_max_step", "ot", 32], ["unroll_explicit", "ot", 1]]}, "result": [[0.0019328925769230769], 0, 1.639451503753662, 1595308225.618249], "version": 0.2, "tvm_version": "0.7.dev1"}
{"input": ["cuda -keys=cuda,gpu -max_num_threads=1024 -thread_warp_size=32", "batch_matmul.cuda", [["TENSOR", [64, 2048, 512], "float32"], ["TENSOR", [64, 1, 512], "float32"]], {}], "config": {"index": 1976, "code_hash": null, "entity": [["tile_y", "sp", [-1, 8, 4]], ["tile_x", "sp", [-1, 1, 1]], ["tile_k", "sp", [-1, 32]], ["auto_unroll_max_step", "ot", 32], ["unroll_explicit", "ot", 0]]}, "result": [[0.0015480300103092783], 0, 1.598829746246338, 1595308226.676474], "version": 0.2, "tvm_version": "0.7.dev1"}
{"input": ["cuda -keys=cuda,gpu -max_num_threads=1024 -thread_warp_size=32", "batch_matmul.cuda", [["TENSOR", [64, 2048, 512], "float32"], ["TENSOR", [64, 1, 512], "float32"]], {}], "config": {"index": 1196, "code_hash": null, "entity": [["tile_y", "sp", [-1, 8, 4]], ["tile_x", "sp", [-1, 1, 1]], ["tile_k", "sp", [-1, 32]], ["auto_unroll_max_step", "ot", 16], ["unroll_explicit", "ot", 0]]}, "result": [[0.0015649635520833332], 0, 1.4988059997558594, 1595308227.7486632], "version": 0.2, "tvm_version": "0.7.dev1"}
{"input": ["cuda -keys=cuda,gpu -max_num_threads=1024 -thread_warp_size=32", "batch_matmul.cuda", [["TENSOR", [64, 2048, 512], "float32"], ["TENSOR", [64, 1, 512], "float32"]], {}], "config": {"index": 3682, "code_hash": null, "entity": [["tile_y", "sp", [-1, 16, 2]], ["tile_x", "sp", [-1, 1, 1]], ["tile_k", "sp", [-1, 128]], ["auto_unroll_max_step", "ot", 8], ["unroll_explicit", "ot", 1]]}, "result": [[0.0016460307746478872], 0, 1.812337875366211, 1595308229.1681554], "version": 0.2, "tvm_version": "0.7.dev1"}
{"input": ["cuda -keys=cuda,gpu -max_num_threads=1024 -thread_warp_size=32", "batch_matmul.cuda", [["TENSOR", [64, 2048, 512], "float32"], ["TENSOR", [64, 1, 512], "float32"]], {}], "config": {"index": 2746, "code_hash": null, "entity": [["tile_y", "sp", [-1, 16, 2]], ["tile_x", "sp", [-1, 1, 1]], ["tile_k", "sp", [-1, 32]], ["auto_unroll_max_step", "ot", 64], ["unroll_explicit", "ot", 0]]}, "result": [[0.0013809452018348624], 0, 1.5784649848937988, 1595308230.2964907], "version": 0.2, "tvm_version": "0.7.dev1"}
{"input": ["cuda -keys=cuda,gpu -max_num_threads=1024 -thread_warp_size=32", "batch_matmul.cuda", [["TENSOR", [64, 2048, 512], "float32"], ["TENSOR", [64, 1, 512], "float32"]], {}], "config": {"index": 1966, "code_hash": null, "entity": [["tile_y", "sp", [-1, 16, 2]], ["tile_x", "sp", [-1, 1, 1]], ["tile_k", "sp", [-1, 32]], ["auto_unroll_max_step", "ot", 32], ["unroll_explicit", "ot", 0]]}, "result": [[0.0013738879272727272], 0, 1.5540220737457275, 1595308231.4206338], "version": 0.2, "tvm_version": "0.7.dev1"}
{"input": ["cuda -keys=cuda,gpu -max_num_threads=1024 -thread_warp_size=32", "batch_matmul.cuda", [["TENSOR", [64, 2048, 512], "float32"], ["TENSOR", [64, 1, 512], "float32"]], {}], "config": {"index": 1186, "code_hash": null, "entity": [["tile_y", "sp", [-1, 16, 2]], ["tile_x", "sp", [-1, 1, 1]], ["tile_k", "sp", [-1, 32]], ["auto_unroll_max_step", "ot", 16], ["unroll_explicit", "ot", 0]]}, "result": [[0.0015247933535353535], 0, 1.4284532070159912, 1595308232.4990425], "version": 0.2, "tvm_version": "0.7.dev1"}
{"input": ["cuda -keys=cuda,gpu -max_num_threads=1024 -thread_warp_size=32", "batch_matmul.cuda", [["TENSOR", [64, 2048, 512], "float32"], ["TENSOR", [64, 1, 512], "float32"]], {}], "config": {"index": 4383, "code_hash": null, "entity": [["tile_y", "sp", [-1, 8, 2]], ["tile_x", "sp", [-1, 1, 1]], ["tile_k", "sp", [-1, 64]], ["auto_unroll_max_step", "ot", 16], ["unroll_explicit", "ot", 1]]}, "result": [[0.0015622475999999999], 0, 1.949101209640503, 1595308234.035123], "version": 0.2, "tvm_version": "0.7.dev1"}
{"input": ["cuda -keys=cuda,gpu -max_num_threads=1024 -thread_warp_size=32", "batch_matmul.cuda", [["TENSOR", [64, 2048, 512], "float32"], ["TENSOR", [64, 1, 512], "float32"]], {}], "config": {"index": 5943, "code_hash": null, "entity": [["tile_y", "sp", [-1, 8, 2]], ["tile_x", "sp", [-1, 1, 1]], ["tile_k", "sp", [-1, 64]], ["auto_unroll_max_step", "ot", 64], ["unroll_explicit", "ot", 1]]}, "result": [[0.001495969514851485], 0, 1.7539842128753662, 1595308235.2583058], "version": 0.2, "tvm_version": "0.7.dev1"}
{"input": ["cuda -keys=cuda,gpu -max_num_threads=1024 -thread_warp_size=32", "batch_matmul.cuda", [["TENSOR", [64, 2048, 512], "float32"], ["TENSOR", [64, 1, 512], "float32"]], {}], "config": {"index": 5163, "code_hash": null, "entity": [["tile_y", "sp", [-1, 8, 2]], ["tile_x", "sp", [-1, 1, 1]], ["tile_k", "sp", [-1, 64]], ["auto_unroll_max_step", "ot", 32], ["unroll_explicit", "ot", 1]]}, "result": [[0.001561978918918919], 0, 1.8664319515228271, 1595308236.6664352], "version": 0.2, "tvm_version": "0.7.dev1"}
{"input": ["cuda -keys=cuda,gpu -max_num_threads=1024 -thread_warp_size=32", "batch_matmul.cuda", [["TENSOR", [64, 2048, 512], "float32"], ["TENSOR", [64, 1, 512], "float32"]], {}], "config": {"index": 3535, "code_hash": null, "entity": [["tile_y", "sp", [-1, 4, 4]], ["tile_x", "sp", [-1, 1, 1]], ["tile_k", "sp", [-1, 32]], ["auto_unroll_max_step", "ot", 8], ["unroll_explicit", "ot", 1]]}, "result": [[0.001849156103174603], 0, 1.901818037033081, 1595308238.0842173], "version": 0.2, "tvm_version": "0.7.dev1"}
{"input": ["cuda -keys=cuda,gpu -max_num_threads=1024 -thread_warp_size=32", "batch_matmul.cuda", [["TENSOR", [64, 2048, 512], "float32"], ["TENSOR", [64, 1, 512], "float32"]], {}], "config": {"index": 416, "code_hash": null, "entity": [["tile_y", "sp", [-1, 8, 4]], ["tile_x", "sp", [-1, 1, 1]], ["tile_k", "sp", [-1, 32]], ["auto_unroll_max_step", "ot", 8], ["unroll_explicit", "ot", 0]]}, "result": [[0.0015646091972789115], 0, 1.9181933403015137, 1595308239.5747042], "version": 0.2, "tvm_version": "0.7.dev1"}
{"input": ["cuda -keys=cuda,gpu -max_num_threads=1024 -thread_warp_size=32", "batch_matmul.cuda", [["TENSOR", [64, 2048, 512], "float32"], ["TENSOR", [64, 1, 512], "float32"]], {}], "config": {"index": 4255, "code_hash": null, "entity": [["tile_y", "sp", [-1, 2, 16]], ["tile_x", "sp", [-1, 1, 1]], ["tile_k", "sp", [-1, 16]], ["auto_unroll_max_step", "ot", 16], ["unroll_explicit", "ot", 1]]}, "result": [[0.003611173880952381], 0, 1.5623843669891357, 1595308240.6912627], "version": 0.2, "tvm_version": "0.7.dev1"}
{"input": ["cuda -keys=cuda,gpu -max_num_threads=1024 -thread_warp_size=32", "batch_matmul.cuda", [["TENSOR", [64, 2048, 512], "float32"], ["TENSOR", [64, 1, 512], "float32"]], {}], "config": {"index": 3467, "code_hash": null, "entity": [["tile_y", "sp", [-1, 4, 8]], ["tile_x", "sp", [-1, 1, 1]], ["tile_k", "sp", [-1, 16]], ["auto_unroll_max_step", "ot", 8], ["unroll_explicit", "ot", 1]]}, "result": [[0.0019313130512820513], 0, 1.5753204822540283, 1595308241.7654212], "version": 0.2, "tvm_version": "0.7.dev1"}
{"input": ["cuda -keys=cuda,gpu -max_num_threads=1024 -thread_warp_size=32", "batch_matmul.cuda", [["TENSOR", [64, 2048, 512], "float32"], ["TENSOR", [64, 1, 512], "float32"]], {}], "config": {"index": 1907, "code_hash": null, "entity": [["tile_y", "sp", [-1, 4, 8]], ["tile_x", "sp", [-1, 1, 1]], ["tile_k", "sp", [-1, 16]], ["auto_unroll_max_step", "ot", 32], ["unroll_explicit", "ot", 0]]}, "result": [[0.0018462979156626505], 0, 1.5509676933288574, 1595308242.856551], "version": 0.2, "tvm_version": "0.7.dev1"}
{"input": ["cuda -keys=cuda,gpu -max_num_threads=1024 -thread_warp_size=32", "batch_matmul.cuda", [["TENSOR", [64, 2048, 512], "float32"], ["TENSOR", [64, 1, 512], "float32"]], {}], "config": {"index": 1127, "code_hash": null, "entity": [["tile_y", "sp", [-1, 4, 8]], ["tile_x", "sp", [-1, 1, 1]], ["tile_k", "sp", [-1, 16]], ["auto_unroll_max_step", "ot", 16], ["unroll_explicit", "ot", 0]]}, "result": [[0.0018462683809523808], 0, 1.8386247158050537, 1595308244.2609627], "version": 0.2, "tvm_version": "0.7.dev1"}
{"input": ["cuda -keys=cuda,gpu -max_num_threads=1024 -thread_warp_size=32", "batch_matmul.cuda", [["TENSOR", [64, 2048, 512], "float32"], ["TENSOR", [64, 1, 512], "float32"]], {}], "config": {"index": 5885, "code_hash": null, "entity": [["tile_y", "sp", [-1, 4, 8]], ["tile_x", "sp", [-1, 1, 1]], ["tile_k", "sp", [-1, 32]], ["auto_unroll_max_step", "ot", 64], ["unroll_explicit", "ot", 1]]}, "result": [[0.0017113981851851854], 0, 1.8848373889923096, 1595308245.6928601], "version": 0.2, "tvm_version": "0.7.dev1"}
{"input": ["cuda -keys=cuda,gpu -max_num_threads=1024 -thread_warp_size=32", "batch_matmul.cuda", [["TENSOR", [64, 2048, 512], "float32"], ["TENSOR", [64, 1, 512], "float32"]], {}], "config": {"index": 3466, "code_hash": null, "entity": [["tile_y", "sp", [-1, 2, 8]], ["tile_x", "sp", [-1, 1, 1]], ["tile_k", "sp", [-1, 16]], ["auto_unroll_max_step", "ot", 8], ["unroll_explicit", "ot", 1]]}, "result": [[0.002396456238095238], 0, 1.5034947395324707, 1595308246.7666738], "version": 0.2, "tvm_version": "0.7.dev1"}
{"input": ["cuda -keys=cuda,gpu -max_num_threads=1024 -thread_warp_size=32", "batch_matmul.cuda", [["TENSOR", [64, 2048, 512], "float32"], ["TENSOR", [64, 1, 512], "float32"]], {}], "config": {"index": 2687, "code_hash": null, "entity": [["tile_y", "sp", [-1, 4, 8]], ["tile_x", "sp", [-1, 1, 1]], ["tile_k", "sp", [-1, 16]], ["auto_unroll_max_step", "ot", 64], ["unroll_explicit", "ot", 0]]}, "result": [[0.0018486743543307087], 0, 1.8764903545379639, 1595308248.1754246], "version": 0.2, "tvm_version": "0.7.dev1"}
{"input": ["cuda -keys=cuda,gpu -max_num_threads=1024 -thread_warp_size=32", "batch_matmul.cuda", [["TENSOR", [64, 2048, 512], "float32"], ["TENSOR", [64, 1, 512], "float32"]], {}], "config": {"index": 5875, "code_hash": null, "entity": [["tile_y", "sp", [-1, 4, 4]], ["tile_x", "sp", [-1, 1, 1]], ["tile_k", "sp", [-1, 32]], ["auto_unroll_max_step", "ot", 64], ["unroll_explicit", "ot", 1]]}, "result": [[0.001934593165289256], 0, 1.858511209487915, 1595308249.5890272], "version": 0.2, "tvm_version": "0.7.dev1"}
{"input": ["cuda -keys=cuda,gpu -max_num_threads=1024 -thread_warp_size=32", "batch_matmul.cuda", [["TENSOR", [64, 2048, 512], "float32"], ["TENSOR", [64, 1, 512], "float32"]], {}], "config": {"index": 406, "code_hash": null, "entity": [["tile_y", "sp", [-1, 16, 2]], ["tile_x", "sp", [-1, 1, 1]], ["tile_k", "sp", [-1, 32]], ["auto_unroll_max_step", "ot", 8], ["unroll_explicit", "ot", 0]]}, "result": [[0.0015249115263157894], 0, 1.8755595684051514, 1595308251.008805], "version": 0.2, "tvm_version": "0.7.dev1"}
{"input": ["cuda -keys=cuda,gpu -max_num_threads=1024 -thread_warp_size=32", "batch_matmul.cuda", [["TENSOR", [64, 2048, 512], "float32"], ["TENSOR", [64, 1, 512], "float32"]], {}], "config": {"index": 2756, "code_hash": null, "entity": [["tile_y", "sp", [-1, 8, 4]], ["tile_x", "sp", [-1, 1, 1]], ["tile_k", "sp", [-1, 32]], ["auto_unroll_max_step", "ot", 64], ["unroll_explicit", "ot", 0]]}, "result": [[0.001549398993243243], 0, 1.9301598072052002, 1595308252.4881072], "version": 0.2, "tvm_version": "0.7.dev1"}
{"input": ["cuda -keys=cuda,gpu -max_num_threads=1024 -thread_warp_size=32", "batch_matmul.cuda", [["TENSOR", [64, 2048, 512], "float32"], ["TENSOR", [64, 1, 512], "float32"]], {}], "config": {"index": 1906, "code_hash": null, "entity": [["tile_y", "sp", [-1, 2, 8]], ["tile_x", "sp", [-1, 1, 1]], ["tile_k", "sp", [-1, 16]], ["auto_unroll_max_step", "ot", 32], ["unroll_explicit", "ot", 0]]}, "result": [[0.002379310734375], 0, 1.4746451377868652, 1595308253.588528], "version": 0.2, "tvm_version": "0.7.dev1"}
{"input": ["cuda -keys=cuda,gpu -max_num_threads=1024 -thread_warp_size=32", "batch_matmul.cuda", [["TENSOR", [64, 2048, 512], "float32"], ["TENSOR", [64, 1, 512], "float32"]], {}], "config": {"index": 1126, "code_hash": null, "entity": [["tile_y", "sp", [-1, 2, 8]], ["tile_x", "sp", [-1, 1, 1]], ["tile_k", "sp", [-1, 16]], ["auto_unroll_max_step", "ot", 16], ["unroll_explicit", "ot", 0]]}, "result": [[0.0023797639], 0, 1.8554894924163818, 1595308255.0447483], "version": 0.2, "tvm_version": "0.7.dev1"}
{"input": ["cuda -keys=cuda,gpu -max_num_threads=1024 -thread_warp_size=32", "batch_matmul.cuda", [["TENSOR", [64, 2048, 512], "float32"], ["TENSOR", [64, 1, 512], "float32"]], {}], "config": {"index": 3603, "code_hash": null, "entity": [["tile_y", "sp", [-1, 8, 2]], ["tile_x", "sp", [-1, 1, 1]], ["tile_k", "sp", [-1, 64]], ["auto_unroll_max_step", "ot", 8], ["unroll_explicit", "ot", 1]]}, "result": [[0.0015623157278911565], 0, 1.9614768028259277, 1595308256.5657156], "version": 0.2, "tvm_version": "0.7.dev1"}
{"input": ["cuda -keys=cuda,gpu -max_num_threads=1024 -thread_warp_size=32", "batch_matmul.cuda", [["TENSOR", [64, 2048, 512], "float32"], ["TENSOR", [64, 1, 512], "float32"]], {}], "config": {"index": 4238, "code_hash": null, "entity": [["tile_y", "sp", [-1, 8, 4]], ["tile_x", "sp", [-1, 1, 1]], ["tile_k", "sp", [-1, 16]], ["auto_unroll_max_step", "ot", 16], ["unroll_explicit", "ot", 1]]}, "result": [[0.001722869892857143], 0, 1.924487829208374, 1595308258.0507698], "version": 0.2, "tvm_version": "0.7.dev1"}
{"input": ["cuda -keys=cuda,gpu -max_num_threads=1024 -thread_warp_size=32", "batch_matmul.cuda", [["TENSOR", [64, 2048, 512], "float32"], ["TENSOR", [64, 1, 512], "float32"]], {}], "config": {"index": 5018, "code_hash": null, "entity": [["tile_y", "sp", [-1, 8, 4]], ["tile_x", "sp", [-1, 1, 1]], ["tile_k", "sp", [-1, 16]], ["auto_unroll_max_step", "ot", 32], ["unroll_explicit", "ot", 1]]}, "result": [[0.0017239733777777778], 0, 1.917830467224121, 1595308259.581324], "version": 0.2, "tvm_version": "0.7.dev1"}
{"input": ["cuda -keys=cuda,gpu -max_num_threads=1024 -thread_warp_size=32", "batch_matmul.cuda", [["TENSOR", [64, 2048, 512], "float32"], ["TENSOR", [64, 1, 512], "float32"]], {}], "config": {"index": 2122, "code_hash": null, "entity": [["tile_y", "sp", [-1, 16, 2]], ["tile_x", "sp", [-1, 1, 1]], ["tile_k", "sp", [-1, 128]], ["auto_unroll_max_step", "ot", 32], ["unroll_explicit", "ot", 0]]}, "result": [[0.0016480126530612244], 0, 2.000713586807251, 1595308261.1410108], "version": 0.2, "tvm_version": "0.7.dev1"}
{"input": ["cuda -keys=cuda,gpu -max_num_threads=1024 -thread_warp_size=32", "batch_matmul.cuda", [["TENSOR", [64, 2048, 512], "float32"], ["TENSOR", [64, 1, 512], "float32"]], {}], "config": {"index": 1342, "code_hash": null, "entity": [["tile_y", "sp", [-1, 16, 2]], ["tile_x", "sp", [-1, 1, 1]], ["tile_k", "sp", [-1, 128]], ["auto_unroll_max_step", "ot", 16], ["unroll_explicit", "ot", 0]]}, "result": [[0.001649116838028169], 0, 1.8315834999084473, 1595308262.59178], "version": 0.2, "tvm_version": "0.7.dev1"}
{"input": ["cuda -keys=cuda,gpu -max_num_threads=1024 -thread_warp_size=32", "batch_matmul.cuda", [["TENSOR", [64, 2048, 512], "float32"], ["TENSOR", [64, 1, 512], "float32"]], {}], "config": {"index": 2902, "code_hash": null, "entity": [["tile_y", "sp", [-1, 16, 2]], ["tile_x", "sp", [-1, 1, 1]], ["tile_k", "sp", [-1, 128]], ["auto_unroll_max_step", "ot", 64], ["unroll_explicit", "ot", 0]]}, "result": [[0.0016466056971830986], 0, 1.8545598983764648, 1595308264.028876], "version": 0.2, "tvm_version": "0.7.dev1"}
{"input": ["cuda -keys=cuda,gpu -max_num_threads=1024 -thread_warp_size=32", "batch_matmul.cuda", [["TENSOR", [64, 2048, 512], "float32"], ["TENSOR", [64, 1, 512], "float32"]], {}], "config": {"index": 3545, "code_hash": null, "entity": [["tile_y", "sp", [-1, 4, 8]], ["tile_x", "sp", [-1, 1, 1]], ["tile_k", "sp", [-1, 32]], ["auto_unroll_max_step", "ot", 8], ["unroll_explicit", "ot", 1]]}, "result": [[0.0017193748148148149], 0, 1.8955078125, 1595308265.5732355], "version": 0.2, "tvm_version": "0.7.dev1"}
{"input": ["cuda -keys=cuda,gpu -max_num_threads=1024 -thread_warp_size=32", "batch_matmul.cuda", [["TENSOR", [64, 2048, 512], "float32"], ["TENSOR", [64, 1, 512], "float32"]], {}], "config": {"index": 2686, "code_hash": null, "entity": [["tile_y", "sp", [-1, 2, 8]], ["tile_x", "sp", [-1, 1, 1]], ["tile_k", "sp", [-1, 16]], ["auto_unroll_max_step", "ot", 64], ["unroll_explicit", "ot", 0]]}, "result": [[0.00237975219], 0, 1.8655343055725098, 1595308267.0355833], "version": 0.2, "tvm_version": "0.7.dev1"}
{"input": ["cuda -keys=cuda,gpu -max_num_threads=1024 -thread_warp_size=32", "batch_matmul.cuda", [["TENSOR", [64, 2048, 512], "float32"], ["TENSOR", [64, 1, 512], "float32"]], {}], "config": {"index": 5815, "code_hash": null, "entity": [["tile_y", "sp", [-1, 2, 16]], ["tile_x", "sp", [-1, 1, 1]], ["tile_k", "sp", [-1, 16]], ["auto_unroll_max_step", "ot", 64], ["unroll_explicit", "ot", 1]]}, "result": [[0.0036129924523809523], 0, 1.5927104949951172, 1595308268.2113938], "version": 0.2, "tvm_version": "0.7.dev1"}
{"input": ["cuda -keys=cuda,gpu -max_num_threads=1024 -thread_warp_size=32", "batch_matmul.cuda", [["TENSOR", [64, 2048, 512], "float32"], ["TENSOR", [64, 1, 512], "float32"]], {}], "config": {"index": 1205, "code_hash": null, "entity": [["tile_y", "sp", [-1, 4, 8]], ["tile_x", "sp", [-1, 1, 1]], ["tile_k", "sp", [-1, 32]], ["auto_unroll_max_step", "ot", 16], ["unroll_explicit", "ot", 0]]}, "result": [[0.0017193020285714285], 0, 1.834273338317871, 1595308269.6981602], "version": 0.2, "tvm_version": "0.7.dev1"}
{"input": ["cuda -keys=cuda,gpu -max_num_threads=1024 -thread_warp_size=32", "batch_matmul.cuda", [["TENSOR", [64, 2048, 512], "float32"], ["TENSOR", [64, 1, 512], "float32"]], {}], "config": {"index": 1985, "code_hash": null, "entity": [["tile_y", "sp", [-1, 4, 8]], ["tile_x", "sp", [-1, 1, 1]], ["tile_k", "sp", [-1, 32]], ["auto_unroll_max_step", "ot", 32], ["unroll_explicit", "ot", 0]]}, "result": [[0.0017127848977272727], 0, 1.4662792682647705, 1595308270.808138], "version": 0.2, "tvm_version": "0.7.dev1"}
{"input": ["cuda -keys=cuda,gpu -max_num_threads=1024 -thread_warp_size=32", "batch_matmul.cuda", [["TENSOR", [64, 2048, 512], "float32"], ["TENSOR", [64, 1, 512], "float32"]], {}], "config": {"index": 2515, "code_hash": null, "entity": [["tile_y", "sp", [-1, 128, 2]], ["tile_x", "sp", [-1, 1, 1]], ["tile_k", "sp", [-1, 4]], ["auto_unroll_max_step", "ot", 64], ["unroll_explicit", "ot", 0]]}, "result": [[0.005875476615384615], 0, 1.4336581230163574, 1595308271.9070024], "version": 0.2, "tvm_version": "0.7.dev1"}
{"input": ["cuda -keys=cuda,gpu -max_num_threads=1024 -thread_warp_size=32", "batch_matmul.cuda", [["TENSOR", [64, 2048, 512], "float32"], ["TENSOR", [64, 1, 512], "float32"]], {}], "config": {"index": 239, "code_hash": null, "entity": [["tile_y", "sp", [-1, 32, 1]], ["tile_x", "sp", [-1, 1, 1]], ["tile_k", "sp", [-1, 8]], ["auto_unroll_max_step", "ot", 8], ["unroll_explicit", "ot", 0]]}, "result": [[0.0023730689375], 0, 1.4739041328430176, 1595308273.2697694], "version": 0.2, "tvm_version": "0.7.dev1"}
{"input": ["cuda -keys=cuda,gpu -max_num_threads=1024 -thread_warp_size=32", "batch_matmul.cuda", [["TENSOR", [64, 2048, 512], "float32"], ["TENSOR", [64, 1, 512], "float32"]], {}], "config": {"index": 3672, "code_hash": null, "entity": [["tile_y", "sp", [-1, 64, 1]], ["tile_x", "sp", [-1, 1, 1]], ["tile_k", "sp", [-1, 128]], ["auto_unroll_max_step", "ot", 8], ["unroll_explicit", "ot", 1]]}, "result": [[0.0018642563086419752], 0, 1.4049172401428223, 1595308274.3711011], "version": 0.2, "tvm_version": "0.7.dev1"}
{"input": ["cuda -keys=cuda,gpu -max_num_threads=1024 -thread_warp_size=32", "batch_matmul.cuda", [["TENSOR", [64, 2048, 512], "float32"], ["TENSOR", [64, 1, 512], "float32"]], {}], "config": {"index": 5138, "code_hash": null, "entity": [["tile_y", "sp", [-1, 1, 256]], ["tile_x", "sp", [-1, 1, 1]], ["tile_k", "sp", [-1, 32]], ["auto_unroll_max_step", "ot", 32], ["unroll_explicit", "ot", 1]]}, "result": [[0.06105943575], 0, 1.7981774806976318, 1595308275.8468535], "version": 0.2, "tvm_version": "0.7.dev1"}
{"input": ["cuda -keys=cuda,gpu -max_num_threads=1024 -thread_warp_size=32", "batch_matmul.cuda", [["TENSOR", [64, 2048, 512], "float32"], ["TENSOR", [64, 1, 512], "float32"]], {}], "config": {"index": 304, "code_hash": null, "entity": [["tile_y", "sp", [-1, 4, 256]], ["tile_x", "sp", [-1, 1, 1]], ["tile_k", "sp", [-1, 8]], ["auto_unroll_max_step", "ot", 8], ["unroll_explicit", "ot", 0]]}, "result": [[0.021404788125], 0, 1.870729923248291, 1595308277.2946198], "version": 0.2, "tvm_version": "0.7.dev1"}
{"input": ["cuda -keys=cuda,gpu -max_num_threads=1024 -thread_warp_size=32", "batch_matmul.cuda", [["TENSOR", [64, 2048, 512], "float32"], ["TENSOR", [64, 1, 512], "float32"]], {}], "config": {"index": 4098, "code_hash": null, "entity": [["tile_y", "sp", [-1, 1, 16]], ["tile_x", "sp", [-1, 1, 1]], ["tile_k", "sp", [-1, 4]], ["auto_unroll_max_step", "ot", 16], ["unroll_explicit", "ot", 1]]}, "result": [[0.00469805378125], 0, 1.4459080696105957, 1595308278.3789568], "version": 0.2, "tvm_version": "0.7.dev1"}
{"input": ["cuda -keys=cuda,gpu -max_num_threads=1024 -thread_warp_size=32", "batch_matmul.cuda", [["TENSOR", [64, 2048, 512], "float32"], ["TENSOR", [64, 1, 512], "float32"]], {}], "config": {"index": 5152, "code_hash": null, "entity": [["tile_y", "sp", [-1, 16, 1]], ["tile_x", "sp", [-1, 1, 1]], ["tile_k", "sp", [-1, 64]], ["auto_unroll_max_step", "ot", 32], ["unroll_explicit", "ot", 1]]}, "result": [[0.00167170075], 0, 1.8421521186828613, 1595308288.6430938], "version": 0.2, "tvm_version": "0.7.dev1"}
{"input": ["cuda -keys=cuda,gpu -max_num_threads=1024 -thread_warp_size=32", "batch_matmul.cuda", [["TENSOR", [64, 2048, 512], "float32"], ["TENSOR", [64, 1, 512], "float32"]], {}], "config": {"index": 5097, "code_hash": null, "entity": [["tile_y", "sp", [-1, 16, 4]], ["tile_x", "sp", [-1, 1, 1]], ["tile_k", "sp", [-1, 32]], ["auto_unroll_max_step", "ot", 32], ["unroll_explicit", "ot", 1]]}, "result": [[0.0011464935877862595], 0, 1.6428039073944092, 1595308289.819778], "version": 0.2, "tvm_version": "0.7.dev1"}
{"input": ["cuda -keys=cuda,gpu -max_num_threads=1024 -thread_warp_size=32", "batch_matmul.cuda", [["TENSOR", [64, 2048, 512], "float32"], ["TENSOR", [64, 1, 512], "float32"]], {}], "config": {"index": 5932, "code_hash": null, "entity": [["tile_y", "sp", [-1, 16, 1]], ["tile_x", "sp", [-1, 1, 1]], ["tile_k", "sp", [-1, 64]], ["auto_unroll_max_step", "ot", 64], ["unroll_explicit", "ot", 1]]}, "result": [[0.0014591780970873787], 0, 1.5604240894317627, 1595308290.8904748], "version": 0.2, "tvm_version": "0.7.dev1"}
{"input": ["cuda -keys=cuda,gpu -max_num_threads=1024 -thread_warp_size=32", "batch_matmul.cuda", [["TENSOR", [64, 2048, 512], "float32"], ["TENSOR", [64, 1, 512], "float32"]], {}], "config": {"index": 4317, "code_hash": null, "entity": [["tile_y", "sp", [-1, 16, 4]], ["tile_x", "sp", [-1, 1, 1]], ["tile_k", "sp", [-1, 32]], ["auto_unroll_max_step", "ot", 16], ["unroll_explicit", "ot", 1]]}, "result": [[0.0012809269523809525], 0, 1.9210851192474365, 1595308292.4054027], "version": 0.2, "tvm_version": "0.7.dev1"}
{"input": ["cuda -keys=cuda,gpu -max_num_threads=1024 -thread_warp_size=32", "batch_matmul.cuda", [["TENSOR", [64, 2048, 512], "float32"], ["TENSOR", [64, 1, 512], "float32"]], {}], "config": {"index": 4372, "code_hash": null, "entity": [["tile_y", "sp", [-1, 16, 1]], ["tile_x", "sp", [-1, 1, 1]], ["tile_k", "sp", [-1, 64]], ["auto_unroll_max_step", "ot", 16], ["unroll_explicit", "ot", 1]]}, "result": [[0.0016686240503597123], 0, 1.7877628803253174, 1595308293.840314], "version": 0.2, "tvm_version": "0.7.dev1"}
{"input": ["cuda -keys=cuda,gpu -max_num_threads=1024 -thread_warp_size=32", "batch_matmul.cuda", [["TENSOR", [64, 2048, 512], "float32"], ["TENSOR", [64, 1, 512], "float32"]], {}], "config": {"index": 3537, "code_hash": null, "entity": [["tile_y", "sp", [-1, 16, 4]], ["tile_x", "sp", [-1, 1, 1]], ["tile_k", "sp", [-1, 32]], ["auto_unroll_max_step", "ot", 8], ["unroll_explicit", "ot", 1]]}, "result": [[0.0012805095586592178], 0, 1.8012926578521729, 1595308295.2473476], "version": 0.2, "tvm_version": "0.7.dev1"}
{"input": ["cuda -keys=cuda,gpu -max_num_threads=1024 -thread_warp_size=32", "batch_matmul.cuda", [["TENSOR", [64, 2048, 512], "float32"], ["TENSOR", [64, 1, 512], "float32"]], {}], "config": {"index": 2032, "code_hash": null, "entity": [["tile_y", "sp", [-1, 16, 1]], ["tile_x", "sp", [-1, 1, 1]], ["tile_k", "sp", [-1, 64]], ["auto_unroll_max_step", "ot", 32], ["unroll_explicit", "ot", 0]]}, "result": [[0.0016686878129496402], 0, 1.8382129669189453, 1595308296.6511033], "version": 0.2, "tvm_version": "0.7.dev1"}
{"input": ["cuda -keys=cuda,gpu -max_num_threads=1024 -thread_warp_size=32", "batch_matmul.cuda", [["TENSOR", [64, 2048, 512], "float32"], ["TENSOR", [64, 1, 512], "float32"]], {}], "config": {"index": 5877, "code_hash": null, "entity": [["tile_y", "sp", [-1, 16, 4]], ["tile_x", "sp", [-1, 1, 1]], ["tile_k", "sp", [-1, 32]], ["auto_unroll_max_step", "ot", 64], ["unroll_explicit", "ot", 1]]}, "result": [[0.00114686261], 0, 1.8168606758117676, 1595308298.05921], "version": 0.2, "tvm_version": "0.7.dev1"}
{"input": ["cuda -keys=cuda,gpu -max_num_threads=1024 -thread_warp_size=32", "batch_matmul.cuda", [["TENSOR", [64, 2048, 512], "float32"], ["TENSOR", [64, 1, 512], "float32"]], {}], "config": {"index": 3593, "code_hash": null, "entity": [["tile_y", "sp", [-1, 32, 1]], ["tile_x", "sp", [-1, 1, 1]], ["tile_k", "sp", [-1, 64]], ["auto_unroll_max_step", "ot", 8], ["unroll_explicit", "ot", 1]]}, "result": [[0.0014497117403846154], 0, 1.630767822265625, 1595308299.3289294], "version": 0.2, "tvm_version": "0.7.dev1"}
{"input": ["cuda -keys=cuda,gpu -max_num_threads=1024 -thread_warp_size=32", "batch_matmul.cuda", [["TENSOR", [64, 2048, 512], "float32"], ["TENSOR", [64, 1, 512], "float32"]], {}], "config": {"index": 5230, "code_hash": null, "entity": [["tile_y", "sp", [-1, 16, 1]], ["tile_x", "sp", [-1, 1, 1]], ["tile_k", "sp", [-1, 128]], ["auto_unroll_max_step", "ot", 32], ["unroll_explicit", "ot", 1]]}, "result": [[0.0014441592795031055], 0, 1.7524404525756836, 1595308300.7661564], "version": 0.2, "tvm_version": "0.7.dev1"}
{"input": ["cuda -keys=cuda,gpu -max_num_threads=1024 -thread_warp_size=32", "batch_matmul.cuda", [["TENSOR", [64, 2048, 512], "float32"], ["TENSOR", [64, 1, 512], "float32"]], {}], "config": {"index": 3592, "code_hash": null, "entity": [["tile_y", "sp", [-1, 16, 1]], ["tile_x", "sp", [-1, 1, 1]], ["tile_k", "sp", [-1, 64]], ["auto_unroll_max_step", "ot", 8], ["unroll_explicit", "ot", 1]]}, "result": [[0.0016685422877697842], 0, 1.7826437950134277, 1595308302.1949983], "version": 0.2, "tvm_version": "0.7.dev1"}
{"input": ["cuda -keys=cuda,gpu -max_num_threads=1024 -thread_warp_size=32", "batch_matmul.cuda", [["TENSOR", [64, 2048, 512], "float32"], ["TENSOR", [64, 1, 512], "float32"]], {}], "config": {"index": 4373, "code_hash": null, "entity": [["tile_y", "sp", [-1, 32, 1]], ["tile_x", "sp", [-1, 1, 1]], ["tile_k", "sp", [-1, 64]], ["auto_unroll_max_step", "ot", 16], ["unroll_explicit", "ot", 1]]}, "result": [[0.001449577158227848], 0, 1.8715407848358154, 1595308303.6133142], "version": 0.2, "tvm_version": "0.7.dev1"}
{"input": ["cuda -keys=cuda,gpu -max_num_threads=1024 -thread_warp_size=32", "batch_matmul.cuda", [["TENSOR", [64, 2048, 512], "float32"], ["TENSOR", [64, 1, 512], "float32"]], {}], "config": {"index": 5153, "code_hash": null, "entity": [["tile_y", "sp", [-1, 32, 1]], ["tile_x", "sp", [-1, 1, 1]], ["tile_k", "sp", [-1, 64]], ["auto_unroll_max_step", "ot", 32], ["unroll_explicit", "ot", 1]]}, "result": [[0.0014496448797468354], 0, 1.8005058765411377, 1595308305.0360284], "version": 0.2, "tvm_version": "0.7.dev1"}
{"input": ["cuda -keys=cuda,gpu -max_num_threads=1024 -thread_warp_size=32", "batch_matmul.cuda", [["TENSOR", [64, 2048, 512], "float32"], ["TENSOR", [64, 1, 512], "float32"]], {}], "config": {"index": 4450, "code_hash": null, "entity": [["tile_y", "sp", [-1, 16, 1]], ["tile_x", "sp", [-1, 1, 1]], ["tile_k", "sp", [-1, 128]], ["auto_unroll_max_step", "ot", 16], ["unroll_explicit", "ot", 1]]}, "result": [[0.001444775093167702], 0, 2.11124849319458, 1595308306.5669196], "version": 0.2, "tvm_version": "0.7.dev1"}
{"input": ["cuda -keys=cuda,gpu -max_num_threads=1024 -thread_warp_size=32", "batch_matmul.cuda", [["TENSOR", [64, 2048, 512], "float32"], ["TENSOR", [64, 1, 512], "float32"]], {}], "config": {"index": 1197, "code_hash": null, "entity": [["tile_y", "sp", [-1, 16, 4]], ["tile_x", "sp", [-1, 1, 1]], ["tile_k", "sp", [-1, 32]], ["auto_unroll_max_step", "ot", 16], ["unroll_explicit", "ot", 0]]}, "result": [[0.0012810513703703703], 0, 1.986584186553955, 1595308308.0902426], "version": 0.2, "tvm_version": "0.7.dev1"}
{"input": ["cuda -keys=cuda,gpu -max_num_threads=1024 -thread_warp_size=32", "batch_matmul.cuda", [["TENSOR", [64, 2048, 512], "float32"], ["TENSOR", [64, 1, 512], "float32"]], {}], "config": {"index": 5933, "code_hash": null, "entity": [["tile_y", "sp", [-1, 32, 1]], ["tile_x", "sp", [-1, 1, 1]], ["tile_k", "sp", [-1, 64]], ["auto_unroll_max_step", "ot", 64], ["unroll_explicit", "ot", 1]]}, "result": [[0.0011915601984126983], 0, 1.7032756805419922, 1595308309.3225427], "version": 0.2, "tvm_version": "0.7.dev1"}
