tvm/matmul_(1,1,16384,512).log
{"input": ["cuda -keys=cuda,gpu -max_num_threads=1024 -thread_warp_size=32", "batch_matmul.cuda", [["TENSOR", [1, 1, 512], "float32"], ["TENSOR", [1, 16384, 512], "float32"]], {}], "config": {"index": 6006, "code_hash": null, "entity": [["tile_y", "sp", [-1, 1, 1]], ["tile_x", "sp", [-1, 64, 1]], ["tile_k", "sp", [-1, 1]], ["auto_unroll_max_step", "ot", 16], ["unroll_explicit", "ot", 1]]}, "result": [[0.00113466723655914], 0, 1.7735636234283447, 1595429742.9928355], "version": 0.2, "tvm_version": "0.7.dev1"}
{"input": ["cuda -keys=cuda,gpu -max_num_threads=1024 -thread_warp_size=32", "batch_matmul.cuda", [["TENSOR", [1, 1, 512], "float32"], ["TENSOR", [1, 16384, 512], "float32"]], {}], "config": {"index": 6159, "code_hash": null, "entity": [["tile_y", "sp", [-1, 1, 1]], ["tile_x", "sp", [-1, 1024, 4]], ["tile_k", "sp", [-1, 2]], ["auto_unroll_max_step", "ot", 16], ["unroll_explicit", "ot", 1]]}, "result": [[0.03592416166666667], 0, 1.8638527393341064, 1595429744.587326], "version": 0.2, "tvm_version": "0.7.dev1"}
{"input": ["cuda -keys=cuda,gpu -max_num_threads=1024 -thread_warp_size=32", "batch_matmul.cuda", [["TENSOR", [1, 1, 512], "float32"], ["TENSOR", [1, 16384, 512], "float32"]], {}], "config": {"index": 72, "code_hash": null, "entity": [["tile_y", "sp", [-1, 1, 1]], ["tile_x", "sp", [-1, 128, 32]], ["tile_k", "sp", [-1, 1]], ["auto_unroll_max_step", "ot", 8], ["unroll_explicit", "ot", 0]]}, "result": [[0.05757069975], 0, 1.7857296466827393, 1595429745.972925], "version": 0.2, "tvm_version": "0.7.dev1"}
{"input": ["cuda -keys=cuda,gpu -max_num_threads=1024 -thread_warp_size=32", "batch_matmul.cuda", [["TENSOR", [1, 1, 512], "float32"], ["TENSOR", [1, 16384, 512], "float32"]], {}], "config": {"index": 7414, "code_hash": null, "entity": [["tile_y", "sp", [-1, 1, 1]], ["tile_x", "sp", [-1, 4, 256]], ["tile_k", "sp", [-1, 2]], ["auto_unroll_max_step", "ot", 32], ["unroll_explicit", "ot", 1]]}, "result": [[0.013111779666666665], 0, 1.778494119644165, 1595429747.3765547], "version": 0.2, "tvm_version": "0.7.dev1"}
{"input": ["cuda -keys=cuda,gpu -max_num_threads=1024 -thread_warp_size=32", "batch_matmul.cuda", [["TENSOR", [1, 1, 512], "float32"], ["TENSOR", [1, 16384, 512], "float32"]], {}], "config": {"index": 8760, "code_hash": null, "entity": [["tile_y", "sp", [-1, 1, 1]], ["tile_x", "sp", [-1, 1, 1]], ["tile_k", "sp", [-1, 8]], ["auto_unroll_max_step", "ot", 64], ["unroll_explicit", "ot", 1]]}, "result": [[0.0008453586923076923], 0, 1.8898131847381592, 1595429748.8804202], "version": 0.2, "tvm_version": "0.7.dev1"}
{"input": ["cuda -keys=cuda,gpu -max_num_threads=1024 -thread_warp_size=32", "batch_matmul.cuda", [["TENSOR", [1, 1, 512], "float32"], ["TENSOR", [1, 16384, 512], "float32"]], {}], "config": {"index": 774, "code_hash": null, "entity": [["tile_y", "sp", [-1, 1, 1]], ["tile_x", "sp", [-1, 1, 16]], ["tile_k", "sp", [-1, 64]], ["auto_unroll_max_step", "ot", 8], ["unroll_explicit", "ot", 0]]}, "result": [[0.0011613705240384616], 0, 1.8954432010650635, 1595429750.5382025], "version": 0.2, "tvm_version": "0.7.dev1"}
{"input": ["cuda -keys=cuda,gpu -max_num_threads=1024 -thread_warp_size=32", "batch_matmul.cuda", [["TENSOR", [1, 1, 512], "float32"], ["TENSOR", [1, 16384, 512], "float32"]], {}], "config": {"index": 5422, "code_hash": null, "entity": [["tile_y", "sp", [-1, 1, 1]], ["tile_x", "sp", [-1, 128, 2]], ["tile_k", "sp", [-1, 32]], ["auto_unroll_max_step", "ot", 8], ["unroll_explicit", "ot", 1]]}, "result": [[0.0003854509011164274], 0, 1.8039820194244385, 1595429752.0219417], "version": 0.2, "tvm_version": "0.7.dev1"}
{"input": ["cuda -keys=cuda,gpu -max_num_threads=1024 -thread_warp_size=32", "batch_matmul.cuda", [["TENSOR", [1, 1, 512], "float32"], ["TENSOR", [1, 16384, 512], "float32"]], {}], "config": {"index": 1351, "code_hash": null, "entity": [["tile_y", "sp", [-1, 1, 1]], ["tile_x", "sp", [-1, 4, 4]], ["tile_k", "sp", [-1, 2]], ["auto_unroll_max_step", "ot", 16], ["unroll_explicit", "ot", 0]]}, "result": [[0.0006056666175298805], 0, 1.5652239322662354, 1595429753.2221768], "version": 0.2, "tvm_version": "0.7.dev1"}
{"input": ["cuda -keys=cuda,gpu -max_num_threads=1024 -thread_warp_size=32", "batch_matmul.cuda", [["TENSOR", [1, 1, 512], "float32"], ["TENSOR", [1, 16384, 512], "float32"]], {}], "config": {"index": 1566, "code_hash": null, "entity": [["tile_y", "sp", [-1, 1, 1]], ["tile_x", "sp", [-1, 64, 1]], ["tile_k", "sp", [-1, 8]], ["auto_unroll_max_step", "ot", 16], ["unroll_explicit", "ot", 0]]}, "result": [[0.0003815000063391442], 0, 1.9510164260864258, 1595429754.8718073], "version": 0.2, "tvm_version": "0.7.dev1"}
{"input": ["cuda -keys=cuda,gpu -max_num_threads=1024 -thread_warp_size=32", "batch_matmul.cuda", [["TENSOR", [1, 1, 512], "float32"], ["TENSOR", [1, 16384, 512], "float32"]], {}], "config": {"index": 6989, "code_hash": null, "entity": [["tile_y", "sp", [-1, 1, 1]], ["tile_x", "sp", [-1, 1, 4]], ["tile_k", "sp", [-1, 256]], ["auto_unroll_max_step", "ot", 16], ["unroll_explicit", "ot", 1]]}, "result": [[0.0006438106042553192], 0, 1.9183728694915771, 1595429756.5202382], "version": 0.2, "tvm_version": "0.7.dev1"}
{"input": ["cuda -keys=cuda,gpu -max_num_threads=1024 -thread_warp_size=32", "batch_matmul.cuda", [["TENSOR", [1, 1, 512], "float32"], ["TENSOR", [1, 16384, 512], "float32"]], {}], "config": {"index": 6906, "code_hash": null, "entity": [["tile_y", "sp", [-1, 1, 1]], ["tile_x", "sp", [-1, 2, 32]], ["tile_k", "sp", [-1, 128]], ["auto_unroll_max_step", "ot", 16], ["unroll_explicit", "ot", 1]]}, "result": [[0.0027250824107142857], 0, 1.5290310382843018, 1595429757.624675], "version": 0.2, "tvm_version": "0.7.dev1"}
{"input": ["cuda -keys=cuda,gpu -max_num_threads=1024 -thread_warp_size=32", "batch_matmul.cuda", [["TENSOR", [1, 1, 512], "float32"], ["TENSOR", [1, 16384, 512], "float32"]], {}], "config": {"index": 3816, "code_hash": null, "entity": [["tile_y", "sp", [-1, 1, 1]], ["tile_x", "sp", [-1, 16, 256]], ["tile_k", "sp", [-1, 2]], ["auto_unroll_max_step", "ot", 64], ["unroll_explicit", "ot", 0]]}, "result": [[0.03774038125], 0, 1.6043164730072021, 1595429758.7934685], "version": 0.2, "tvm_version": "0.7.dev1"}
{"input": ["cuda -keys=cuda,gpu -max_num_threads=1024 -thread_warp_size=32", "batch_matmul.cuda", [["TENSOR", [1, 1, 512], "float32"], ["TENSOR", [1, 16384, 512], "float32"]], {}], "config": {"index": 6370, "code_hash": null, "entity": [["tile_y", "sp", [-1, 1, 1]], ["tile_x", "sp", [-1, 1024, 1]], ["tile_k", "sp", [-1, 8]], ["auto_unroll_max_step", "ot", 16], ["unroll_explicit", "ot", 1]]}, "result": [[0.0024643468032786884], 0, 1.4210295677185059, 1595429760.31213], "version": 0.2, "tvm_version": "0.7.dev1"}
{"input": ["cuda -keys=cuda,gpu -max_num_threads=1024 -thread_warp_size=32", "batch_matmul.cuda", [["TENSOR", [1, 1, 512], "float32"], ["TENSOR", [1, 16384, 512], "float32"]], {}], "config": {"index": 3682, "code_hash": null, "entity": [["tile_y", "sp", [-1, 1, 1]], ["tile_x", "sp", [-1, 128, 64]], ["tile_k", "sp", [-1, 1]], ["auto_unroll_max_step", "ot", 64], ["unroll_explicit", "ot", 0]]}, "result": [[0.2655572495], 0, 4.486786842346191, 1595429764.3922052], "version": 0.2, "tvm_version": "0.7.dev1"}
{"input": ["cuda -keys=cuda,gpu -max_num_threads=1024 -thread_warp_size=32", "batch_matmul.cuda", [["TENSOR", [1, 1, 512], "float32"], ["TENSOR", [1, 16384, 512], "float32"]], {}], "config": {"index": 7301, "code_hash": null, "entity": [["tile_y", "sp", [-1, 1, 1]], ["tile_x", "sp", [-1, 4, 512]], ["tile_k", "sp", [-1, 1]], ["auto_unroll_max_step", "ot", 32], ["unroll_explicit", "ot", 1]]}, "result": [[0.0461833585], 0, 1.6941211223602295, 1595429765.7072191], "version": 0.2, "tvm_version": "0.7.dev1"}
{"input": ["cuda -keys=cuda,gpu -max_num_threads=1024 -thread_warp_size=32", "batch_matmul.cuda", [["TENSOR", [1, 1, 512], "float32"], ["TENSOR", [1, 16384, 512], "float32"]], {}], "config": {"index": 9007, "code_hash": null, "entity": [["tile_y", "sp", [-1, 1, 1]], ["tile_x", "sp", [-1, 128, 1]], ["tile_k", "sp", [-1, 32]], ["auto_unroll_max_step", "ot", 64], ["unroll_explicit", "ot", 1]]}, "result": [[0.00014545242373923737], 0, 1.7530734539031982, 1595429767.188747], "version": 0.2, "tvm_version": "0.7.dev1"}
{"input": ["cuda -keys=cuda,gpu -max_num_threads=1024 -thread_warp_size=32", "batch_matmul.cuda", [["TENSOR", [1, 1, 512], "float32"], ["TENSOR", [1, 16384, 512], "float32"]], {}], "config": {"index": 159, "code_hash": null, "entity": [["tile_y", "sp", [-1, 1, 1]], ["tile_x", "sp", [-1, 1024, 4]], ["tile_k", "sp", [-1, 2]], ["auto_unroll_max_step", "ot", 8], ["unroll_explicit", "ot", 0]]}, "result": [[0.03618466233333333], 0, 1.8454880714416504, 1595429768.746239], "version": 0.2, "tvm_version": "0.7.dev1"}
{"input": ["cuda -keys=cuda,gpu -max_num_threads=1024 -thread_warp_size=32", "batch_matmul.cuda", [["TENSOR", [1, 1, 512], "float32"], ["TENSOR", [1, 16384, 512], "float32"]], {}], "config": {"index": 1516, "code_hash": null, "entity": [["tile_y", "sp", [-1, 1, 1]], ["tile_x", "sp", [-1, 2, 64]], ["tile_k", "sp", [-1, 4]], ["auto_unroll_max_step", "ot", 16], ["unroll_explicit", "ot", 0]]}, "result": [[0.0021445959428571426], 0, 1.5788683891296387, 1595429769.8965576], "version": 0.2, "tvm_version": "0.7.dev1"}
{"input": ["cuda -keys=cuda,gpu -max_num_threads=1024 -thread_warp_size=32", "batch_matmul.cuda", [["TENSOR", [1, 1, 512], "float32"], ["TENSOR", [1, 16384, 512], "float32"]], {}], "config": {"index": 3762, "code_hash": null, "entity": [["tile_y", "sp", [-1, 1, 1]], ["tile_x", "sp", [-1, 1, 8]], ["tile_k", "sp", [-1, 2]], ["auto_unroll_max_step", "ot", 64], ["unroll_explicit", "ot", 0]]}, "result": [[0.0006917361959654179], 0, 1.9486427307128906, 1595429771.771682], "version": 0.2, "tvm_version": "0.7.dev1"}
{"input": ["cuda -keys=cuda,gpu -max_num_threads=1024 -thread_warp_size=32", "batch_matmul.cuda", [["TENSOR", [1, 1, 512], "float32"], ["TENSOR", [1, 16384, 512], "float32"]], {}], "config": {"index": 3482, "code_hash": null, "entity": [["tile_y", "sp", [-1, 1, 1]], ["tile_x", "sp", [-1, 4, 1]], ["tile_k", "sp", [-1, 512]], ["auto_unroll_max_step", "ot", 32], ["unroll_explicit", "ot", 0]]}, "result": [[0.00025985189749182117], 0, 1.8574488162994385, 1595429773.2611806], "version": 0.2, "tvm_version": "0.7.dev1"}
{"input": ["cuda -keys=cuda,gpu -max_num_threads=1024 -thread_warp_size=32", "batch_matmul.cuda", [["TENSOR", [1, 1, 512], "float32"], ["TENSOR", [1, 16384, 512], "float32"]], {}], "config": {"index": 8191, "code_hash": null, "entity": [["tile_y", "sp", [-1, 1, 1]], ["tile_x", "sp", [-1, 4, 4]], ["tile_k", "sp", [-1, 256]], ["auto_unroll_max_step", "ot", 32], ["unroll_explicit", "ot", 1]]}, "result": [[0.0003051490421455939], 0, 1.916924238204956, 1595429774.971819], "version": 0.2, "tvm_version": "0.7.dev1"}
{"input": ["cuda -keys=cuda,gpu -max_num_threads=1024 -thread_warp_size=32", "batch_matmul.cuda", [["TENSOR", [1, 1, 512], "float32"], ["TENSOR", [1, 16384, 512], "float32"]], {}], "config": {"index": 465, "code_hash": null, "entity": [["tile_y", "sp", [-1, 1, 1]], ["tile_x", "sp", [-1, 1, 1024]], ["tile_k", "sp", [-1, 8]], ["auto_unroll_max_step", "ot", 8], ["unroll_explicit", "ot", 0]]}, "result": [[0.026824094000000003], 0, 1.775728702545166, 1595429776.2121978], "version": 0.2, "tvm_version": "0.7.dev1"}
{"input": ["cuda -keys=cuda,gpu -max_num_threads=1024 -thread_warp_size=32", "batch_matmul.cuda", [["TENSOR", [1, 1, 512], "float32"], ["TENSOR", [1, 16384, 512], "float32"]], {}], "config": {"index": 7310, "code_hash": null, "entity": [["tile_y", "sp", [-1, 1, 1]], ["tile_x", "sp", [-1, 1, 2048]], ["tile_k", "sp", [-1, 1]], ["auto_unroll_max_step", "ot", 32], ["unroll_explicit", "ot", 1]]}, "result": [[0.05382310425], 0, 2.071495532989502, 1595429777.846644], "version": 0.2, "tvm_version": "0.7.dev1"}
{"input": ["cuda -keys=cuda,gpu -max_num_threads=1024 -thread_warp_size=32", "batch_matmul.cuda", [["TENSOR", [1, 1, 512], "float32"], ["TENSOR", [1, 16384, 512], "float32"]], {}], "config": {"index": 3480, "code_hash": null, "entity": [["tile_y", "sp", [-1, 1, 1]], ["tile_x", "sp", [-1, 1, 1]], ["tile_k", "sp", [-1, 512]], ["auto_unroll_max_step", "ot", 32], ["unroll_explicit", "ot", 0]]}, "result": [[0.0008004784569536424], 0, 1.7482020854949951, 1595429779.3088162], "version": 0.2, "tvm_version": "0.7.dev1"}
{"input": ["cuda -keys=cuda,gpu -max_num_threads=1024 -thread_warp_size=32", "batch_matmul.cuda", [["TENSOR", [1, 1, 512], "float32"], ["TENSOR", [1, 16384, 512], "float32"]], {}], "config": {"index": 2782, "code_hash": null, "entity": [["tile_y", "sp", [-1, 1, 1]], ["tile_x", "sp", [-1, 128, 2]], ["tile_k", "sp", [-1, 8]], ["auto_unroll_max_step", "ot", 32], ["unroll_explicit", "ot", 0]]}, "result": [[0.0007386142423312883], 0, 1.8673782348632812, 1595429780.7949386], "version": 0.2, "tvm_version": "0.7.dev1"}
{"input": ["cuda -keys=cuda,gpu -max_num_threads=1024 -thread_warp_size=32", "batch_matmul.cuda", [["TENSOR", [1, 1, 512], "float32"], ["TENSOR", [1, 16384, 512], "float32"]], {}], "config": {"index": 1525, "code_hash": null, "entity": [["tile_y", "sp", [-1, 1, 1]], ["tile_x", "sp", [-1, 2, 128]], ["tile_k", "sp", [-1, 4]], ["auto_unroll_max_step", "ot", 16], ["unroll_explicit", "ot", 0]]}, "result": [[0.002208535411764706], 0, 1.6049599647521973, 1595429781.93603], "version": 0.2, "tvm_version": "0.7.dev1"}
{"input": ["cuda -keys=cuda,gpu -max_num_threads=1024 -thread_warp_size=32", "batch_matmul.cuda", [["TENSOR", [1, 1, 512], "float32"], ["TENSOR", [1, 16384, 512], "float32"]], {}], "config": {"index": 7455, "code_hash": null, "entity": [["tile_y", "sp", [-1, 1, 1]], ["tile_x", "sp", [-1, 1, 2]], ["tile_k", "sp", [-1, 4]], ["auto_unroll_max_step", "ot", 32], ["unroll_explicit", "ot", 1]]}, "result": [[0.0007038730991253644], 0, 1.8851869106292725, 1595429783.4878223], "version": 0.2, "tvm_version": "0.7.dev1"}
{"input": ["cuda -keys=cuda,gpu -max_num_threads=1024 -thread_warp_size=32", "batch_matmul.cuda", [["TENSOR", [1, 1, 512], "float32"], ["TENSOR", [1, 16384, 512], "float32"]], {}], "config": {"index": 346, "code_hash": null, "entity": [["tile_y", "sp", [-1, 1, 1]], ["tile_x", "sp", [-1, 2, 1024]], ["tile_k", "sp", [-1, 4]], ["auto_unroll_max_step", "ot", 8], ["unroll_explicit", "ot", 0]]}, "result": [[0.021434925363636365], 0, 1.960362434387207, 1595429785.1684394], "version": 0.2, "tvm_version": "0.7.dev1"}
{"input": ["cuda -keys=cuda,gpu -max_num_threads=1024 -thread_warp_size=32", "batch_matmul.cuda", [["TENSOR", [1, 1, 512], "float32"], ["TENSOR", [1, 16384, 512], "float32"]], {}], "config": {"index": 70, "code_hash": null, "entity": [["tile_y", "sp", [-1, 1, 1]], ["tile_x", "sp", [-1, 32, 32]], ["tile_k", "sp", [-1, 1]], ["auto_unroll_max_step", "ot", 8], ["unroll_explicit", "ot", 0]]}, "result": [[0.014540609636363637], 0, 1.5193803310394287, 1595429786.4071827], "version": 0.2, "tvm_version": "0.7.dev1"}
{"input": ["cuda -keys=cuda,gpu -max_num_threads=1024 -thread_warp_size=32", "batch_matmul.cuda", [["TENSOR", [1, 1, 512], "float32"], ["TENSOR", [1, 16384, 512], "float32"]], {}], "config": {"index": 3759, "code_hash": null, "entity": [["tile_y", "sp", [-1, 1, 1]], ["tile_x", "sp", [-1, 1024, 4]], ["tile_k", "sp", [-1, 2]], ["auto_unroll_max_step", "ot", 64], ["unroll_explicit", "ot", 0]]}, "result": [[0.03609223833333333], 0, 1.6882033348083496, 1595429788.1660042], "version": 0.2, "tvm_version": "0.7.dev1"}
{"input": ["cuda -keys=cuda,gpu -max_num_threads=1024 -thread_warp_size=32", "batch_matmul.cuda", [["TENSOR", [1, 1, 512], "float32"], ["TENSOR", [1, 16384, 512], "float32"]], {}], "config": {"index": 6377, "code_hash": null, "entity": [["tile_y", "sp", [-1, 1, 1]], ["tile_x", "sp", [-1, 4, 2]], ["tile_k", "sp", [-1, 8]], ["auto_unroll_max_step", "ot", 16], ["unroll_explicit", "ot", 1]]}, "result": [[0.00041626438146167557], 0, 1.9079246520996094, 1595429809.600416], "version": 0.2, "tvm_version": "0.7.dev1"}
{"input": ["cuda -keys=cuda,gpu -max_num_threads=1024 -thread_warp_size=32", "batch_matmul.cuda", [["TENSOR", [1, 1, 512], "float32"], ["TENSOR", [1, 16384, 512], "float32"]], {}], "config": {"index": 6271, "code_hash": null, "entity": [["tile_y", "sp", [-1, 1, 1]], ["tile_x", "sp", [-1, 4, 4]], ["tile_k", "sp", [-1, 4]], ["auto_unroll_max_step", "ot", 16], ["unroll_explicit", "ot", 1]]}, "result": [[0.000468787515625], 0, 1.7878820896148682, 1595429811.0173087], "version": 0.2, "tvm_version": "0.7.dev1"}
{"input": ["cuda -keys=cuda,gpu -max_num_threads=1024 -thread_warp_size=32", "batch_matmul.cuda", [["TENSOR", [1, 1, 512], "float32"], ["TENSOR", [1, 16384, 512], "float32"]], {}], "config": {"index": 6257, "code_hash": null, "entity": [["tile_y", "sp", [-1, 1, 1]], ["tile_x", "sp", [-1, 4, 2]], ["tile_k", "sp", [-1, 4]], ["auto_unroll_max_step", "ot", 16], ["unroll_explicit", "ot", 1]]}, "result": [[0.00042812867553191486], 0, 1.8824882507324219, 1595429812.4822545], "version": 0.2, "tvm_version": "0.7.dev1"}
{"input": ["cuda -keys=cuda,gpu -max_num_threads=1024 -thread_warp_size=32", "batch_matmul.cuda", [["TENSOR", [1, 1, 512], "float32"], ["TENSOR", [1, 16384, 512], "float32"]], {}], "config": {"index": 6243, "code_hash": null, "entity": [["tile_y", "sp", [-1, 1, 1]], ["tile_x", "sp", [-1, 8, 1]], ["tile_k", "sp", [-1, 4]], ["auto_unroll_max_step", "ot", 16], ["unroll_explicit", "ot", 1]]}, "result": [[0.00042825120142602494], 0, 1.821167230606079, 1595429813.947975], "version": 0.2, "tvm_version": "0.7.dev1"}
{"input": ["cuda -keys=cuda,gpu -max_num_threads=1024 -thread_warp_size=32", "batch_matmul.cuda", [["TENSOR", [1, 1, 512], "float32"], ["TENSOR", [1, 16384, 512], "float32"]], {}], "config": {"index": 1471, "code_hash": null, "entity": [["tile_y", "sp", [-1, 1, 1]], ["tile_x", "sp", [-1, 4, 4]], ["tile_k", "sp", [-1, 4]], ["auto_unroll_max_step", "ot", 16], ["unroll_explicit", "ot", 0]]}, "result": [[0.0004684628082191781], 0, 1.8943126201629639, 1595429815.3931463], "version": 0.2, "tvm_version": "0.7.dev1"}
{"input": ["cuda -keys=cuda,gpu -max_num_threads=1024 -thread_warp_size=32", "batch_matmul.cuda", [["TENSOR", [1, 1, 512], "float32"], ["TENSOR", [1, 16384, 512], "float32"]], {}], "config": {"index": 1577, "code_hash": null, "entity": [["tile_y", "sp", [-1, 1, 1]], ["tile_x", "sp", [-1, 4, 2]], ["tile_k", "sp", [-1, 8]], ["auto_unroll_max_step", "ot", 16], ["unroll_explicit", "ot", 0]]}, "result": [[0.00041528064827586205], 0, 1.8429207801818848, 1595429816.8620806], "version": 0.2, "tvm_version": "0.7.dev1"}
{"input": ["cuda -keys=cuda,gpu -max_num_threads=1024 -thread_warp_size=32", "batch_matmul.cuda", [["TENSOR", [1, 1, 512], "float32"], ["TENSOR", [1, 16384, 512], "float32"]], {}], "config": {"index": 6272, "code_hash": null, "entity": [["tile_y", "sp", [-1, 1, 1]], ["tile_x", "sp", [-1, 8, 4]], ["tile_k", "sp", [-1, 4]], ["auto_unroll_max_step", "ot", 16], ["unroll_explicit", "ot", 1]]}, "result": [[0.00039661056363636364], 0, 2.155339002609253, 1595429818.547851], "version": 0.2, "tvm_version": "0.7.dev1"}
{"input": ["cuda -keys=cuda,gpu -max_num_threads=1024 -thread_warp_size=32", "batch_matmul.cuda", [["TENSOR", [1, 1, 512], "float32"], ["TENSOR", [1, 16384, 512], "float32"]], {}], "config": {"index": 7471, "code_hash": null, "entity": [["tile_y", "sp", [-1, 1, 1]], ["tile_x", "sp", [-1, 4, 4]], ["tile_k", "sp", [-1, 4]], ["auto_unroll_max_step", "ot", 32], ["unroll_explicit", "ot", 1]]}, "result": [[0.0004694465697674419], 0, 1.9180657863616943, 1595429820.0238373], "version": 0.2, "tvm_version": "0.7.dev1"}
{"input": ["cuda -keys=cuda,gpu -max_num_threads=1024 -thread_warp_size=32", "batch_matmul.cuda", [["TENSOR", [1, 1, 512], "float32"], ["TENSOR", [1, 16384, 512], "float32"]], {}], "config": {"index": 7577, "code_hash": null, "entity": [["tile_y", "sp", [-1, 1, 1]], ["tile_x", "sp", [-1, 4, 2]], ["tile_k", "sp", [-1, 8]], ["auto_unroll_max_step", "ot", 32], ["unroll_explicit", "ot", 1]]}, "result": [[0.0004155589705372617], 0, 1.7567377090454102, 1595429821.4787023], "version": 0.2, "tvm_version": "0.7.dev1"}
{"input": ["cuda -keys=cuda,gpu -max_num_threads=1024 -thread_warp_size=32", "batch_matmul.cuda", [["TENSOR", [1, 1, 512], "float32"], ["TENSOR", [1, 16384, 512], "float32"]], {}], "config": {"index": 5071, "code_hash": null, "entity": [["tile_y", "sp", [-1, 1, 1]], ["tile_x", "sp", [-1, 4, 4]], ["tile_k", "sp", [-1, 4]], ["auto_unroll_max_step", "ot", 8], ["unroll_explicit", "ot", 1]]}, "result": [[0.0004693312857142857], 0, 1.8234171867370605, 1595429822.9991019], "version": 0.2, "tvm_version": "0.7.dev1"}
{"input": ["cuda -keys=cuda,gpu -max_num_threads=1024 -thread_warp_size=32", "batch_matmul.cuda", [["TENSOR", [1, 1, 512], "float32"], ["TENSOR", [1, 16384, 512], "float32"]], {}], "config": {"index": 5177, "code_hash": null, "entity": [["tile_y", "sp", [-1, 1, 1]], ["tile_x", "sp", [-1, 4, 2]], ["tile_k", "sp", [-1, 8]], ["auto_unroll_max_step", "ot", 8], ["unroll_explicit", "ot", 1]]}, "result": [[0.0004153731013986014], 0, 1.720736026763916, 1595429824.4090803], "version": 0.2, "tvm_version": "0.7.dev1"}
{"input": ["cuda -keys=cuda,gpu -max_num_threads=1024 -thread_warp_size=32", "batch_matmul.cuda", [["TENSOR", [1, 1, 512], "float32"], ["TENSOR", [1, 16384, 512], "float32"]], {}], "config": {"index": 6363, "code_hash": null, "entity": [["tile_y", "sp", [-1, 1, 1]], ["tile_x", "sp", [-1, 8, 1]], ["tile_k", "sp", [-1, 8]], ["auto_unroll_max_step", "ot", 16], ["unroll_explicit", "ot", 1]]}, "result": [[0.0003400002669683258], 0, 1.4279212951660156, 1595429825.4452276], "version": 0.2, "tvm_version": "0.7.dev1"}
{"input": ["cuda -keys=cuda,gpu -max_num_threads=1024 -thread_warp_size=32", "batch_matmul.cuda", [["TENSOR", [1, 1, 512], "float32"], ["TENSOR", [1, 16384, 512], "float32"]], {}], "config": {"index": 6378, "code_hash": null, "entity": [["tile_y", "sp", [-1, 1, 1]], ["tile_x", "sp", [-1, 8, 2]], ["tile_k", "sp", [-1, 8]], ["auto_unroll_max_step", "ot", 16], ["unroll_explicit", "ot", 1]]}, "result": [[0.0004354297238267148], 0, 1.9189326763153076, 1595429826.9171405], "version": 0.2, "tvm_version": "0.7.dev1"}
{"input": ["cuda -keys=cuda,gpu -max_num_threads=1024 -thread_warp_size=32", "batch_matmul.cuda", [["TENSOR", [1, 1, 512], "float32"], ["TENSOR", [1, 16384, 512], "float32"]], {}], "config": {"index": 6123, "code_hash": null, "entity": [["tile_y", "sp", [-1, 1, 1]], ["tile_x", "sp", [-1, 8, 1]], ["tile_k", "sp", [-1, 2]], ["auto_unroll_max_step", "ot", 16], ["unroll_explicit", "ot", 1]]}, "result": [[0.0005089203291139241], 0, 1.7732579708099365, 1595429828.337565], "version": 0.2, "tvm_version": "0.7.dev1"}
{"input": ["cuda -keys=cuda,gpu -max_num_threads=1024 -thread_warp_size=32", "batch_matmul.cuda", [["TENSOR", [1, 1, 512], "float32"], ["TENSOR", [1, 16384, 512], "float32"]], {}], "config": {"index": 6270, "code_hash": null, "entity": [["tile_y", "sp", [-1, 1, 1]], ["tile_x", "sp", [-1, 2, 4]], ["tile_k", "sp", [-1, 4]], ["auto_unroll_max_step", "ot", 16], ["unroll_explicit", "ot", 1]]}, "result": [[0.0004923719083503055], 0, 1.86562180519104, 1595429829.779111], "version": 0.2, "tvm_version": "0.7.dev1"}
{"input": ["cuda -keys=cuda,gpu -max_num_threads=1024 -thread_warp_size=32", "batch_matmul.cuda", [["TENSOR", [1, 1, 512], "float32"], ["TENSOR", [1, 16384, 512], "float32"]], {}], "config": {"index": 6242, "code_hash": null, "entity": [["tile_y", "sp", [-1, 1, 1]], ["tile_x", "sp", [-1, 4, 1]], ["tile_k", "sp", [-1, 4]], ["auto_unroll_max_step", "ot", 16], ["unroll_explicit", "ot", 1]]}, "result": [[0.0003088679270166453], 0, 1.8140501976013184, 1595429831.2201767], "version": 0.2, "tvm_version": "0.7.dev1"}
{"input": ["cuda -keys=cuda,gpu -max_num_threads=1024 -thread_warp_size=32", "batch_matmul.cuda", [["TENSOR", [1, 1, 512], "float32"], ["TENSOR", [1, 16384, 512], "float32"]], {}], "config": {"index": 6362, "code_hash": null, "entity": [["tile_y", "sp", [-1, 1, 1]], ["tile_x", "sp", [-1, 4, 1]], ["tile_k", "sp", [-1, 8]], ["auto_unroll_max_step", "ot", 16], ["unroll_explicit", "ot", 1]]}, "result": [[0.0003763820535433071], 0, 1.9678359031677246, 1595429832.7805548], "version": 0.2, "tvm_version": "0.7.dev1"}
{"input": ["cuda -keys=cuda,gpu -max_num_threads=1024 -thread_warp_size=32", "batch_matmul.cuda", [["TENSOR", [1, 1, 512], "float32"], ["TENSOR", [1, 16384, 512], "float32"]], {}], "config": {"index": 1457, "code_hash": null, "entity": [["tile_y", "sp", [-1, 1, 1]], ["tile_x", "sp", [-1, 4, 2]], ["tile_k", "sp", [-1, 4]], ["auto_unroll_max_step", "ot", 16], ["unroll_explicit", "ot", 0]]}, "result": [[0.00042265701048951047], 0, 1.808506727218628, 1595429834.2372515], "version": 0.2, "tvm_version": "0.7.dev1"}
{"input": ["cuda -keys=cuda,gpu -max_num_threads=1024 -thread_warp_size=32", "batch_matmul.cuda", [["TENSOR", [1, 1, 512], "float32"], ["TENSOR", [1, 16384, 512], "float32"]], {}], "config": {"index": 6258, "code_hash": null, "entity": [["tile_y", "sp", [-1, 1, 1]], ["tile_x", "sp", [-1, 8, 2]], ["tile_k", "sp", [-1, 4]], ["auto_unroll_max_step", "ot", 16], ["unroll_explicit", "ot", 1]]}, "result": [[0.00046955087548638136], 0, 1.889249324798584, 1595429835.785793], "version": 0.2, "tvm_version": "0.7.dev1"}
{"input": ["cuda -keys=cuda,gpu -max_num_threads=1024 -thread_warp_size=32", "batch_matmul.cuda", [["TENSOR", [1, 1, 512], "float32"], ["TENSOR", [1, 16384, 512], "float32"]], {}], "config": {"index": 6163, "code_hash": null, "entity": [["tile_y", "sp", [-1, 1, 1]], ["tile_x", "sp", [-1, 2, 8]], ["tile_k", "sp", [-1, 2]], ["auto_unroll_max_step", "ot", 16], ["unroll_explicit", "ot", 1]]}, "result": [[0.0006475777510729614], 0, 1.5102310180664062, 1595429836.89753], "version": 0.2, "tvm_version": "0.7.dev1"}
{"input": ["cuda -keys=cuda,gpu -max_num_threads=1024 -thread_warp_size=32", "batch_matmul.cuda", [["TENSOR", [1, 1, 512], "float32"], ["TENSOR", [1, 16384, 512], "float32"]], {}], "config": {"index": 7457, "code_hash": null, "entity": [["tile_y", "sp", [-1, 1, 1]], ["tile_x", "sp", [-1, 4, 2]], ["tile_k", "sp", [-1, 4]], ["auto_unroll_max_step", "ot", 32], ["unroll_explicit", "ot", 1]]}, "result": [[0.00042814606028368794], 0, 1.8242394924163818, 1595429838.3505893], "version": 0.2, "tvm_version": "0.7.dev1"}
{"input": ["cuda -keys=cuda,gpu -max_num_threads=1024 -thread_warp_size=32", "batch_matmul.cuda", [["TENSOR", [1, 1, 512], "float32"], ["TENSOR", [1, 16384, 512], "float32"]], {}], "config": {"index": 5057, "code_hash": null, "entity": [["tile_y", "sp", [-1, 1, 1]], ["tile_x", "sp", [-1, 4, 2]], ["tile_k", "sp", [-1, 4]], ["auto_unroll_max_step", "ot", 8], ["unroll_explicit", "ot", 1]]}, "result": [[0.00042845591119005326], 0, 1.8114242553710938, 1595429839.7995272], "version": 0.2, "tvm_version": "0.7.dev1"}
{"input": ["cuda -keys=cuda,gpu -max_num_threads=1024 -thread_warp_size=32", "batch_matmul.cuda", [["TENSOR", [1, 1, 512], "float32"], ["TENSOR", [1, 16384, 512], "float32"]], {}], "config": {"index": 1443, "code_hash": null, "entity": [["tile_y", "sp", [-1, 1, 1]], ["tile_x", "sp", [-1, 8, 1]], ["tile_k", "sp", [-1, 4]], ["auto_unroll_max_step", "ot", 16], ["unroll_explicit", "ot", 0]]}, "result": [[0.00042628629964539005], 0, 1.737058401107788, 1595429841.2384405], "version": 0.2, "tvm_version": "0.7.dev1"}
{"input": ["cuda -keys=cuda,gpu -max_num_threads=1024 -thread_warp_size=32", "batch_matmul.cuda", [["TENSOR", [1, 1, 512], "float32"], ["TENSOR", [1, 16384, 512], "float32"]], {}], "config": {"index": 6164, "code_hash": null, "entity": [["tile_y", "sp", [-1, 1, 1]], ["tile_x", "sp", [-1, 4, 8]], ["tile_k", "sp", [-1, 2]], ["auto_unroll_max_step", "ot", 16], ["unroll_explicit", "ot", 1]]}, "result": [[0.0005610088402777778], 0, 2.056178569793701, 1595429842.854355], "version": 0.2, "tvm_version": "0.7.dev1"}
{"input": ["cuda -keys=cuda,gpu -max_num_threads=1024 -thread_warp_size=32", "batch_matmul.cuda", [["TENSOR", [1, 1, 512], "float32"], ["TENSOR", [1, 16384, 512], "float32"]], {}], "config": {"index": 7443, "code_hash": null, "entity": [["tile_y", "sp", [-1, 1, 1]], ["tile_x", "sp", [-1, 8, 1]], ["tile_k", "sp", [-1, 4]], ["auto_unroll_max_step", "ot", 32], ["unroll_explicit", "ot", 1]]}, "result": [[0.00042851814311270123], 0, 1.8195993900299072, 1595429844.3061926], "version": 0.2, "tvm_version": "0.7.dev1"}
{"input": ["cuda -keys=cuda,gpu -max_num_threads=1024 -thread_warp_size=32", "batch_matmul.cuda", [["TENSOR", [1, 1, 512], "float32"], ["TENSOR", [1, 16384, 512], "float32"]], {}], "config": {"index": 8777, "code_hash": null, "entity": [["tile_y", "sp", [-1, 1, 1]], ["tile_x", "sp", [-1, 4, 2]], ["tile_k", "sp", [-1, 8]], ["auto_unroll_max_step", "ot", 64], ["unroll_explicit", "ot", 1]]}, "result": [[0.00041569670811744387], 0, 1.814239263534546, 1595429845.7640567], "version": 0.2, "tvm_version": "0.7.dev1"}
{"input": ["cuda -keys=cuda,gpu -max_num_threads=1024 -thread_warp_size=32", "batch_matmul.cuda", [["TENSOR", [1, 1, 512], "float32"], ["TENSOR", [1, 16384, 512], "float32"]], {}], "config": {"index": 8671, "code_hash": null, "entity": [["tile_y", "sp", [-1, 1, 1]], ["tile_x", "sp", [-1, 4, 4]], ["tile_k", "sp", [-1, 4]], ["auto_unroll_max_step", "ot", 64], ["unroll_explicit", "ot", 1]]}, "result": [[0.0004697133125], 0, 1.4406893253326416, 1595429846.8009188], "version": 0.2, "tvm_version": "0.7.dev1"}
{"input": ["cuda -keys=cuda,gpu -max_num_threads=1024 -thread_warp_size=32", "batch_matmul.cuda", [["TENSOR", [1, 1, 512], "float32"], ["TENSOR", [1, 16384, 512], "float32"]], {}], "config": {"index": 1472, "code_hash": null, "entity": [["tile_y", "sp", [-1, 1, 1]], ["tile_x", "sp", [-1, 8, 4]], ["tile_k", "sp", [-1, 4]], ["auto_unroll_max_step", "ot", 16], ["unroll_explicit", "ot", 0]]}, "result": [[0.00039733761666666667], 0, 1.9097168445587158, 1595429848.351907], "version": 0.2, "tvm_version": "0.7.dev1"}
{"input": ["cuda -keys=cuda,gpu -max_num_threads=1024 -thread_warp_size=32", "batch_matmul.cuda", [["TENSOR", [1, 1, 512], "float32"], ["TENSOR", [1, 16384, 512], "float32"]], {}], "config": {"index": 5043, "code_hash": null, "entity": [["tile_y", "sp", [-1, 1, 1]], ["tile_x", "sp", [-1, 8, 1]], ["tile_k", "sp", [-1, 4]], ["auto_unroll_max_step", "ot", 8], ["unroll_explicit", "ot", 1]]}, "result": [[0.0004285051918294849], 0, 1.7723052501678467, 1595429849.792589], "version": 0.2, "tvm_version": "0.7.dev1"}
{"input": ["cuda -keys=cuda,gpu -max_num_threads=1024 -thread_warp_size=32", "batch_matmul.cuda", [["TENSOR", [1, 1, 512], "float32"], ["TENSOR", [1, 16384, 512], "float32"]], {}], "config": {"index": 2671, "code_hash": null, "entity": [["tile_y", "sp", [-1, 1, 1]], ["tile_x", "sp", [-1, 4, 4]], ["tile_k", "sp", [-1, 4]], ["auto_unroll_max_step", "ot", 32], ["unroll_explicit", "ot", 0]]}, "result": [[0.000469134579766537], 0, 1.8464796543121338, 1595429851.2214236], "version": 0.2, "tvm_version": "0.7.dev1"}
{"input": ["cuda -keys=cuda,gpu -max_num_threads=1024 -thread_warp_size=32", "batch_matmul.cuda", [["TENSOR", [1, 1, 512], "float32"], ["TENSOR", [1, 16384, 512], "float32"]], {}], "config": {"index": 2777, "code_hash": null, "entity": [["tile_y", "sp", [-1, 1, 1]], ["tile_x", "sp", [-1, 4, 2]], ["tile_k", "sp", [-1, 8]], ["auto_unroll_max_step", "ot", 32], ["unroll_explicit", "ot", 0]]}, "result": [[0.00041566185319516405], 0, 1.9251744747161865, 1595429852.7341845], "version": 0.2, "tvm_version": "0.7.dev1"}
{"input": ["cuda -keys=cuda,gpu -max_num_threads=1024 -thread_warp_size=32", "batch_matmul.cuda", [["TENSOR", [1, 1, 512], "float32"], ["TENSOR", [1, 16384, 512], "float32"]], {}], "config": {"index": 7472, "code_hash": null, "entity": [["tile_y", "sp", [-1, 1, 1]], ["tile_x", "sp", [-1, 8, 4]], ["tile_k", "sp", [-1, 4]], ["auto_unroll_max_step", "ot", 32], ["unroll_explicit", "ot", 1]]}, "result": [[0.0003991098308457712], 0, 1.9587864875793457, 1595429854.2511551], "version": 0.2, "tvm_version": "0.7.dev1"}
{"input": ["cuda -keys=cuda,gpu -max_num_threads=1024 -thread_warp_size=32", "batch_matmul.cuda", [["TENSOR", [1, 1, 512], "float32"], ["TENSOR", [1, 16384, 512], "float32"]], {}], "config": {"index": 377, "code_hash": null, "entity": [["tile_y", "sp", [-1, 1, 1]], ["tile_x", "sp", [-1, 4, 2]], ["tile_k", "sp", [-1, 8]], ["auto_unroll_max_step", "ot", 8], ["unroll_explicit", "ot", 0]]}, "result": [[0.00041571459272097053], 0, 1.915712594985962, 1595429855.7838213], "version": 0.2, "tvm_version": "0.7.dev1"}
{"input": ["cuda -keys=cuda,gpu -max_num_threads=1024 -thread_warp_size=32", "batch_matmul.cuda", [["TENSOR", [1, 1, 512], "float32"], ["TENSOR", [1, 16384, 512], "float32"]], {}], "config": {"index": 271, "code_hash": null, "entity": [["tile_y", "sp", [-1, 1, 1]], ["tile_x", "sp", [-1, 4, 4]], ["tile_k", "sp", [-1, 4]], ["auto_unroll_max_step", "ot", 8], ["unroll_explicit", "ot", 0]]}, "result": [[0.0004691843934108527], 0, 1.859273910522461, 1595429857.2235985], "version": 0.2, "tvm_version": "0.7.dev1"}
{"input": ["cuda -keys=cuda,gpu -max_num_threads=1024 -thread_warp_size=32", "batch_matmul.cuda", [["TENSOR", [1, 1, 512], "float32"], ["TENSOR", [1, 16384, 512], "float32"]], {}], "config": {"index": 5072, "code_hash": null, "entity": [["tile_y", "sp", [-1, 1, 1]], ["tile_x", "sp", [-1, 8, 4]], ["tile_k", "sp", [-1, 4]], ["auto_unroll_max_step", "ot", 8], ["unroll_explicit", "ot", 1]]}, "result": [[0.0003966794231404959], 0, 1.9957201480865479, 1595429858.7839844], "version": 0.2, "tvm_version": "0.7.dev1"}
{"input": ["cuda -keys=cuda,gpu -max_num_threads=1024 -thread_warp_size=32", "batch_matmul.cuda", [["TENSOR", [1, 1, 512], "float32"], ["TENSOR", [1, 16384, 512], "float32"]], {}], "config": {"index": 1563, "code_hash": null, "entity": [["tile_y", "sp", [-1, 1, 1]], ["tile_x", "sp", [-1, 8, 1]], ["tile_k", "sp", [-1, 8]], ["auto_unroll_max_step", "ot", 16], ["unroll_explicit", "ot", 0]]}, "result": [[0.00036714735877862596], 0, 1.827610731124878, 1595429860.223154], "version": 0.2, "tvm_version": "0.7.dev1"}
{"input": ["cuda -keys=cuda,gpu -max_num_threads=1024 -thread_warp_size=32", "batch_matmul.cuda", [["TENSOR", [1, 1, 512], "float32"], ["TENSOR", [1, 16384, 512], "float32"]], {}], "config": {"index": 6150, "code_hash": null, "entity": [["tile_y", "sp", [-1, 1, 1]], ["tile_x", "sp", [-1, 2, 4]], ["tile_k", "sp", [-1, 2]], ["auto_unroll_max_step", "ot", 16], ["unroll_explicit", "ot", 1]]}, "result": [[0.0005041870248962655], 0, 2.0448901653289795, 1595429861.8133538], "version": 0.2, "tvm_version": "0.7.dev1"}
{"input": ["cuda -keys=cuda,gpu -max_num_threads=1024 -thread_warp_size=32", "batch_matmul.cuda", [["TENSOR", [1, 1, 512], "float32"], ["TENSOR", [1, 16384, 512], "float32"]], {}], "config": {"index": 7563, "code_hash": null, "entity": [["tile_y", "sp", [-1, 1, 1]], ["tile_x", "sp", [-1, 8, 1]], ["tile_k", "sp", [-1, 8]], ["auto_unroll_max_step", "ot", 32], ["unroll_explicit", "ot", 1]]}, "result": [[0.0003397863475177305], 0, 1.8473494052886963, 1595429863.2496426], "version": 0.2, "tvm_version": "0.7.dev1"}
{"input": ["cuda -keys=cuda,gpu -max_num_threads=1024 -thread_warp_size=32", "batch_matmul.cuda", [["TENSOR", [1, 1, 512], "float32"], ["TENSOR", [1, 16384, 512], "float32"]], {}], "config": {"index": 1578, "code_hash": null, "entity": [["tile_y", "sp", [-1, 1, 1]], ["tile_x", "sp", [-1, 8, 2]], ["tile_k", "sp", [-1, 8]], ["auto_unroll_max_step", "ot", 16], ["unroll_explicit", "ot", 0]]}, "result": [[0.0004356387864963504], 0, 1.9264860153198242, 1595429864.8154829], "version": 0.2, "tvm_version": "0.7.dev1"}
{"input": ["cuda -keys=cuda,gpu -max_num_threads=1024 -thread_warp_size=32", "batch_matmul.cuda", [["TENSOR", [1, 1, 512], "float32"], ["TENSOR", [1, 16384, 512], "float32"]], {}], "config": {"index": 5163, "code_hash": null, "entity": [["tile_y", "sp", [-1, 1, 1]], ["tile_x", "sp", [-1, 8, 1]], ["tile_k", "sp", [-1, 8]], ["auto_unroll_max_step", "ot", 8], ["unroll_explicit", "ot", 1]]}, "result": [[0.00033985218014184396], 0, 1.8740484714508057, 1595429866.2577372], "version": 0.2, "tvm_version": "0.7.dev1"}
{"input": ["cuda -keys=cuda,gpu -max_num_threads=1024 -thread_warp_size=32", "batch_matmul.cuda", [["TENSOR", [1, 1, 512], "float32"], ["TENSOR", [1, 16384, 512], "float32"]], {}], "config": {"index": 6165, "code_hash": null, "entity": [["tile_y", "sp", [-1, 1, 1]], ["tile_x", "sp", [-1, 8, 8]], ["tile_k", "sp", [-1, 2]], ["auto_unroll_max_step", "ot", 16], ["unroll_explicit", "ot", 1]]}, "result": [[0.0006836707796610169], 0, 1.896040439605713, 1595429867.8033438], "version": 0.2, "tvm_version": "0.7.dev1"}
{"input": ["cuda -keys=cuda,gpu -max_num_threads=1024 -thread_warp_size=32", "batch_matmul.cuda", [["TENSOR", [1, 1, 512], "float32"], ["TENSOR", [1, 16384, 512], "float32"]], {}], "config": {"index": 6138, "code_hash": null, "entity": [["tile_y", "sp", [-1, 1, 1]], ["tile_x", "sp", [-1, 8, 2]], ["tile_k", "sp", [-1, 2]], ["auto_unroll_max_step", "ot", 16], ["unroll_explicit", "ot", 1]]}, "result": [[0.0006072274023904382], 0, 1.4480130672454834, 1595429868.8888347], "version": 0.2, "tvm_version": "0.7.dev1"}
{"input": ["cuda -keys=cuda,gpu -max_num_threads=1024 -thread_warp_size=32", "batch_matmul.cuda", [["TENSOR", [1, 1, 512], "float32"], ["TENSOR", [1, 16384, 512], "float32"]], {}], "config": {"index": 6152, "code_hash": null, "entity": [["tile_y", "sp", [-1, 1, 1]], ["tile_x", "sp", [-1, 8, 4]], ["tile_k", "sp", [-1, 2]], ["auto_unroll_max_step", "ot", 16], ["unroll_explicit", "ot", 1]]}, "result": [[0.0005332840243902439], 0, 1.8576405048370361, 1595429870.3774397], "version": 0.2, "tvm_version": "0.7.dev1"}
{"input": ["cuda -keys=cuda,gpu -max_num_threads=1024 -thread_warp_size=32", "batch_matmul.cuda", [["TENSOR", [1, 1, 512], "float32"], ["TENSOR", [1, 16384, 512], "float32"]], {}], "config": {"index": 6151, "code_hash": null, "entity": [["tile_y", "sp", [-1, 1, 1]], ["tile_x", "sp", [-1, 4, 4]], ["tile_k", "sp", [-1, 2]], ["auto_unroll_max_step", "ot", 16], ["unroll_explicit", "ot", 1]]}, "result": [[0.0006066890483870967], 0, 1.5216577053070068, 1595429871.441819], "version": 0.2, "tvm_version": "0.7.dev1"}
{"input": ["cuda -keys=cuda,gpu -max_num_threads=1024 -thread_warp_size=32", "batch_matmul.cuda", [["TENSOR", [1, 1, 512], "float32"], ["TENSOR", [1, 16384, 512], "float32"]], {}], "config": {"index": 6137, "code_hash": null, "entity": [["tile_y", "sp", [-1, 1, 1]], ["tile_x", "sp", [-1, 4, 2]], ["tile_k", "sp", [-1, 2]], ["auto_unroll_max_step", "ot", 16], ["unroll_explicit", "ot", 1]]}, "result": [[0.0005161425310492506], 0, 1.7702772617340088, 1595429872.8436484], "version": 0.2, "tvm_version": "0.7.dev1"}
{"input": ["cuda -keys=cuda,gpu -max_num_threads=1024 -thread_warp_size=32", "batch_matmul.cuda", [["TENSOR", [1, 1, 512], "float32"], ["TENSOR", [1, 16384, 512], "float32"]], {}], "config": {"index": 7578, "code_hash": null, "entity": [["tile_y", "sp", [-1, 1, 1]], ["tile_x", "sp", [-1, 8, 2]], ["tile_k", "sp", [-1, 8]], ["auto_unroll_max_step", "ot", 32], ["unroll_explicit", "ot", 1]]}, "result": [[0.00043602390596745027], 0, 1.8396461009979248, 1595429874.297206], "version": 0.2, "tvm_version": "0.7.dev1"}
{"input": ["cuda -keys=cuda,gpu -max_num_threads=1024 -thread_warp_size=32", "batch_matmul.cuda", [["TENSOR", [1, 1, 512], "float32"], ["TENSOR", [1, 16384, 512], "float32"]], {}], "config": {"index": 6391, "code_hash": null, "entity": [["tile_y", "sp", [-1, 1, 1]], ["tile_x", "sp", [-1, 4, 4]], ["tile_k", "sp", [-1, 8]], ["auto_unroll_max_step", "ot", 16], ["unroll_explicit", "ot", 1]]}, "result": [[0.0004858148640973631], 0, 1.8821325302124023, 1595429875.7963736], "version": 0.2, "tvm_version": "0.7.dev1"}
{"input": ["cuda -keys=cuda,gpu -max_num_threads=1024 -thread_warp_size=32", "batch_matmul.cuda", [["TENSOR", [1, 1, 512], "float32"], ["TENSOR", [1, 16384, 512], "float32"]], {}], "config": {"index": 5178, "code_hash": null, "entity": [["tile_y", "sp", [-1, 1, 1]], ["tile_x", "sp", [-1, 8, 2]], ["tile_k", "sp", [-1, 8]], ["auto_unroll_max_step", "ot", 8], ["unroll_explicit", "ot", 1]]}, "result": [[0.00043595878237410074], 0, 1.8075206279754639, 1595429877.2759342], "version": 0.2, "tvm_version": "0.7.dev1"}
{"input": ["cuda -keys=cuda,gpu -max_num_threads=1024 -thread_warp_size=32", "batch_matmul.cuda", [["TENSOR", [1, 1, 512], "float32"], ["TENSOR", [1, 16384, 512], "float32"]], {}], "config": {"index": 1323, "code_hash": null, "entity": [["tile_y", "sp", [-1, 1, 1]], ["tile_x", "sp", [-1, 8, 1]], ["tile_k", "sp", [-1, 2]], ["auto_unroll_max_step", "ot", 16], ["unroll_explicit", "ot", 0]]}, "result": [[0.0005047259832635983], 0, 1.944441795349121, 1595429878.8674197], "version": 0.2, "tvm_version": "0.7.dev1"}
{"input": ["cuda -keys=cuda,gpu -max_num_threads=1024 -thread_warp_size=32", "batch_matmul.cuda", [["TENSOR", [1, 1, 512], "float32"], ["TENSOR", [1, 16384, 512], "float32"]], {}], "config": {"index": 1470, "code_hash": null, "entity": [["tile_y", "sp", [-1, 1, 1]], ["tile_x", "sp", [-1, 2, 4]], ["tile_k", "sp", [-1, 4]], ["auto_unroll_max_step", "ot", 16], ["unroll_explicit", "ot", 0]]}, "result": [[0.0004935255901639344], 0, 1.7826578617095947, 1595429880.2888367], "version": 0.2, "tvm_version": "0.7.dev1"}
{"input": ["cuda -keys=cuda,gpu -max_num_threads=1024 -thread_warp_size=32", "batch_matmul.cuda", [["TENSOR", [1, 1, 512], "float32"], ["TENSOR", [1, 16384, 512], "float32"]], {}], "config": {"index": 6284, "code_hash": null, "entity": [["tile_y", "sp", [-1, 1, 1]], ["tile_x", "sp", [-1, 4, 8]], ["tile_k", "sp", [-1, 4]], ["auto_unroll_max_step", "ot", 16], ["unroll_explicit", "ot", 1]]}, "result": [[0.000390461207177814], 0, 1.928516149520874, 1595429881.8795767], "version": 0.2, "tvm_version": "0.7.dev1"}
{"input": ["cuda -keys=cuda,gpu -max_num_threads=1024 -thread_warp_size=32", "batch_matmul.cuda", [["TENSOR", [1, 1, 512], "float32"], ["TENSOR", [1, 16384, 512], "float32"]], {}], "config": {"index": 6404, "code_hash": null, "entity": [["tile_y", "sp", [-1, 1, 1]], ["tile_x", "sp", [-1, 4, 8]], ["tile_k", "sp", [-1, 8]], ["auto_unroll_max_step", "ot", 16], ["unroll_explicit", "ot", 1]]}, "result": [[0.0004542109811320755], 0, 1.9134807586669922, 1595429883.364744], "version": 0.2, "tvm_version": "0.7.dev1"}
{"input": ["cuda -keys=cuda,gpu -max_num_threads=1024 -thread_warp_size=32", "batch_matmul.cuda", [["TENSOR", [1, 1, 512], "float32"], ["TENSOR", [1, 16384, 512], "float32"]], {}], "config": {"index": 1562, "code_hash": null, "entity": [["tile_y", "sp", [-1, 1, 1]], ["tile_x", "sp", [-1, 4, 1]], ["tile_k", "sp", [-1, 8]], ["auto_unroll_max_step", "ot", 16], ["unroll_explicit", "ot", 0]]}, "result": [[0.0003769645808477237], 0, 1.8031044006347656, 1595429884.793878], "version": 0.2, "tvm_version": "0.7.dev1"}
{"input": ["cuda -keys=cuda,gpu -max_num_threads=1024 -thread_warp_size=32", "batch_matmul.cuda", [["TENSOR", [1, 1, 512], "float32"], ["TENSOR", [1, 16384, 512], "float32"]], {}], "config": {"index": 1442, "code_hash": null, "entity": [["tile_y", "sp", [-1, 1, 1]], ["tile_x", "sp", [-1, 4, 1]], ["tile_k", "sp", [-1, 4]], ["auto_unroll_max_step", "ot", 16], ["unroll_explicit", "ot", 0]]}, "result": [[0.0003819413624801272], 0, 1.8202106952667236, 1595429886.2449818], "version": 0.2, "tvm_version": "0.7.dev1"}
{"input": ["cuda -keys=cuda,gpu -max_num_threads=1024 -thread_warp_size=32", "batch_matmul.cuda", [["TENSOR", [1, 1, 512], "float32"], ["TENSOR", [1, 16384, 512], "float32"]], {}], "config": {"index": 8657, "code_hash": null, "entity": [["tile_y", "sp", [-1, 1, 1]], ["tile_x", "sp", [-1, 4, 2]], ["tile_k", "sp", [-1, 4]], ["auto_unroll_max_step", "ot", 64], ["unroll_explicit", "ot", 1]]}, "result": [[0.00042903410285714285], 0, 1.580336332321167, 1595429887.4340758], "version": 0.2, "tvm_version": "0.7.dev1"}
{"input": ["cuda -keys=cuda,gpu -max_num_threads=1024 -thread_warp_size=32", "batch_matmul.cuda", [["TENSOR", [1, 1, 512], "float32"], ["TENSOR", [1, 16384, 512], "float32"]], {}], "config": {"index": 1458, "code_hash": null, "entity": [["tile_y", "sp", [-1, 1, 1]], ["tile_x", "sp", [-1, 8, 2]], ["tile_k", "sp", [-1, 4]], ["auto_unroll_max_step", "ot", 16], ["unroll_explicit", "ot", 0]]}, "result": [[0.000435168280733945], 0, 1.7677910327911377, 1595429888.8644657], "version": 0.2, "tvm_version": "0.7.dev1"}
{"input": ["cuda -keys=cuda,gpu -max_num_threads=1024 -thread_warp_size=32", "batch_matmul.cuda", [["TENSOR", [1, 1, 512], "float32"], ["TENSOR", [1, 16384, 512], "float32"]], {}], "config": {"index": 7562, "code_hash": null, "entity": [["tile_y", "sp", [-1, 1, 1]], ["tile_x", "sp", [-1, 4, 1]], ["tile_k", "sp", [-1, 8]], ["auto_unroll_max_step", "ot", 32], ["unroll_explicit", "ot", 1]]}, "result": [[0.0003701090292307692], 0, 1.8076698780059814, 1595429890.2984881], "version": 0.2, "tvm_version": "0.7.dev1"}
{"input": ["cuda -keys=cuda,gpu -max_num_threads=1024 -thread_warp_size=32", "batch_matmul.cuda", [["TENSOR", [1, 1, 512], "float32"], ["TENSOR", [1, 16384, 512], "float32"]], {}], "config": {"index": 7442, "code_hash": null, "entity": [["tile_y", "sp", [-1, 1, 1]], ["tile_x", "sp", [-1, 4, 1]], ["tile_k", "sp", [-1, 4]], ["auto_unroll_max_step", "ot", 32], ["unroll_explicit", "ot", 1]]}, "result": [[0.0003097250296391753], 0, 1.8589725494384766, 1595429891.826913], "version": 0.2, "tvm_version": "0.7.dev1"}
{"input": ["cuda -keys=cuda,gpu -max_num_threads=1024 -thread_warp_size=32", "batch_matmul.cuda", [["TENSOR", [1, 1, 512], "float32"], ["TENSOR", [1, 16384, 512], "float32"]], {}], "config": {"index": 2657, "code_hash": null, "entity": [["tile_y", "sp", [-1, 1, 1]], ["tile_x", "sp", [-1, 4, 2]], ["tile_k", "sp", [-1, 4]], ["auto_unroll_max_step", "ot", 32], ["unroll_explicit", "ot", 0]]}, "result": [[0.00042315844507042255], 0, 1.4293980598449707, 1595429892.9450488], "version": 0.2, "tvm_version": "0.7.dev1"}
{"input": ["cuda -keys=cuda,gpu -max_num_threads=1024 -thread_warp_size=32", "batch_matmul.cuda", [["TENSOR", [1, 1, 512], "float32"], ["TENSOR", [1, 16384, 512], "float32"]], {}], "config": {"index": 7458, "code_hash": null, "entity": [["tile_y", "sp", [-1, 1, 1]], ["tile_x", "sp", [-1, 8, 2]], ["tile_k", "sp", [-1, 4]], ["auto_unroll_max_step", "ot", 32], ["unroll_explicit", "ot", 1]]}, "result": [[0.0004696463816046967], 0, 1.7728757858276367, 1595429894.3855553], "version": 0.2, "tvm_version": "0.7.dev1"}
{"input": ["cuda -keys=cuda,gpu -max_num_threads=1024 -thread_warp_size=32", "batch_matmul.cuda", [["TENSOR", [1, 1, 512], "float32"], ["TENSOR", [1, 16384, 512], "float32"]], {}], "config": {"index": 4923, "code_hash": null, "entity": [["tile_y", "sp", [-1, 1, 1]], ["tile_x", "sp", [-1, 8, 1]], ["tile_k", "sp", [-1, 2]], ["auto_unroll_max_step", "ot", 8], ["unroll_explicit", "ot", 1]]}, "result": [[0.0005102888400852878], 0, 1.7657675743103027, 1595429895.8228188], "version": 0.2, "tvm_version": "0.7.dev1"}
{"input": ["cuda -keys=cuda,gpu -max_num_threads=1024 -thread_warp_size=32", "batch_matmul.cuda", [["TENSOR", [1, 1, 512], "float32"], ["TENSOR", [1, 16384, 512], "float32"]], {}], "config": {"index": 8914, "code_hash": null, "entity": [["tile_y", "sp", [-1, 1, 1]], ["tile_x", "sp", [-1, 32, 4]], ["tile_k", "sp", [-1, 16]], ["auto_unroll_max_step", "ot", 64], ["unroll_explicit", "ot", 1]]}, "result": [[0.0002560843782051282], 0, 1.8260111808776855, 1595429897.376173], "version": 0.2, "tvm_version": "0.7.dev1"}
{"input": ["cuda -keys=cuda,gpu -max_num_threads=1024 -thread_warp_size=32", "batch_matmul.cuda", [["TENSOR", [1, 1, 512], "float32"], ["TENSOR", [1, 16384, 512], "float32"]], {}], "config": {"index": 2298, "code_hash": null, "entity": [["tile_y", "sp", [-1, 1, 1]], ["tile_x", "sp", [-1, 8, 2]], ["tile_k", "sp", [-1, 512]], ["auto_unroll_max_step", "ot", 16], ["unroll_explicit", "ot", 0]]}, "result": [[0.00045001845215759847], 0, 1.7472429275512695, 1595429898.8827782], "version": 0.2, "tvm_version": "0.7.dev1"}
{"input": ["cuda -keys=cuda,gpu -max_num_threads=1024 -thread_warp_size=32", "batch_matmul.cuda", [["TENSOR", [1, 1, 512], "float32"], ["TENSOR", [1, 16384, 512], "float32"]], {}], "config": {"index": 1280, "code_hash": null, "entity": [["tile_y", "sp", [-1, 1, 1]], ["tile_x", "sp", [-1, 32, 64]], ["tile_k", "sp", [-1, 1]], ["auto_unroll_max_step", "ot", 16], ["unroll_explicit", "ot", 0]]}, "result": [[0.0670500135], 0, 1.800729751586914, 1595429900.5752177], "version": 0.2, "tvm_version": "0.7.dev1"}
{"input": ["cuda -keys=cuda,gpu -max_num_threads=1024 -thread_warp_size=32", "batch_matmul.cuda", [["TENSOR", [1, 1, 512], "float32"], ["TENSOR", [1, 16384, 512], "float32"]], {}], "config": {"index": 5526, "code_hash": null, "entity": [["tile_y", "sp", [-1, 1, 1]], ["tile_x", "sp", [-1, 64, 1]], ["tile_k", "sp", [-1, 64]], ["auto_unroll_max_step", "ot", 8], ["unroll_explicit", "ot", 1]]}, "result": [[9.613239081004263e-05], 0, 1.6698064804077148, 1595429912.9692566], "version": 0.2, "tvm_version": "0.7.dev1"}
{"input": ["cuda -keys=cuda,gpu -max_num_threads=1024 -thread_warp_size=32", "batch_matmul.cuda", [["TENSOR", [1, 1, 512], "float32"], ["TENSOR", [1, 16384, 512], "float32"]], {}], "config": {"index": 6605, "code_hash": null, "entity": [["tile_y", "sp", [-1, 1, 1]], ["tile_x", "sp", [-1, 32, 1]], ["tile_k", "sp", [-1, 32]], ["auto_unroll_max_step", "ot", 16], ["unroll_explicit", "ot", 1]]}, "result": [[8.904638635014837e-05], 0, 1.7715892791748047, 1595429914.2909288], "version": 0.2, "tvm_version": "0.7.dev1"}
{"input": ["cuda -keys=cuda,gpu -max_num_threads=1024 -thread_warp_size=32", "batch_matmul.cuda", [["TENSOR", [1, 1, 512], "float32"], ["TENSOR", [1, 16384, 512], "float32"]], {}], "config": {"index": 5405, "code_hash": null, "entity": [["tile_y", "sp", [-1, 1, 1]], ["tile_x", "sp", [-1, 32, 1]], ["tile_k", "sp", [-1, 32]], ["auto_unroll_max_step", "ot", 8], ["unroll_explicit", "ot", 1]]}, "result": [[8.838542495344507e-05], 0, 1.9731993675231934, 1595429915.9274762], "version": 0.2, "tvm_version": "0.7.dev1"}
{"input": ["cuda -keys=cuda,gpu -max_num_threads=1024 -thread_warp_size=32", "batch_matmul.cuda", [["TENSOR", [1, 1, 512], "float32"], ["TENSOR", [1, 16384, 512], "float32"]], {}], "config": {"index": 6726, "code_hash": null, "entity": [["tile_y", "sp", [-1, 1, 1]], ["tile_x", "sp", [-1, 64, 1]], ["tile_k", "sp", [-1, 64]], ["auto_unroll_max_step", "ot", 16], ["unroll_explicit", "ot", 1]]}, "result": [[9.386776794582392e-05], 0, 1.7394707202911377, 1595429917.2483602], "version": 0.2, "tvm_version": "0.7.dev1"}
{"input": ["cuda -keys=cuda,gpu -max_num_threads=1024 -thread_warp_size=32", "batch_matmul.cuda", [["TENSOR", [1, 1, 512], "float32"], ["TENSOR", [1, 16384, 512], "float32"]], {}], "config": {"index": 7083, "code_hash": null, "entity": [["tile_y", "sp", [-1, 1, 1]], ["tile_x", "sp", [-1, 8, 1]], ["tile_k", "sp", [-1, 512]], ["auto_unroll_max_step", "ot", 16], ["unroll_explicit", "ot", 1]]}, "result": [[0.0002275279338446788], 0, 1.9272949695587158, 1595429918.763002], "version": 0.2, "tvm_version": "0.7.dev1"}
{"input": ["cuda -keys=cuda,gpu -max_num_threads=1024 -thread_warp_size=32", "batch_matmul.cuda", [["TENSOR", [1, 1, 512], "float32"], ["TENSOR", [1, 16384, 512], "float32"]], {}], "config": {"index": 6723, "code_hash": null, "entity": [["tile_y", "sp", [-1, 1, 1]], ["tile_x", "sp", [-1, 8, 1]], ["tile_k", "sp", [-1, 64]], ["auto_unroll_max_step", "ot", 16], ["unroll_explicit", "ot", 1]]}, "result": [[0.00013444333550681684], 0, 1.816082239151001, 1595429920.1707537], "version": 0.2, "tvm_version": "0.7.dev1"}
{"input": ["cuda -keys=cuda,gpu -max_num_threads=1024 -thread_warp_size=32", "batch_matmul.cuda", [["TENSOR", [1, 1, 512], "float32"], ["TENSOR", [1, 16384, 512], "float32"]], {}], "config": {"index": 6725, "code_hash": null, "entity": [["tile_y", "sp", [-1, 1, 1]], ["tile_x", "sp", [-1, 32, 1]], ["tile_k", "sp", [-1, 64]], ["auto_unroll_max_step", "ot", 16], ["unroll_explicit", "ot", 1]]}, "result": [[9.70093528468324e-05], 0, 1.8920814990997314, 1595429921.682834], "version": 0.2, "tvm_version": "0.7.dev1"}
{"input": ["cuda -keys=cuda,gpu -max_num_threads=1024 -thread_warp_size=32", "batch_matmul.cuda", [["TENSOR", [1, 1, 512], "float32"], ["TENSOR", [1, 16384, 512], "float32"]], {}], "config": {"index": 5525, "code_hash": null, "entity": [["tile_y", "sp", [-1, 1, 1]], ["tile_x", "sp", [-1, 32, 1]], ["tile_k", "sp", [-1, 64]], ["auto_unroll_max_step", "ot", 8], ["unroll_explicit", "ot", 1]]}, "result": [[9.705867457305503e-05], 0, 1.7008159160614014, 1595429923.0047898], "version": 0.2, "tvm_version": "0.7.dev1"}
{"input": ["cuda -keys=cuda,gpu -max_num_threads=1024 -thread_warp_size=32", "batch_matmul.cuda", [["TENSOR", [1, 1, 512], "float32"], ["TENSOR", [1, 16384, 512], "float32"]], {}], "config": {"index": 5523, "code_hash": null, "entity": [["tile_y", "sp", [-1, 1, 1]], ["tile_x", "sp", [-1, 8, 1]], ["tile_k", "sp", [-1, 64]], ["auto_unroll_max_step", "ot", 8], ["unroll_explicit", "ot", 1]]}, "result": [[0.00013439682511923688], 0, 1.6319210529327393, 1595429924.194235], "version": 0.2, "tvm_version": "0.7.dev1"}
{"input": ["cuda -keys=cuda,gpu -max_num_threads=1024 -thread_warp_size=32", "batch_matmul.cuda", [["TENSOR", [1, 1, 512], "float32"], ["TENSOR", [1, 16384, 512], "float32"]], {}], "config": {"index": 5883, "code_hash": null, "entity": [["tile_y", "sp", [-1, 1, 1]], ["tile_x", "sp", [-1, 8, 1]], ["tile_k", "sp", [-1, 512]], ["auto_unroll_max_step", "ot", 8], ["unroll_explicit", "ot", 1]]}, "result": [[0.00022745995502392345], 0, 1.8510172367095947, 1595429925.735194], "version": 0.2, "tvm_version": "0.7.dev1"}
{"input": ["cuda -keys=cuda,gpu -max_num_threads=1024 -thread_warp_size=32", "batch_matmul.cuda", [["TENSOR", [1, 1, 512], "float32"], ["TENSOR", [1, 16384, 512], "float32"]], {}], "config": {"index": 6603, "code_hash": null, "entity": [["tile_y", "sp", [-1, 1, 1]], ["tile_x", "sp", [-1, 8, 1]], ["tile_k", "sp", [-1, 32]], ["auto_unroll_max_step", "ot", 16], ["unroll_explicit", "ot", 1]]}, "result": [[0.00013044105845980887], 0, 2.7226901054382324, 1595429928.1530616], "version": 0.2, "tvm_version": "0.7.dev1"}
{"input": ["cuda -keys=cuda,gpu -max_num_threads=1024 -thread_warp_size=32", "batch_matmul.cuda", [["TENSOR", [1, 1, 512], "float32"], ["TENSOR", [1, 16384, 512], "float32"]], {}], "config": {"index": 9483, "code_hash": null, "entity": [["tile_y", "sp", [-1, 1, 1]], ["tile_x", "sp", [-1, 8, 1]], ["tile_k", "sp", [-1, 512]], ["auto_unroll_max_step", "ot", 64], ["unroll_explicit", "ot", 1]]}, "result": [[0.00022827238712776177], 0, 1.9805827140808105, 1595429929.6616235], "version": 0.2, "tvm_version": "0.7.dev1"}
{"input": ["cuda -keys=cuda,gpu -max_num_threads=1024 -thread_warp_size=32", "batch_matmul.cuda", [["TENSOR", [1, 1, 512], "float32"], ["TENSOR", [1, 16384, 512], "float32"]], {}], "config": {"index": 5403, "code_hash": null, "entity": [["tile_y", "sp", [-1, 1, 1]], ["tile_x", "sp", [-1, 8, 1]], ["tile_k", "sp", [-1, 32]], ["auto_unroll_max_step", "ot", 8], ["unroll_explicit", "ot", 1]]}, "result": [[0.00013041470639032815], 0, 1.7373793125152588, 1595429931.059922], "version": 0.2, "tvm_version": "0.7.dev1"}
{"input": ["cuda -keys=cuda,gpu -max_num_threads=1024 -thread_warp_size=32", "batch_matmul.cuda", [["TENSOR", [1, 1, 512], "float32"], ["TENSOR", [1, 16384, 512], "float32"]], {}], "config": {"index": 6963, "code_hash": null, "entity": [["tile_y", "sp", [-1, 1, 1]], ["tile_x", "sp", [-1, 8, 1]], ["tile_k", "sp", [-1, 256]], ["auto_unroll_max_step", "ot", 16], ["unroll_explicit", "ot", 1]]}, "result": [[0.00015394925178919975], 0, 1.8528509140014648, 1595429932.5751953], "version": 0.2, "tvm_version": "0.7.dev1"}
{"input": ["cuda -keys=cuda,gpu -max_num_threads=1024 -thread_warp_size=32", "batch_matmul.cuda", [["TENSOR", [1, 1, 512], "float32"], ["TENSOR", [1, 16384, 512], "float32"]], {}], "config": {"index": 5763, "code_hash": null, "entity": [["tile_y", "sp", [-1, 1, 1]], ["tile_x", "sp", [-1, 8, 1]], ["tile_k", "sp", [-1, 256]], ["auto_unroll_max_step", "ot", 8], ["unroll_explicit", "ot", 1]]}, "result": [[0.00015397406266490766], 0, 1.8724000453948975, 1595429934.0417156], "version": 0.2, "tvm_version": "0.7.dev1"}
{"input": ["cuda -keys=cuda,gpu -max_num_threads=1024 -thread_warp_size=32", "batch_matmul.cuda", [["TENSOR", [1, 1, 512], "float32"], ["TENSOR", [1, 16384, 512], "float32"]], {}], "config": {"index": 9005, "code_hash": null, "entity": [["tile_y", "sp", [-1, 1, 1]], ["tile_x", "sp", [-1, 32, 1]], ["tile_k", "sp", [-1, 32]], ["auto_unroll_max_step", "ot", 64], ["unroll_explicit", "ot", 1]]}, "result": [[9.161757150025088e-05], 0, 1.5670263767242432, 1595429935.27973], "version": 0.2, "tvm_version": "0.7.dev1"}
{"input": ["cuda -keys=cuda,gpu -max_num_threads=1024 -thread_warp_size=32", "batch_matmul.cuda", [["TENSOR", [1, 1, 512], "float32"], ["TENSOR", [1, 16384, 512], "float32"]], {}], "config": {"index": 9123, "code_hash": null, "entity": [["tile_y", "sp", [-1, 1, 1]], ["tile_x", "sp", [-1, 8, 1]], ["tile_k", "sp", [-1, 64]], ["auto_unroll_max_step", "ot", 64], ["unroll_explicit", "ot", 1]]}, "result": [[0.00012899456142433235], 0, 1.918428897857666, 1595429936.7669077], "version": 0.2, "tvm_version": "0.7.dev1"}
{"input": ["cuda -keys=cuda,gpu -max_num_threads=1024 -thread_warp_size=32", "batch_matmul.cuda", [["TENSOR", [1, 1, 512], "float32"], ["TENSOR", [1, 16384, 512], "float32"]], {}], "config": {"index": 7805, "code_hash": null, "entity": [["tile_y", "sp", [-1, 1, 1]], ["tile_x", "sp", [-1, 32, 1]], ["tile_k", "sp", [-1, 32]], ["auto_unroll_max_step", "ot", 32], ["unroll_explicit", "ot", 1]]}, "result": [[9.09147869285984e-05], 0, 1.8772602081298828, 1595429938.1420164], "version": 0.2, "tvm_version": "0.7.dev1"}
{"input": ["cuda -keys=cuda,gpu -max_num_threads=1024 -thread_warp_size=32", "batch_matmul.cuda", [["TENSOR", [1, 1, 512], "float32"], ["TENSOR", [1, 16384, 512], "float32"]], {}], "config": {"index": 8283, "code_hash": null, "entity": [["tile_y", "sp", [-1, 1, 1]], ["tile_x", "sp", [-1, 8, 1]], ["tile_k", "sp", [-1, 512]], ["auto_unroll_max_step", "ot", 32], ["unroll_explicit", "ot", 1]]}, "result": [[0.00022744430473372782], 0, 1.8738296031951904, 1595429939.5551524], "version": 0.2, "tvm_version": "0.7.dev1"}
{"input": ["cuda -keys=cuda,gpu -max_num_threads=1024 -thread_warp_size=32", "batch_matmul.cuda", [["TENSOR", [1, 1, 512], "float32"], ["TENSOR", [1, 16384, 512], "float32"]], {}], "config": {"index": 9006, "code_hash": null, "entity": [["tile_y", "sp", [-1, 1, 1]], ["tile_x", "sp", [-1, 64, 1]], ["tile_k", "sp", [-1, 32]], ["auto_unroll_max_step", "ot", 64], ["unroll_explicit", "ot", 1]]}, "result": [[9.738181609195402e-05], 0, 1.7997522354125977, 1595429940.856364], "version": 0.2, "tvm_version": "0.7.dev1"}
{"input": ["cuda -keys=cuda,gpu -max_num_threads=1024 -thread_warp_size=32", "batch_matmul.cuda", [["TENSOR", [1, 1, 512], "float32"], ["TENSOR", [1, 16384, 512], "float32"]], {}], "config": {"index": 9126, "code_hash": null, "entity": [["tile_y", "sp", [-1, 1, 1]], ["tile_x", "sp", [-1, 64, 1]], ["tile_k", "sp", [-1, 64]], ["auto_unroll_max_step", "ot", 64], ["unroll_explicit", "ot", 1]]}, "result": [[9.644965086006507e-05], 0, 1.7768912315368652, 1595429942.1716933], "version": 0.2, "tvm_version": "0.7.dev1"}
{"input": ["cuda -keys=cuda,gpu -max_num_threads=1024 -thread_warp_size=32", "batch_matmul.cuda", [["TENSOR", [1, 1, 512], "float32"], ["TENSOR", [1, 16384, 512], "float32"]], {}], "config": {"index": 723, "code_hash": null, "entity": [["tile_y", "sp", [-1, 1, 1]], ["tile_x", "sp", [-1, 8, 1]], ["tile_k", "sp", [-1, 64]], ["auto_unroll_max_step", "ot", 8], ["unroll_explicit", "ot", 0]]}, "result": [[0.00013443895731707318], 0, 1.8212335109710693, 1595429943.6296105], "version": 0.2, "tvm_version": "0.7.dev1"}
{"input": ["cuda -keys=cuda,gpu -max_num_threads=1024 -thread_warp_size=32", "batch_matmul.cuda", [["TENSOR", [1, 1, 512], "float32"], ["TENSOR", [1, 16384, 512], "float32"]], {}], "config": {"index": 7923, "code_hash": null, "entity": [["tile_y", "sp", [-1, 1, 1]], ["tile_x", "sp", [-1, 8, 1]], ["tile_k", "sp", [-1, 64]], ["auto_unroll_max_step", "ot", 32], ["unroll_explicit", "ot", 1]]}, "result": [[0.00013441233043981482], 0, 1.7931804656982422, 1595429945.0748894], "version": 0.2, "tvm_version": "0.7.dev1"}
{"input": ["cuda -keys=cuda,gpu -max_num_threads=1024 -thread_warp_size=32", "batch_matmul.cuda", [["TENSOR", [1, 1, 512], "float32"], ["TENSOR", [1, 16384, 512], "float32"]], {}], "config": {"index": 5406, "code_hash": null, "entity": [["tile_y", "sp", [-1, 1, 1]], ["tile_x", "sp", [-1, 64, 1]], ["tile_k", "sp", [-1, 32]], ["auto_unroll_max_step", "ot", 8], ["unroll_explicit", "ot", 1]]}, "result": [[0.0001139159206060606], 0, 1.5790379047393799, 1595429946.324481], "version": 0.2, "tvm_version": "0.7.dev1"}
{"input": ["cuda -keys=cuda,gpu -max_num_threads=1024 -thread_warp_size=32", "batch_matmul.cuda", [["TENSOR", [1, 1, 512], "float32"], ["TENSOR", [1, 16384, 512], "float32"]], {}], "config": {"index": 5645, "code_hash": null, "entity": [["tile_y", "sp", [-1, 1, 1]], ["tile_x", "sp", [-1, 32, 1]], ["tile_k", "sp", [-1, 128]], ["auto_unroll_max_step", "ot", 8], ["unroll_explicit", "ot", 1]]}, "result": [[9.811913620253165e-05], 0, 1.8013079166412354, 1595429947.7043872], "version": 0.2, "tvm_version": "0.7.dev1"}
{"input": ["cuda -keys=cuda,gpu -max_num_threads=1024 -thread_warp_size=32", "batch_matmul.cuda", [["TENSOR", [1, 1, 512], "float32"], ["TENSOR", [1, 16384, 512], "float32"]], {}], "config": {"index": 9003, "code_hash": null, "entity": [["tile_y", "sp", [-1, 1, 1]], ["tile_x", "sp", [-1, 8, 1]], ["tile_k", "sp", [-1, 32]], ["auto_unroll_max_step", "ot", 64], ["unroll_explicit", "ot", 1]]}, "result": [[0.00013041998041474654], 0, 1.8046281337738037, 1595429949.0976644], "version": 0.2, "tvm_version": "0.7.dev1"}
{"input": ["cuda -keys=cuda,gpu -max_num_threads=1024 -thread_warp_size=32", "batch_matmul.cuda", [["TENSOR", [1, 1, 512], "float32"], ["TENSOR", [1, 16384, 512], "float32"]], {}], "config": {"index": 7926, "code_hash": null, "entity": [["tile_y", "sp", [-1, 1, 1]], ["tile_x", "sp", [-1, 64, 1]], ["tile_k", "sp", [-1, 64]], ["auto_unroll_max_step", "ot", 32], ["unroll_explicit", "ot", 1]]}, "result": [[9.366466911404796e-05], 0, 1.6969964504241943, 1595429950.3763804], "version": 0.2, "tvm_version": "0.7.dev1"}
{"input": ["cuda -keys=cuda,gpu -max_num_threads=1024 -thread_warp_size=32", "batch_matmul.cuda", [["TENSOR", [1, 1, 512], "float32"], ["TENSOR", [1, 16384, 512], "float32"]], {}], "config": {"index": 9363, "code_hash": null, "entity": [["tile_y", "sp", [-1, 1, 1]], ["tile_x", "sp", [-1, 8, 1]], ["tile_k", "sp", [-1, 256]], ["auto_unroll_max_step", "ot", 64], ["unroll_explicit", "ot", 1]]}, "result": [[0.00015385916005291006], 0, 2.081984043121338, 1595429951.9455519], "version": 0.2, "tvm_version": "0.7.dev1"}
{"input": ["cuda -keys=cuda,gpu -max_num_threads=1024 -thread_warp_size=32", "batch_matmul.cuda", [["TENSOR", [1, 1, 512], "float32"], ["TENSOR", [1, 16384, 512], "float32"]], {}], "config": {"index": 7803, "code_hash": null, "entity": [["tile_y", "sp", [-1, 1, 1]], ["tile_x", "sp", [-1, 8, 1]], ["tile_k", "sp", [-1, 32]], ["auto_unroll_max_step", "ot", 32], ["unroll_explicit", "ot", 1]]}, "result": [[0.0001303820272189349], 0, 1.807311773300171, 1595429953.3431427], "version": 0.2, "tvm_version": "0.7.dev1"}
{"input": ["cuda -keys=cuda,gpu -max_num_threads=1024 -thread_warp_size=32", "batch_matmul.cuda", [["TENSOR", [1, 1, 512], "float32"], ["TENSOR", [1, 16384, 512], "float32"]], {}], "config": {"index": 6606, "code_hash": null, "entity": [["tile_y", "sp", [-1, 1, 1]], ["tile_x", "sp", [-1, 64, 1]], ["tile_k", "sp", [-1, 32]], ["auto_unroll_max_step", "ot", 16], ["unroll_explicit", "ot", 1]]}, "result": [[0.00011395175337597725], 0, 1.7387793064117432, 1595429954.592839], "version": 0.2, "tvm_version": "0.7.dev1"}
